,type,reference,price,district,street,area,plant,lift,parking,description
68,Flat,/en/inmueble/100769679/,"625,000€","['\n\n\n\n\n\n\nFlat in calle de Mallorca', "" La Nova Esquerra de l'Eixample"", ' Barcelona\n\n\n625', '000€\n\n\n635', '000 €\n\n2%\n\n\n\n3 bed.\n102 m²\n6th floor interior with lift\n\n\nFor sale', ' spectacular apartment on Mallorca street with Comte Borrell. The building', ' from 1976 with an area of 116 m2', ' and a 10m2 terrace. It has a comprehensive renovation with top quality materials.\nThe apartment is located on the sixth floor with an lift', ' facing the interior of the block patio']",calle de Mallorca,102 m²,6th,with lift,,"For sale, spectacular apartment on Mallorca street with Comte Borrell. The building, from 1976 with an area of 116 m2, and a 10m2 terrace. It has a comprehensive renovation with top quality materials.
The apartment is located on the sixth floor with an lift, facing the interior of the block patio,"
69,Flat,/en/inmueble/96197895/,"550,000€","['\n\nFlat in calle Balmes', "" L'Antiga Esquerra de l'Eixample"", ' Barcelona\n\n\n550', '000€\n\n\n4 bed.\n110 m²\n2nd floor exterior with lift\n\n\nNext to l’Avinguda Diagonal and the emblematic Enric Granados street', ' surrounded by services and local shops and very well connected by public transport']",calle Balmes,110 m²,2nd,with lift,,"Next to l’Avinguda Diagonal and the emblematic Enric Granados street, surrounded by services and local shops and very well connected by public transport, we find this fantastic 110 m² apartment to reform outside with two winds. The house is located on the second floor of a beautiful royal estate fro"
70,Penthouse,/en/inmueble/101269695/,"387,000€","['\n\nPenthouse in calle de Sòcrates', ' Sant Andreu', ' Barcelona\n\n\n387', '000€\n\n\n3 bed.\n105 m²\n6th floor exterior with lift\n\n\nBeautiful penthouse near the Meridiana', ' 05 minutes walk from the Fabra i Puig Metro stop and the Can Dragó Park.\nIt consists of 105m2 built', ' 75 useful meters', ' distributed in 2 Double Bedrooms', ' 1 single', ' living room with access to the main terrace', ' kitchen']",calle de Sòcrates,105 m²,6th,with lift,,"Beautiful penthouse near the Meridiana, 05 minutes walk from the Fabra i Puig Metro stop and the Can Dragó Park.
It consists of 105m2 built, 75 useful meters, distributed in 2 Double Bedrooms, 1 single, living room with access to the main terrace, kitchen, 4-piece bathroom with bathtub
Sixth floor i"
71,Duplex,/en/inmueble/98680408/,"1,690,000€","['\n\n\n\n\n\n\nDuplex in La Barceloneta', ' Barcelona\n\n\n1', '690', '000€\n\n\n1', '790']",La Barceloneta,111 m²,1st,without lift,,"ONLY BRAND NEW PROPERTY ON THE FIRST LINE OF THE SEA IN BARCELONA!
""IAS Real Estate presents this exclusive brand new property on the seafront.
It has a living area of 67m2 and an impressive 40m2 terrace facing the sea. The house is distributed in a spacious living-dining room with an open kitchen"
72,Detached,/en/inmueble/101586658/,"265,000€","['\n\n\n\n\n\n\nDetached house in calle de Pedrell', "" La Font d'En Fargues"", ' Barcelona\n\n\n265', '000€\n\n\n3 bed.\n152 m²\n\n\nAre you looking for a cozy place to call home? This beautiful house of 152 m2 built', ' of which 70 are useful', "" is perfect for you! Located in the residential area La Font d'en Fargues""]",calle de Pedrell,152 m²,,,,"Are you looking for a cozy place to call home? This beautiful house of 152 m2 built, of which 70 are useful, is perfect for you! Located in the residential area La Font d'en Fargues, this property has a spacious bright living room that invites you to relax. Imagine enjoying the sun from its large 42"
73,Flat,/en/inmueble/90463250/,"475,000€","[""\n\nFlat in calle d'Aribau"", "" L'Antiga Esquerra de l'Eixample"", ' Barcelona\n\n\n475', '000€\n\n\n5 bed.\n110 m²\n1st floor exterior with lift\n\n\nC / Aribau! 110 m2 apartment', ' functional and very comfortable']",calle d'Aribau,110 m²,1st,with lift,,"C / Aribau! 110 m2 apartment, functional and very comfortable, both for a family or to share.
Distributed in 5 bedrooms (4 doubles and 1 single) + a dressing room.
Kitchen.
Bathroom + courtesy toilet.
Outside dining room with access to terrace.
Elevator.
With all services within reach.
Alarm."
74,Flat,/en/inmueble/101602854/,"159,000€","['\n\n\n\n\n\n\nFlat in calle de Rosés', ' Sants', ' Barcelona\n\n\n159', '000€\n\n\n3 bed.\n51 m²\nGround floor interior with lift\n\n\nLA CASA AGENCY PRESENTS EXCLUSIVELY! :\nGROUND FLOOR TO REFORM\nLocated in the Sants area']",calle de Rosés,51 m²,Ground,with lift,,"LA CASA AGENCY PRESENTS EXCLUSIVELY! :
GROUND FLOOR TO REFORM
Located in the Sants area, very close to Avenida Madrid.
Sants is a neighborhood of Barcelona located in the southern part of the city. It belongs to the district of Sants-Montjuic and borders the Barcelona districts of Ensanche to the"
75,Flat,/en/inmueble/101608256/,"750,000€","['\n\n\n\n\n\n\nFlat in calle de Badajoz', ' El Poblenou', ' Barcelona\n\n\n750', '000€\n\n\n3 bed.\n148 m²\nGround floor exterior without lift\n\n\nEl Poblenou - Charming duplex', ' 5 minutes from the beach.\nSpectacular renovated ground floor maintaining the character of the old buildings', ' such as the high ceilings', ' the restored wooden beams and the Catalan volta.It retains a large access door that']",calle de Badajoz,148 m²,Ground,without lift,,"El Poblenou - Charming duplex, 5 minutes from the beach.
Spectacular renovated ground floor maintaining the character of the old buildings, such as the high ceilings, the restored wooden beams and the Catalan volta.It retains a large access door that, together with the interior patio for private use"
76,Penthouse,/en/inmueble/101319745/,"545,000€","['\n\n\n\n\n\n\nPenthouse in El Poblenou', ' Barcelona\n\n\n545', '000€\n\n\n2 bed.\n72 m²\n5th floor exterior with lift\n\n\nMagnificent south facing penthouse next to Rambla Poblenou', ' with large communal area.\nThe property has a built area of 72sqm', ' distributed in 2 bedrooms with built-in wardrobe', ' 1 complete bathroom with bathtub', ' the kitchen next to the hall where there is a built-in wardrobe']",El Poblenou,72 m²,5th,with lift,,"Magnificent south facing penthouse next to Rambla Poblenou, with large communal area.
The property has a built area of 72sqm, distributed in 2 bedrooms with built-in wardrobe, 1 complete bathroom with bathtub, the kitchen next to the hall where there is a built-in wardrobe, and the living-dining ro"
77,Flat,/en/inmueble/101591613/,"1,428,000€","['\n\n\n\n\n\n\nFlat in calle de Pau Claris', "" La Dreta de l'Eixample"", ' Barcelona\n\n\n1', '428', '000€\n\n\n3 bed.\n164 m²\n2nd floor exterior with lift\n\n\nNew construction apartment for sale in Eixample Dreta', "" Barcelona\nMagnificent new construction apartment located in the Quadrat d'or of the Eixample of Barcelona and a few meters from Paseo de Gracia""]",calle de Pau Claris,164 m²,2nd,with lift,,"New construction apartment for sale in Eixample Dreta, Barcelona
Magnificent new construction apartment located in the Quadrat d'or of the Eixample of Barcelona and a few meters from Paseo de Gracia, one of the most luxurious areas of the city.
It consists of 164 m² built distributed in 158m² of h"
78,Flat,/en/inmueble/100488558/,"650,000€","['\n\n\n\n\n\n\nFlat in El Gòtic', ' Barcelona\n\n\n650', '000€\n\n\n4 bed.\n187 m²\n3rd floor exterior without lift\n\n\nCasc Antic BCN presents this fabulous corner apartment in the Gothic Quarter of Barcelona.\nOriented to the northeast with unobstructed views of the emblematic Regomir square', ' completely exterior we find this apartment of 176 meters built.\nThe apartment consists of three parts']",El Gòtic,187 m²,3rd,without lift,,"Casc Antic BCN presents this fabulous corner apartment in the Gothic Quarter of Barcelona.
Oriented to the northeast with unobstructed views of the emblematic Regomir square, completely exterior we find this apartment of 176 meters built.
The apartment consists of three parts, a very spacious apartm"
79,Flat,/en/inmueble/91841904/,"350,000€","['\n\n\n\n\n\n\nFlat in La Maternitat i Sant Ramon', ' Barcelona\n\n\n350', '000€\n\n\n3 bed.\n80 m²\n1st floor exterior without lift\n\n\n70 m2 apartment totally exterior and with natural light (none of the units overlooks a closed patio', ' all the units are exterior and with natural light). Building without elevator.\nIn the day area', ' the house has a living room with access to a balcony', ' an outdoor and equipped kitchen']",La Maternitat i Sant Ramon,80 m²,1st,without lift,,"70 m2 apartment totally exterior and with natural light (none of the units overlooks a closed patio, all the units are exterior and with natural light). Building without elevator.
In the day area, the house has a living room with access to a balcony, an outdoor and equipped kitchen, with an inductio"
80,Flat,/en/inmueble/100720081/,"879,000€","['\n\n\n\n\n\n\nFlat in Les Tres Torres', ' Barcelona\n\n\n879', '000€\nParking included\n\n\n5 bed.\n160 m²\n2nd floor exterior with lift\n\n\n160m2 house in Tres Torres.\nNext to the Mercat de Tres Torres.\nIt has 145m2 plus a 15m2 terrace.\nTotally exterior', ' southwest orientation.\nLiving room with access to terrace.\nFive rooms. One en suite']",Les Tres Torres,160 m²,2nd,with lift,Parking included,"160m2 house in Tres Torres.
Next to the Mercat de Tres Torres.
It has 145m2 plus a 15m2 terrace.
Totally exterior, southwest orientation.
Living room with access to terrace.
Five rooms. One en suite, three doubles and one single.
The rooms are spacious and quiet.
Two bathrooms.
Kitchen with separate"
81,Flat,/en/inmueble/100763495/,"399,000€","[""\n\n\n\n\n\n\nFlat in L'Antiga Esquerra de l'Eixample"", ' Barcelona\n\n\n399', '000€\n\n\n4 bed.\n100 m²\n2nd floor exterior with lift\n\n\nOn Villarroel street', ' above the Barcelona Clinical Hospital', ' in one of the most popular neighborhoods in the city', ' surrounded by schools', ' services', ' parks', ' a shopping center', ' shops... This 100m2 apartment', ' 4 bedrooms', ' 1 bathroom with the possibility of a second bathroom', ' kitchen']",L'Antiga Esquerra de l'Eixample,100 m²,2nd,with lift,,"On Villarroel street, above the Barcelona Clinical Hospital, in one of the most popular neighborhoods in the city, surrounded by schools, services, parks, a shopping center, shops... This 100m2 apartment, 4 bedrooms, 1 bathroom with the possibility of a second bathroom, kitchen, and living room. Bri"
82,Flat,/en/inmueble/101592497/,"270,000€","['\n\n\n\n\n\n\nFlat in El Gòtic', ' Barcelona\n\n\n270', '000€\n\n\n2 bed.\n62 m²\n1st floor exterior without lift\n\n\nExcellent property near Plaça Sant Jaume\nEngel and Völkers presents this excellent property in a small community near Barcelona City Hall.\nThis corner building offers several windows with balconies to Ferran Street. The future owners', ' most probably']",El Gòtic,62 m²,1st,without lift,,"Excellent property near Plaça Sant Jaume
Engel and Völkers presents this excellent property in a small community near Barcelona City Hall.
This corner building offers several windows with balconies to Ferran Street. The future owners, most probably, will want to update the decoration and some instal"
83,Flat,/en/inmueble/100762006/,"655,000€","['\n\n\n\n\n\n\nFlat in calle de Provença', "" La Dreta de l'Eixample"", ' Barcelona\n\n\n655', '000€\n\n\n695', '000 €\n\n6%\n\n\n\n2 bed.\n84 m²\n3rd floor exterior with lift\n\n\nProperty located in the heart of Eixample Dret\nEngel &Völkers presents this quite unique property']",calle de Provença,84 m²,3rd,with lift,,"Property located in the heart of Eixample Dret
Engel &Völkers presents this quite unique property, located at Provença Street one of the most sought-after streets in the Eixample and only a few minutes away from La Pedrera one of the most emblematic buildings in Barcelona.
This charming property is"
84,Flat,/en/inmueble/100990316/,"390,000€","['\n\n\n\n\n\n\nFlat in El Gòtic', ' Barcelona\n\n\n390', '000€\n\n\n395', ""000 €\n\n1%\n\n\n\n3 bed.\n105 m²\n exterior without lift\n\n\nApartment with original elements in the Gòtic\nFantastic apartment located between Portal de L'Ángel and Via Laietana in the upper part of the old town of Barcelona with an area of 105 m2. It consists of a hall"", ' 3 bedrooms', ' 2 living rooms']",El Gòtic,105 m²,,,,"Apartment with original elements in the Gòtic
Fantastic apartment located between Portal de L'Ángel and Via Laietana in the upper part of the old town of Barcelona with an area of 105 m2. It consists of a hall, 3 bedrooms, 2 living rooms, kitchen and 1 bathroom. With 3 balconies facing a quiet semi-"
85,Penthouse,/en/inmueble/98793896/,"574,000€","['\n\n\n\n\n\n\nPenthouse in Vila de Gràcia', ' Barcelona\n\n\n574', '000€\nGarage optional 25', '000 €\n\n\n2 bed.\n86 m²\n3rd floor exterior with lift\n\n\nLocated in a modern building', ' we find this cozy and cozy duplex penthouse of 86m built plus 20m of terrace.With completely clear views of the Iconic Tennis', ' La Salut and Tibidabo']",Vila de Gràcia,86 m²,3rd,with lift,"Garage optional 25,000 €","Located in a modern building, we find this cozy and cozy duplex penthouse of 86m built plus 20m of terrace.With completely clear views of the Iconic Tennis, La Salut and Tibidabo, very bright and with afternoon sun.
The house is very well preserved.It is distributed in a spacious and pleasant living"
86,Flat,/en/inmueble/100796897/,"1,550,000€","['\n\n\n\n\n\n\nFlat in Les Tres Torres', ' Barcelona\n\n\n1', '550', '000€\nParking included\n\n\n5 bed.\n281 m²\n1st floor exterior with lift\n\n\nSplendid apartment of 261 m2 built + 20 m2 of terraces', ' located in a beautiful building in the residential neighborhood of Tres Torres. The house stands out for its magnificent distribution']",Les Tres Torres,281 m²,1st,with lift,Parking included,"Splendid apartment of 261 m2 built + 20 m2 of terraces, located in a beautiful building in the residential neighborhood of Tres Torres. The house stands out for its magnificent distribution, and has all its exterior rooms with an excellent orientation to the West that gives the apartment clarity all"
87,Flat,/en/inmueble/99753412/,"690,000€","[""\n\n\n\n\n\n\nFlat in La Dreta de l'Eixample"", ' Barcelona\n\n\n690', '000€\n\n\n745', ""000 €\n\n7%\n\n\n\n4 bed.\n164 m²\n3rd floor exterior with lift\n\n\nHigh flat to refurbish in la Dreta de l'Eixample\nIt is a beautiful building built in 1900"", ' very well preserved and recently restored', "" which is located in the emblematic Quadrat d'Or in the Dreta de l'Eixample"", ' next to Passeig Sant Joan.\nThis flat has great potential to refurbish']",La Dreta de l'Eixample,164 m²,3rd,with lift,,"High flat to refurbish in la Dreta de l'Eixample
It is a beautiful building built in 1900, very well preserved and recently restored, which is located in the emblematic Quadrat d'Or in the Dreta de l'Eixample, next to Passeig Sant Joan.
This flat has great potential to refurbish, it partially preser"
88,Flat,/en/inmueble/100789141/,"870,000€","[""\n\n\n\n\n\n\nFlat in La Dreta de l'Eixample"", ' Barcelona\n\n\n870', '000€\n\n\n890', '000 €\n\n2%\n\n\n\n2 bed.\n123 m²\n4th floor exterior with lift\n\n\nRenovated apartment with community pool in Eixample\nRenovated apartment with community pool', ' gym', ' concierge and storage room in a premium area']",La Dreta de l'Eixample,123 m²,4th,with lift,,"Renovated apartment with community pool in Eixample
Renovated apartment with community pool, gym, concierge and storage room in a premium area, on Casp street.
Perfect as Pied a Terre or investment.
Housing in a stately modernist building completely rehabilitated in 2016 preserving elements of the"
89,Penthouse,/en/inmueble/101611743/,"428,000€","['\n\n\n\n\n\n\nPenthouse in calle de Lluçà', ' Nn', ' Les Corts', ' Barcelona\n\n\n428', '000€\n\n\n3 bed.\n80 m²\n5th floor exterior with lift\n\n\nExterior floor with balcony', ' on a 5th floor.\nIt has three bedrooms', ' two doubles and one single. A complete bathroom with shower and screen and ventilated with window. High-end kitchen equipped with oven', ' microwave', ' fridge', ' ceramic hob']",calle de Lluçà,80 m²,5th,with lift,,"Exterior floor with balcony, on a 5th floor.
It has three bedrooms, two doubles and one single. A complete bathroom with shower and screen and ventilated with window. High-end kitchen equipped with oven, microwave, fridge, ceramic hob, extractor hood and fully integrated dishwasher.
Reform with to"
90,Flat,/en/inmueble/101592497/,"270,000€","['\n\n\n\n\n\n\nFlat in El Gòtic', ' Barcelona\n\n\n270', '000€\n\n\n2 bed.\n62 m²\n1st floor exterior without lift\n\n\nExcellent property near Plaça Sant Jaume\nEngel and Völkers presents this excellent property in a small community near Barcelona City Hall.\nThis corner building offers several windows with balconies to Ferran Street. The future owners', ' most probably']",El Gòtic,62 m²,1st,without lift,,"Excellent property near Plaça Sant Jaume
Engel and Völkers presents this excellent property in a small community near Barcelona City Hall.
This corner building offers several windows with balconies to Ferran Street. The future owners, most probably, will want to update the decoration and some instal"
91,Penthouse,/en/inmueble/100057774/,"815,000€","['\n\n\n\n\n\n\nPenthouse in Gran Via de les Corts Catalanes', "" L'Antiga Esquerra de l'Eixample"", ' Barcelona\n\n\n815', '000€\n\n\n839']",Gran Via de les Corts Catalanes,170 m²,8th,with lift,,"Bright penthouse with terrace in Eixample
This bright penthouse ready to move in is located in a classic building in the centre of the Eixample Esquerra. It stands out for its enjoyable terrace with panoramic views and good orientation.
The property has a rectangular layout with 160sqm with double o"
92,Flat,/en/inmueble/99753412/,"690,000€","[""\n\n\n\n\n\n\nFlat in La Dreta de l'Eixample"", ' Barcelona\n\n\n690', '000€\n\n\n745', ""000 €\n\n7%\n\n\n\n4 bed.\n164 m²\n3rd floor exterior with lift\n\n\nHigh flat to refurbish in la Dreta de l'Eixample\nIt is a beautiful building built in 1900"", ' very well preserved and recently restored', "" which is located in the emblematic Quadrat d'Or in the Dreta de l'Eixample"", ' next to Passeig Sant Joan.\nThis flat has great potential to refurbish']",La Dreta de l'Eixample,164 m²,3rd,with lift,,"High flat to refurbish in la Dreta de l'Eixample
It is a beautiful building built in 1900, very well preserved and recently restored, which is located in the emblematic Quadrat d'Or in the Dreta de l'Eixample, next to Passeig Sant Joan.
This flat has great potential to refurbish, it partially preser"
93,Flat,/en/inmueble/100796897/,"1,550,000€","['\n\n\n\n\n\n\nFlat in Les Tres Torres', ' Barcelona\n\n\n1', '550', '000€\nParking included\n\n\n5 bed.\n281 m²\n1st floor exterior with lift\n\n\nSplendid apartment of 261 m2 built + 20 m2 of terraces', ' located in a beautiful building in the residential neighborhood of Tres Torres. The house stands out for its magnificent distribution']",Les Tres Torres,281 m²,1st,with lift,Parking included,"Splendid apartment of 261 m2 built + 20 m2 of terraces, located in a beautiful building in the residential neighborhood of Tres Torres. The house stands out for its magnificent distribution, and has all its exterior rooms with an excellent orientation to the West that gives the apartment clarity all"
94,Flat,/en/inmueble/100720081/,"879,000€","['\n\n\n\n\n\n\nFlat in Les Tres Torres', ' Barcelona\n\n\n879', '000€\nParking included\n\n\n5 bed.\n160 m²\n2nd floor exterior with lift\n\n\n160m2 house in Tres Torres.\nNext to the Mercat de Tres Torres.\nIt has 145m2 plus a 15m2 terrace.\nTotally exterior', ' southwest orientation.\nLiving room with access to terrace.\nFive rooms. One en suite']",Les Tres Torres,160 m²,2nd,with lift,Parking included,"160m2 house in Tres Torres.
Next to the Mercat de Tres Torres.
It has 145m2 plus a 15m2 terrace.
Totally exterior, southwest orientation.
Living room with access to terrace.
Five rooms. One en suite, three doubles and one single.
The rooms are spacious and quiet.
Two bathrooms.
Kitchen with separate"
95,Flat,/en/inmueble/101464952/,"259,000€","['\n\n\n\n\n\n\nFlat in calle de Cartellà', ' Vilapicina i la Torre Llobeta', ' Barcelona\n\n\n259', '000€\n\n\n4 bed.\n95 m²\n4th floor exterior with lift\n\n\nFantastic opportunity!\napartment with 4 exterior rooms in cartellà street\nhouse of 95m built']",calle de Cartellà,95 m²,4th,with lift,,"Fantastic opportunity!
apartment with 4 exterior rooms in cartellà street
house of 95m built, has:
4 exterior rooms (2 doubles and 2 singles)
1 bathroom (with the possibility of making a 2nd bathroom)
outside balcony
4th floor with elevator
farm with the last favorable ite
Contact now to schedu"
96,Flat,/en/inmueble/99475987/,"1,690,000€","['\n\n\n\n\n\n\nFlat in calle del Bon Pastor', ' Sant Gervasi - Galvany', ' Barcelona\n\n\n1', '690', '000€\n\n\n4 bed.\n266 m²\n4th floor exterior with lift\n\n\nApartment for sale on Avenida Diagonal\nIn the heart of Avenida Diagonal', ' located in one of the most exclusive and noble areas of the city of Barcelona', ' we find this excellent home for sale']",calle del Bon Pastor,266 m²,4th,with lift,,"Apartment for sale on Avenida Diagonal
In the heart of Avenida Diagonal, located in one of the most exclusive and noble areas of the city of Barcelona, we find this excellent home for sale, on one of its upper floors of this luxurious royal estate.
It is a spectacular 266 m2 apartment in perfect co"
97,Flat,/en/inmueble/98680063/,"300,000€","['\n\n\n\n\n\n\nFlat in plaza Sagrada Família', ' La Sagrada Família', ' Barcelona\n\n\n300', '000€\n\n\n325']",plaza Sagrada Família,88 m²,,,,"Cozy apartment with views of the Sagrada Família
We present a cozy two-bedroom apartment with views of the Sagrada Família in a classic house from 1936. The apartment has a balcony facing the street that overlooks the Sagrada Família park. The bedrooms are double and the apartment is heated by natur"
98,Penthouse,/en/inmueble/101187702/,"645,000€","['\n\n\n\n\n\n\nPenthouse in Les Corts', ' Barcelona\n\n\n645', '000€\n\n\n695', '000 €\n\n7%\n\n\n\n4 bed.\n129 m²\n exterior with lift\n\n\nWonderful penthouse to reform with 2 terraces and 4 bedrooms\nEngel & Völkers presents a spectacular Penthouse to reform with 2 terraces and double orientation.\nLocated on Avenida de Madrid', ' this penthouse consists of 129m2 built and 116m2 habitable. In addition']",Les Corts,129 m²,,,,"Wonderful penthouse to reform with 2 terraces and 4 bedrooms
Engel & Völkers presents a spectacular Penthouse to reform with 2 terraces and double orientation.
Located on Avenida de Madrid, this penthouse consists of 129m2 built and 116m2 habitable. In addition, the two terraces add up to a total of"
99,Duplex,/en/inmueble/99713079/,"1,100,000€","['\n\n\n\n\n\n\nDuplex in Les Tres Torres', ' Barcelona\n\n\n1', '100', '000€\nParking included\n\n\n160 m²\n6th floor exterior with lift\n\n\n160m2 duplex penthouse to reform and fantastic 70m2 terrace.\nAll exterior', ' very bright', ' facing southwest.\nOn the attic floor we have a large 46m2 dining room.\nThe kitchen has a separate laundry room.\nTwo full bathrooms and a toilet.\nOne suite']",Les Tres Torres,6th floor exterior with lift,,,Parking included,"160m2 duplex penthouse to reform and fantastic 70m2 terrace.
All exterior, very bright, facing southwest.
On the attic floor we have a large 46m2 dining room.
The kitchen has a separate laundry room.
Two full bathrooms and a toilet.
One suite, two medium-sized double bedrooms and a service room.
Fro"
100,Flat,/en/inmueble/101619370/,"1,050,000€","[""\n\nFlat in L'Antiga Esquerra de l'Eixample"", ' Barcelona\n\n\n1', '050', '000€\n\n\n7 bed.\n295 m²\nGround floor exterior with lift\n\n\nLocated in the center of the eixample', ' in a building of 1.950', ' with elevator and concierge service.\nIt is a nice apartment of large dimensions']",L'Antiga Esquerra de l'Eixample,295 m²,Ground,with lift,,"Located in the center of the eixample, in a building of 1.950, with elevator and concierge service.
It is a nice apartment of large dimensions, with five double bedrooms and one single.
Kitchen with independent office.
Spacious living-dining room of about 70 m2.
Double facade to the street and inner"
101,Duplex,/en/inmueble/99349452/,"425,000€","['\n\n\n\n\n\n\nDuplex in La Barceloneta', ' Barcelona\n\n\n425', '000€\n\n\n430', '000 €\n\n1%\n\n\n\n3 bed.\n117 m²\n exterior without lift\n\n\nFamily duplex near the sea in Barceloneta\nWe present you this duplex of 117m2 fully equipped and in very good condition in one of the quietest streets of Barceloneta. Starting on the first floor we find a spacious and bright living room with terrace']",La Barceloneta,117 m²,,,,"Family duplex near the sea in Barceloneta
We present you this duplex of 117m2 fully equipped and in very good condition in one of the quietest streets of Barceloneta. Starting on the first floor we find a spacious and bright living room with terrace, a bathroom and a kitchen equipped with gallery fo"
