,type,reference,price,district,street,area,plant,lift,parking,description
135,Flat,/en/inmueble/101617932/,"847,500€","['\n\nFlat in Pelai', ' 10', ' El Raval', ' Barcelona\n\n\n847', '500€\n\n\n3 bed.\n163 m²\n4th floor exterior with lift\n\n\nABSTAIN AGENCIES', ' PLEASE.\nREAL PHOTOS', ' NOT A RENDER.""WORK FINISHED"".\nUnique 163 m2 apartment']",Pelai,163 m²,4th,with lift,,"ABSTAIN AGENCIES, PLEASE.
REAL PHOTOS, NOT A RENDER.""WORK FINISHED"".
Unique 163 m2 apartment, located in the heart of Barcelona in one of the most famous and representative streets and in a royal estate so typical and sought after in our city.
The apartment is completely renovated with luxury fin"
136,Flat,/en/inmueble/101610846/,"300,000€","['\n\n\n\n\n\n\nFlat in Ramon Albo', ' El Congrés i els Indians', ' Barcelona\n\n\n300', '000€\n\n\n3 bed.\n90 m²\n4th floor exterior with lift\n\n\nYOU ARE ALREADY MINE! ******************** FINANCE STAR PRODUCT\nWe enter and the first thing that surprises us is the light that reaches us to the entrance of the apartment. This beautiful oasis', ' without square meters lost in an endless corridor', ' with three rooms', ' two of them single and one double']",Ramon Albo,90 m²,4th,with lift,,"YOU ARE ALREADY MINE! ******************** FINANCE STAR PRODUCT
We enter and the first thing that surprises us is the light that reaches us to the entrance of the apartment. This beautiful oasis, without square meters lost in an endless corridor, with three rooms, two of them single and one double,"
137,Flat,/en/inmueble/101611342/,"750,000€","[""\n\n\n\n\n\n\nFlat in avenida d'Icària"", ' La Vila Olímpica del Poblenou', ' Barcelona\n\n\n750', '000€\n\n\n4 bed.\n165 m²\n2nd floor exterior with lift\n\n\nARE YOU GOING TO MISS IT? ************ FINADOR STAR PRODUCT\nMagnificent totally exterior apartment located on Av Icaria', ' one street from the Mapfre towers']",avenida d'Icària,165 m²,2nd,with lift,,"ARE YOU GOING TO MISS IT? ************ FINADOR STAR PRODUCT
Magnificent totally exterior apartment located on Av Icaria, one street from the Mapfre towers, Hotel Arts and Puerto Olimpico. It has a community garden and a parking space included in the price. As we enter the apartment we find the hall"
138,Flat,/en/inmueble/87294786/,"1,995,000€","['\n\n\n\n\n\n\nFlat in Sant Gervasi - Galvany', ' Barcelona\n\n\n1', '995', '000€\n\n\n6 bed.\n367 m²\n4th floor exterior with lift\n\n\nSpectacular apartment for sale in Via Augusta of 370 m² built with 30 m² of terrace is distributed with a hall at the entrance and to your right we find a very bright 60 m² dining room with access to the south-facing terrace. Office kitchen with large windows', ' which gives plenty of light']",Sant Gervasi - Galvany,367 m²,4th,with lift,,"Spectacular apartment for sale in Via Augusta of 370 m² built with 30 m² of terrace is distributed with a hall at the entrance and to your right we find a very bright 60 m² dining room with access to the south-facing terrace. Office kitchen with large windows, which gives plenty of light, dining roo"
139,Flat,/en/inmueble/101612766/,"405,000€","['\n\nFlat in callejón Varsovia', ' 137', ' El Guinardó', ' Barcelona\n\n\n405', '000€\n\n\n3 bed.\n93 m²\n2nd floor exterior with lift\n\n\nNEW CONSTRUCTION HOUSING with 3 bedrooms', ' 2 bathrooms and spectacular solarium terrace.\nLast home for sale next to the Hospital de Sant Pau', ' on Varsóvia street', ' in the heart of the Guinardó neighborhood.\nHousing on one floor', ' third real height']",callejón Varsovia,93 m²,2nd,with lift,,"NEW CONSTRUCTION HOUSING with 3 bedrooms, 2 bathrooms and spectacular solarium terrace.
Last home for sale next to the Hospital de Sant Pau, on Varsóvia street, in the heart of the Guinardó neighborhood.
Housing on one floor, third real height, facing the sea that enjoys light and sun practically"
140,Flat,/en/inmueble/97614928/,"965,000€","['\n\n\n\n\n\n\nFlat in Sant Gervasi - Galvany', ' Barcelona\n\n\n965', '000€\nParking included\n\n\n4 bed.\n290 m²\n4th floor exterior with lift\n\n\nLarge stately apartment on Calle Muntaner', ' 224m² (290m2 in catastro)', ' in a 1950 building. Located in one of the best areas of Barcelona', ' close to national and international schools. The apartment maintains details in its original ceilings and moldings of the time. It has 4 bedrooms']",Sant Gervasi - Galvany,290 m²,4th,with lift,Parking included,"Large stately apartment on Calle Muntaner, 224m² (290m2 in catastro), in a 1950 building. Located in one of the best areas of Barcelona, close to national and international schools. The apartment maintains details in its original ceilings and moldings of the time. It has 4 bedrooms, one en suite wit"
141,Flat,/en/inmueble/101619111/,"259,000€","['\n\nFlat in calle de Carreras i Candi', ' Sants - Badal', ' Barcelona\n\n\n259', '000€\n\n\n3 bed.\n62 m²\n1st floor exterior with lift\n\n\nSants - Carreras i Candi\nHousing located next to the Badal metro!\nThe apartment is in perfect condition to move into', ' the house is very square without loss of space', ' it consists of an entrance hall', ' a living room with access to a covered gallery-type balcony outside the block patio', ' 3 bedrooms']",calle de Carreras i Candi,62 m²,1st,with lift,,"Sants - Carreras i Candi
Housing located next to the Badal metro!
The apartment is in perfect condition to move into, the house is very square without loss of space, it consists of an entrance hall, a living room with access to a covered gallery-type balcony outside the block patio, 3 bedrooms, an"
142,Flat,/en/inmueble/101622905/,"385,000€","['\n\nFlat in calle de la Diputació', "" La Dreta de l'Eixample"", ' Barcelona\n\n\n385', '000€\nParking included\n\n\n2 bed.\n71 m²\nGround floor exterior with lift\n\n\nWe present', ' a few minutes from Paseo de Gracia and in the heart of the city of Barcelona', ' this little jewel of 60 m²', ' ready to move into. With lots of light and very quiet since it is a sixth floor high', ' the house has two bedrooms']",calle de la Diputació,71 m²,Ground,with lift,Parking included,"We present, a few minutes from Paseo de Gracia and in the heart of the city of Barcelona, this little jewel of 60 m², ready to move into. With lots of light and very quiet since it is a sixth floor high, the house has two bedrooms, one double in a suit format with a dressing room and another single."
143,Flat,/en/inmueble/100890343/,"990,000€","['\n\n\n\n\n\n\nFlat in Pedralbes', ' Barcelona\n\n\n990', '000€\nParking included\n\n\n5 bed.\n150 m²\n8th floor exterior with lift\n\n\nSurface: 150 m² approx. ', ' 8 m² approx. of terrace.\nDistribution: Entrance hall', ' living room with fireplace', ' 4 bedrooms', ' 2 bathrooms', ' kitchen', ' room with service toilet. Water area.\nObservations: High floor with very good orientation. Living room with access to a very sunny terrace']",Pedralbes,150 m²,8th,with lift,Parking included,"Surface: 150 m² approx. , 8 m² approx. of terrace.
Distribution: Entrance hall, living room with fireplace, 4 bedrooms, 2 bathrooms, kitchen, room with service toilet. Water area.
Observations: High floor with very good orientation. Living room with access to a very sunny terrace, facing south. The"
144,Flat,/en/inmueble/101613951/,"319,500€","['\n\nFlat in calle de Fluvià', ' Provençals del Poblenou', ' Barcelona\n\n\n319', '500€\n\n\n3 bed.\n96 m²\n1st floor exterior with lift\n\n\nThe Agency House sells:\nSpectacular house in the area of Provençals del Poblenou', ' Sant Martí. It consists of 83 useful meters distributed in: 3 bedrooms: 1 double', ' 1 medium and 1 single', ' two of them outside and one inside', ' living room with access to an outside balcony']",calle de Fluvià,96 m²,1st,with lift,,"The Agency House sells:
Spectacular house in the area of Provençals del Poblenou, Sant Martí. It consists of 83 useful meters distributed in: 3 bedrooms: 1 double, 1 medium and 1 single, two of them outside and one inside, living room with access to an outside balcony, kitchen in good condition wit"
145,Flat,/en/inmueble/101602432/,"750,000€","[""\n\nFlat in avenida d'Icària"", ' La Vila Olímpica del Poblenou', ' Barcelona\n\n\n750', '000€\nParking included\n\n\n4 bed.\n165 m²\nGround floor exterior with lift\n\n\nMagnificent totally exterior apartment located on Av Icaria one street from the Mapfre towers']",avenida d'Icària,165 m²,Ground,with lift,Parking included,"Magnificent totally exterior apartment located on Av Icaria one street from the Mapfre towers, Arts hotel and Puerto Olimpico. It has a community garden and a parking space included in the price. As we enter the apartment we find the hall that leads to a large living room with access to the terrace"
146,Flat,/en/inmueble/101602884/,"750,000€","[""\n\nFlat in avenida d'Icària"", ' La Vila Olímpica del Poblenou', ' Barcelona\n\n\n750', '000€\nParking included\n\n\n4 bed.\n128 m²\n1st floor exterior with lift\n\n\nMagnificent totally exterior apartment located on Av Icaria', ' one street from the Mapfre towers']",avenida d'Icària,128 m²,1st,with lift,Parking included,"Magnificent totally exterior apartment located on Av Icaria, one street from the Mapfre towers, Hotel Arts and Puerto Olímpico. It has a community garden and a parking space included in the price. As we enter the apartment we find the hall that leads to a large living room with access to the terrace"
147,House,/en/inmueble/101170920/,"1,600,000€","['\n\n\n\n\n\n\nHouse in Vallcarca i els Penitents', ' Barcelona\n\n\n1', '600', '000€\nParking included\n\n\n7 bed.\n404 m²\n\n\nThe house is divided by floors.\nOn the second and attic floors there is a tenant', ' with a departure date of February 2026\nPlot surface: 280 m² approx.\nTotal constructed area: 404 m² approx. + terraces of 81 m² and 35 m² approx.\nDistribution: Ground floor of approx. 141 m²', ' large hall', ' two bedrooms']",Vallcarca i els Penitents,404 m²,,,Parking included,"The house is divided by floors.
On the second and attic floors there is a tenant, with a departure date of February 2026
Plot surface: 280 m² approx.
Total constructed area: 404 m² approx. + terraces of 81 m² and 35 m² approx.
Distribution: Ground floor of approx. 141 m², large hall, two bedrooms, l"
148,Flat,/en/inmueble/91871835/,"2,600,000€","['\n\n\n\n\n\n\nFlat in Pedralbes', ' Barcelona\n\n\n2', '600', '000€\nParking included\n\n\n4 bed.\n240 m²\n3rd floor exterior with lift\n\n\nSpectacular designer apartment with high quality materials', ' for sale in Pedralbes. It has 240 m2 + terrace 24 m2. Living-dining room with access to a terrace with views over the city. Fully equipped kitchen-office with top brand appliances. Separate laundry room']",Pedralbes,240 m²,3rd,with lift,Parking included,"Spectacular designer apartment with high quality materials, for sale in Pedralbes. It has 240 m2 + terrace 24 m2. Living-dining room with access to a terrace with views over the city. Fully equipped kitchen-office with top brand appliances. Separate laundry room, service room with bathroom. Master s"
149,Flat,/en/inmueble/100934636/,"2,149,000€","['\n\n\n\n\n\n\nFlat in Pedralbes', ' Barcelona\n\n\n2', '149', '000€\n\n\n5 bed.\n195 m²\n1st floor exterior with lift\n\n\nLuxurious brand new ground floor in Pedralbes with large terrace of 142sqm.\nSurface area 195', '33sqm built and 168', '39sqm usable. It has 5 bedrooms', ' 3 bathrooms', ' spacious living room and kitchen.\nSpectacular terrace where you can enjoy the moments of rest that you deserve']",Pedralbes,195 m²,1st,with lift,,"Luxurious brand new ground floor in Pedralbes with large terrace of 142sqm.
Surface area 195,33sqm built and 168,39sqm usable. It has 5 bedrooms, 3 bathrooms, spacious living room and kitchen.
Spectacular terrace where you can enjoy the moments of rest that you deserve, or have an aperitif with yo"
150,Flat,/en/inmueble/100934636/,"2,149,000€","['\n\n\n\n\n\n\nFlat in Pedralbes', ' Barcelona\n\n\n2', '149', '000€\n\n\n5 bed.\n195 m²\n1st floor exterior with lift\n\n\nLuxurious brand new ground floor in Pedralbes with large terrace of 142sqm.\nSurface area 195', '33sqm built and 168', '39sqm usable. It has 5 bedrooms', ' 3 bathrooms', ' spacious living room and kitchen.\nSpectacular terrace where you can enjoy the moments of rest that you deserve']",Pedralbes,195 m²,1st,with lift,,"Luxurious brand new ground floor in Pedralbes with large terrace of 142sqm.
Surface area 195,33sqm built and 168,39sqm usable. It has 5 bedrooms, 3 bathrooms, spacious living room and kitchen.
Spectacular terrace where you can enjoy the moments of rest that you deserve, or have an aperitif with yo"
151,Penthouse,/en/inmueble/96691900/,"1,090,000€","['\n\n\n\n\n\n\nPenthouse in Sant Gervasi - Galvany', ' Barcelona\n\n\n1', '090', '000€\n\n\n1', '300', '000 €\n\n16%\n\n\n\n3 bed.\n150 m²\n8th floor exterior with lift\n\n\nPenthouse next to Turó Park with a 30m2 terrace', ' Barcelona\nSpectacular penthouse to reform', ' with an area of 149m2 including the terrace', ' of which 120m2 belong to the flat', ' next to Turó Park']",Sant Gervasi - Galvany,150 m²,8th,with lift,,"Penthouse next to Turó Park with a 30m2 terrace, Barcelona
Spectacular penthouse to reform, with an area of 149m2 including the terrace, of which 120m2 belong to the flat, next to Turó Park, in the upper area of the city.
The house is distributed in a spacious and bright living-dining room with a f"
152,Flat,/en/inmueble/96965683/,"1,090,000€","['\n\nFlat in calle Francesc Pérez Cabrero', ' Sant Gervasi - Galvany', ' Barcelona\n\n\n1', '090', '000€\n\n\n1', '300', '000 €\n\n16%\n\n\n\n3 bed.\n149 m²\n8th floor exterior with lift\n\n\nPenthouse to reform in the best area of the city', ' Turó Park.\nYou can reform to your liking', ' and create the appropriate distribution. With a large terrace', "" all exterior with the best orientation and beautiful views.\nLocated in a magnificent estate with a porter's lodge""]",calle Francesc Pérez Cabrero,149 m²,8th,with lift,,"Penthouse to reform in the best area of the city, Turó Park.
You can reform to your liking, and create the appropriate distribution. With a large terrace, all exterior with the best orientation and beautiful views.
Located in a magnificent estate with a porter's lodge, an excellent location in the"
153,Flat,/en/inmueble/101339916/,"580,000€","['\n\n\n\n\n\n\nFlat in calle del Vallespir', ' Les Corts', ' Barcelona\n\n\n580', '000€\n\n\n595', '000 €\n\n3%\n\n\n\n3 bed.\n114 m²\nGround floor exterior without lift\n\n\nFabulous brand new refurbished ground floor property with patio in Les Corts.\nThis charming apartment has been completely refurbished to create a unique interior with the highest quality materials and finishings']",calle del Vallespir,114 m²,Ground,without lift,,"Fabulous brand new refurbished ground floor property with patio in Les Corts.
This charming apartment has been completely refurbished to create a unique interior with the highest quality materials and finishings, together with the restoration of original elements. It's located in the neighbourhood"
154,Flat,/en/inmueble/100601612/,"340,000€","['\n\nFlat in El Carmel', ' Barcelona\n\n\n340', '000€\n\n\n360', '000 €\n\n6%\n\n\n\n4 bed.\n145 m²\n2nd floor with lift\n\n\nContact by calls or WhatsApp to Patricia SANTUARI / THE CARMEL. 85 m2 house', ' currently has 3 bedrooms since two singles were joined', ' but it can be separated again (one room has a balcony) living room with access to a 60m2 terrace', ' kitchenette', ' bathroom with shower', ' parquet floor', ' air conditioning']",El Carmel,145 m²,2nd,lift,,"Contact by calls or WhatsApp to Patricia SANTUARI / THE CARMEL. 85 m2 house, currently has 3 bedrooms since two singles were joined, but it can be separated again (one room has a balcony) living room with access to a 60m2 terrace, kitchenette, bathroom with shower, parquet floor, air conditioning, a"
155,Flat,/en/inmueble/101120527/,"147,500€","['\n\nFlat in calle de Beret', ' Can Peguera - El Turó de la Peira', ' Barcelona\n\n\n147', '500€\n\n\n154', '500 €\n\n5%\n\n\n\n3 bed.\n59 m²\n4th floor exterior without lift\n\n\nApartment in Barcelona. It has an area of 59 m² distributed in a living-dining room', ' 3 bedrooms', ' a kitchen and a bathroom. Finca with elevator. It has services', ' shops and nearby bus stops. Apartment located in the Vilapicina neighborhood in front of the Turó de la Peira Park']",calle de Beret,59 m²,4th,without lift,,"Apartment in Barcelona. It has an area of 59 m² distributed in a living-dining room, 3 bedrooms, a kitchen and a bathroom. Finca with elevator. It has services, shops and nearby bus stops. Apartment located in the Vilapicina neighborhood in front of the Turó de la Peira Park, around medical services"
156,Flat,/en/inmueble/101344700/,"320,000€","['\n\n\n\n\n\n\nFlat in calle de Muntaner', "" L'Antiga Esquerra de l'Eixample"", ' Barcelona\n\n\n320', '000€\n\n\n3 bed.\n61 m²\n3rd floor exterior with lift\n\n\nThree bedroom apartment for sale in Muntaner street\nWith an unbeatable location', ' in Muntaner street with Provença', ' a few steps from the Mercat del Ninot and the Hospital Clínic', ' we find this apartment of 61 m2', ' in a 4th real floor']",calle de Muntaner,61 m²,3rd,with lift,,"Three bedroom apartment for sale in Muntaner street
With an unbeatable location, in Muntaner street with Provença, a few steps from the Mercat del Ninot and the Hospital Clínic, we find this apartment of 61 m2, in a 4th real floor, in a building of 1950 in good condition with elevator.
It consists o"
157,Flat,/en/inmueble/101615105/,"300,000€","['\n\n\n\n\n\n\nFlat in calle de Ramon Albó', ' El Congrés i els Indians', ' Barcelona\n\n\n300', '000€\n\n\n3 bed.\n90 m²\n4th floor with lift\n\n\nWe enter and the first thing that surprises us is the light that reaches us to the entrance of the apartment. This beautiful oasis', ' without square meters lost in an endless corridor', ' with three rooms', ' two of them single and one double']",calle de Ramon Albó,90 m²,4th,lift,,"We enter and the first thing that surprises us is the light that reaches us to the entrance of the apartment. This beautiful oasis, without square meters lost in an endless corridor, with three rooms, two of them single and one double, all with natural light and very quiet. And the jewel of the hous"
158,Flat,/en/inmueble/100320064/,"480,000€","[""\n\nFlat in La Nova Esquerra de l'Eixample"", ' Barcelona\n\n\n480', '000€\n\n\n4 bed.\n115 m²\n4th floor exterior with lift\n\n\nTotally exterior apartment in Sants located on Avenida Roma', ' unbeatable location. It consists of four bedrooms and two bathrooms', ' two double bedrooms and two singles', ' a good living-dining room with access to an outdoor terrace with very good light input']",La Nova Esquerra de l'Eixample,115 m²,4th,with lift,,"Totally exterior apartment in Sants located on Avenida Roma, unbeatable location. It consists of four bedrooms and two bathrooms, two double bedrooms and two singles, a good living-dining room with access to an outdoor terrace with very good light input, a renovated kitchen with an independent exter"
159,Flat,/en/inmueble/101613198/,"275,000€","['\n\n\n\n\n\n\nFlat in calle de los Castillejos', ' El Baix Guinardó', ' Barcelona\n\n\n275', '000€\n\n\n3 bed.\n63 m²\n1st floor exterior with lift\n\n\nUnique opportunity! We are selling a fantastic apartment on the first floor with an exterior elevator', ' which will provide you with comfort and light in every corner. With a total area of 63m2', ' this home is perfect for enjoying a cozy and functional space.\nUpon entering the apartment']",calle de los Castillejos,63 m²,1st,with lift,,"Unique opportunity! We are selling a fantastic apartment on the first floor with an exterior elevator, which will provide you with comfort and light in every corner. With a total area of 63m2, this home is perfect for enjoying a cozy and functional space.
Upon entering the apartment, you will be gr"
160,Penthouse,/en/inmueble/98241033/,"399,000€","['\n\nPenthouse in calle de Sant Pere Màrtir', ' 23', ' Vila de Gràcia', ' Barcelona\n\n\n399', '000€\n\n\n2 bed.\n82 m²\n2nd floor exterior without lift\n\n\nIf you were looking for a SPACIOUS CHARMING APARTMENT in the heart of the Gràcia neighborhood', ' you just found it! Located next to the Jardinets de Gràcia', ' this beautiful 16m2 apartment WITH PRIVATE TERRACE is a dream. It is a second floor', ' without elevator']",calle de Sant Pere Màrtir,82 m²,2nd,without lift,,"If you were looking for a SPACIOUS CHARMING APARTMENT in the heart of the Gràcia neighborhood, you just found it! Located next to the Jardinets de Gràcia, this beautiful 16m2 apartment WITH PRIVATE TERRACE is a dream. It is a second floor, without elevator, of a small building on calle Sant Pere Mar"
161,Flat,/en/inmueble/98269201/,"550,000€","['\n\n\n\n\n\n\nFlat in El Poblenou', ' Barcelona\n\n\n550', '000€\n\n\n700', '000 €\n\n21%\n\n\n\n3 bed.\n312 m²\n exterior without lift\n\n\nDesign apartment and commercial premises in Poblenou\nSpectacular property consisting of commercial premises of 155 m2', ' with double height', ' ideal for setting up a business']",El Poblenou,312 m²,,,,"Design apartment and commercial premises in Poblenou
Spectacular property consisting of commercial premises of 155 m2, with double height, ideal for setting up a business, office or loft with double height. Continuing towards the back of the premises we will see a courtyard that communicates with a"
162,Flat,/en/inmueble/100112075/,"540,000€","['\n\nFlat in El Gòtic', ' Barcelona\n\n\n540']",El Gòtic,130 m²,2nd,with lift,,Elegant apartment with antique elements located in a building built in the second half of the 19th century that is structured around a beautiful patio and that is part of the Catalog of Architectural Heritage of Barcelona. It is located on the second floor and is special due to its distribution and
163,Flat,/en/inmueble/101183050/,"540,000€","['\n\nFlat in El Gòtic', ' Barcelona\n\n\n540']",El Gòtic,130 m²,2nd,with lift,,Elegant apartment with antique elements located in a building built in the second half of the 19th century that is structured around a beautiful patio and that is part of the Catalog of Architectural Heritage of Barcelona. It is located on the second floor and is special due to its distribution and
164,Detached,/en/inmueble/101262103/,"1,490,000€","['\n\nDetached house in Sant Gervasi - La Bonanova', ' Barcelona\n\n\n1', '490', '000€\n\n\n4 bed.\n151 m²\n\n\nDesign house in Bonanova with 2 floors located on a 174m2 lot', ' in an unbeatable area.\nThe property consists of 160m2 spread over 2 floors. The ground floor has 90m2 and the upper floor 70m2']",Sant Gervasi - La Bonanova,151 m²,,,,"Design house in Bonanova with 2 floors located on a 174m2 lot, in an unbeatable area.
The property consists of 160m2 spread over 2 floors. The ground floor has 90m2 and the upper floor 70m2, with two terraces of 10m2 respectively. This exclusive property also has a 70m2 garden and a 20m2 garden hou"
165,Flat,/en/inmueble/100587374/,"920,000€","['\n\nFlat in Sants', ' Barcelona\n\n\n920', '000€\nGarage optional 30', '000 €\n\n\n4 bed.\n159 m²\n2nd floor exterior with lift\n\n\nMagnificent duplex apartment with a surface area of 159 m2', ' and an excellent 60 m2 terrace', ' located in the center of La Bordeta', ' close to all services', ' very well connected.\nBuilding of the year 1991', ' exposed work', ' with elevator']",Sants,159 m²,2nd,with lift,"Garage optional 30,000 €","Magnificent duplex apartment with a surface area of 159 m2, and an excellent 60 m2 terrace, located in the center of La Bordeta, close to all services, very well connected.
Building of the year 1991, exposed work, with elevator, perfectly preserved. Floor to enter to live!
Optional PLACE FOR LARGE"
166,Flat,/en/inmueble/100454446/,"310,000€","['\n\n\n\n\n\n\nFlat in ronda de Sant Pau', ' Sant Antoni', ' Barcelona\n\n\n310', '000€\n\n\n325', '000 €\n\n5%\n\n\n\n3 bed.\n86 m²\n4th floor exterior with lift\n\n\nHigh and bright flat all exterior to refurbish in Eixample\nEngel & Völkers has the pleasure of introduce with exclusivity this fantastic 86 m2 apartment', ' with two balconies', ' made up of 3 rooms (two doubles and one single) all exterior', ' open kitchen']",ronda de Sant Pau,86 m²,4th,with lift,,"High and bright flat all exterior to refurbish in Eixample
Engel & Völkers has the pleasure of introduce with exclusivity this fantastic 86 m2 apartment, with two balconies, made up of 3 rooms (two doubles and one single) all exterior, open kitchen, living room with balcony with unobstructed views o"
167,Flat,/en/inmueble/100683533/,"675,000€","['\n\n\n\n\n\n\nFlat in calle de Sant Elies', ' Sant Gervasi - Galvany', ' Barcelona\n\n\n675', '000€\n\n\n4 bed.\n149 m²\n1st floor exterior with lift\n\n\nSant Elies/Brusi (Sant Gervasi) spacious 149m2 apartment outside a block patio. ', ' in a building built by the renowned architect Antoni de Moragas. ', ' with access to 2 interior patios. Dining room in two rooms of 40m2. ', ' approx. ', ' 4 bedrooms (2 doubles', ' 1 medium', ' 1 single)', ' 2 bathrooms with shower']",calle de Sant Elies,149 m²,1st,with lift,,"Sant Elies/Brusi (Sant Gervasi) spacious 149m2 apartment outside a block patio. , in a building built by the renowned architect Antoni de Moragas. , with access to 2 interior patios. Dining room in two rooms of 40m2. , approx. , 4 bedrooms (2 doubles, 1 medium, 1 single), 2 bathrooms with shower, ga"
