,type,reference,price,district,street,area,plant,lift,parking,description
299,Flat,/en/inmueble/93738105/,"1,450,000€","['\n\n\n\n\n\n\nFlat in Sant Gervasi - Galvany', ' Barcelona\n\n\n1', '450', '000€\nParking included\n\n\n4 bed.\n200 m²\n4th floor exterior with lift\n\n\nFantastic high apartment near Turó Parc\nIn an excellent location in the Galvany neighborhood', ' in one of the most prestigious streets and close to Turó Parc', ' we present this magnificent high and bright apartment thanks to its double orientation. Apartment of approximately 200sqm built']",Sant Gervasi - Galvany,200 m²,4th,with lift,Parking included,"Fantastic high apartment near Turó Parc
In an excellent location in the Galvany neighborhood, in one of the most prestigious streets and close to Turó Parc, we present this magnificent high and bright apartment thanks to its double orientation. Apartment of approximately 200sqm built, with spacious"
300,Flat,/en/inmueble/101044355/,"335,000€","['\n\n\n\n\n\n\nFlat in El Raval', ' Barcelona\n\n\n335', '000€\n\n\n4 bed.\n149 m²\n exterior without lift\n\n\nRenovated first floor for sale in Raval Nord\nSplendid first floor apartment conditioned as an office and refurbished with high quality finishes in the heart of the historic center of Barcelona. Located in a pedestrian street of Raval Alto', ' very close to Plaça Universitat']",El Raval,149 m²,,,,"Renovated first floor for sale in Raval Nord
Splendid first floor apartment conditioned as an office and refurbished with high quality finishes in the heart of the historic center of Barcelona. Located in a pedestrian street of Raval Alto, very close to Plaça Universitat, next to Joaquín Costa stree"
301,Flat,/en/inmueble/98372259/,"1,870,000€","['\n\n\n\n\n\n\nFlat in Pedralbes', ' Barcelona\n\n\n1', '870', '000€\nParking included\n\n\n4 bed.\n184 m²\n4th floor exterior with lift\n\n\nApartment refurbished with terrace in Pedralbes\nSpectacular new renovated home.\nHousing on the fourth floor of: 168.4sqm of housing']",Pedralbes,184 m²,4th,with lift,Parking included,"Apartment refurbished with terrace in Pedralbes
Spectacular new renovated home.
Housing on the fourth floor of: 168.4sqm of housing, 27.88sqm of terrace and 4.11sqm of common private area.
Spectacular home with a large living-dining room with access to the South-facing terrace. The main room en sui"
302,Flat,/en/inmueble/99168745/,"770,000€","[""\n\n\n\n\n\n\nFlat in La Dreta de l'Eixample"", ' Barcelona\n\n\n770', '000€\n\n\n1 bed.\n61 m²\n1st floor exterior with lift\n\n\nNew one bedroom flat on Rambla Catalunya\nWe are pleased to present this completely refurbished finca regia with 17 contemporary designed apartments', ' located on the iconic Rambla de Catalunya in the heart of Barcelona. Set on a tree-lined']",La Dreta de l'Eixample,61 m²,1st,with lift,,"New one bedroom flat on Rambla Catalunya
We are pleased to present this completely refurbished finca regia with 17 contemporary designed apartments, located on the iconic Rambla de Catalunya in the heart of Barcelona. Set on a tree-lined, semi-pedestrianized avenue known for both outdoor dining and"
303,Flat,/en/inmueble/99230533/,"490,000€","[""\n\n\n\n\n\n\nFlat in L'Antiga Esquerra de l'Eixample"", ' Barcelona\n\n\n490', '000€\n\n\n505']",L'Antiga Esquerra de l'Eixample,93 m²,5th,with lift,,"Cozy flat in classic Eixample building
On the fifth floor of a classic building in Eixample Esquerra we find this apartment of approximately 93 square meters with three bedrooms and one bathroom.
Upon entering we find ourselves in the hall that separates the apartment into two areas. On the left ha"
304,Flat,/en/inmueble/85716462/,"1,580,000€","[""\n\n\n\n\n\n\nFlat in La Dreta de l'Eixample"", ' Barcelona\n\n\n1', '580', '000€\nParking included\n\n\n3 bed.\n174 m²\n5th floor exterior with lift\n\n\nExclusive flat with terrace in Rambla Catalunya\nLocated in a traditional building from the beginning of the 20th century', ' in the prestigious Rambla Catalunya', ' the flat is located on an upper floor that belongs to a rise of the year 2016']",La Dreta de l'Eixample,174 m²,5th,with lift,Parking included,"Exclusive flat with terrace in Rambla Catalunya
Located in a traditional building from the beginning of the 20th century, in the prestigious Rambla Catalunya, the flat is located on an upper floor that belongs to a rise of the year 2016, perfectly integrated into the original building. The price inc"
305,Flat,/en/inmueble/88934232/,"370,000€","['\n\n\n\n\n\n\nFlat in Sant Pere - Santa Caterina i la Ribera', ' Barcelona\n\n\n370', '000€\n\n\n1 bed.\n65 m²\n2nd floor exterior with lift\n\n\nSpacious renovated apartment in Born\nThis spacious flat has undergone an extensive renovation that has maximized the space and integrated the luxuries of a modern property. With high ceilings notable of the principal level']",Sant Pere - Santa Cater,65 m²,2nd,with lift,,"Spacious renovated apartment in Born
This spacious flat has undergone an extensive renovation that has maximized the space and integrated the luxuries of a modern property. With high ceilings notable of the principal level, the natural light travels throughout the property and imparts a sensation of"
306,Flat,/en/inmueble/101131574/,"1,070,000€","['\n\n\n\n\n\n\nFlat in Sant Gervasi - Galvany', ' Barcelona\n\n\n1', '070', '000€\nParking included\n\n\n5 bed.\n170 m²\n1st floor exterior with lift\n\n\nExterior flat with swimming pool in Turo Park\nEngel & Völkers presents a comfortable', ' bright and elegant property in Turo Park. It is an exterior apartment and completely customizable according to the demands of the new owners.\nIt currently consists of a hall']",Sant Gervasi - Galvany,170 m²,1st,with lift,Parking included,"Exterior flat with swimming pool in Turo Park
Engel & Völkers presents a comfortable, bright and elegant property in Turo Park. It is an exterior apartment and completely customizable according to the demands of the new owners.
It currently consists of a hall, a spacious living room with access to a"
307,Flat,/en/inmueble/101597208/,"515,000€","['\n\n\n\n\n\n\nFlat in El Raval', ' Barcelona\n\n\n515', '000€\n\n\n2 bed.\n115 m²\n5th floor exterior with lift\n\n\nFabulous flat in Tallers street in Raval\nIn the heart of the old quarter of Barcelona', ' next to Las Ramblas', ' we find this fabulous apartment of 115 square meters.\nThe property is perfectly divided through a large corridor', ' in night zone and day zone. It consists of two double bedrooms']",El Raval,115 m²,5th,with lift,,"Fabulous flat in Tallers street in Raval
In the heart of the old quarter of Barcelona, next to Las Ramblas, we find this fabulous apartment of 115 square meters.
The property is perfectly divided through a large corridor, in night zone and day zone. It consists of two double bedrooms, one with a lar"
308,Flat,/en/inmueble/101161333/,"1,095,000€","[""\n\n\n\n\n\n\nFlat in La Dreta de l'Eixample"", ' Barcelona\n\n\n1', '095', '000€\n\n\n4 bed.\n252 m²\n1st floor exterior with lift\n\n\nProperty with terrace next to Passeig de Gràcia\nProperty located in a coveted area of the Eixample district. It is very close to the exclusive Passeig de Gràcia and Rambla de Catalunya']",La Dreta de l'Eixample,252 m²,1st,with lift,,"Property with terrace next to Passeig de Gràcia
Property located in a coveted area of the Eixample district. It is very close to the exclusive Passeig de Gràcia and Rambla de Catalunya, very well connected to the entire city.
It is located in a well-preserved 1930s building with a concierge service."
309,Duplex,/en/inmueble/101336091/,"390,000€","['\n\n\n\n\n\n\nDuplex in Sant Pere - Santa Caterina i la Ribera', ' Barcelona\n\n\n390', '000€\n\n\n430', '000 €\n\n9%\n\n\n\n2 bed.\n82 m²\nGround floor exterior with lift\n\n\nNew Apartments in a Restored Medieval Building in El Born\nIn a quiet street next to the emblematic Born Market we find this corner building', ' of a total of 10 apartments', ' completely renovated maintaining its charm and original elements.\nIt has 2 bedroom apartments']",Sant Pere - Santa Cater,82 m²,Ground,with lift,,"New Apartments in a Restored Medieval Building in El Born
In a quiet street next to the emblematic Born Market we find this corner building, of a total of 10 apartments, completely renovated maintaining its charm and original elements.
It has 2 bedroom apartments, with balconies overlooking the str"
310,Flat,/en/inmueble/99989919/,"1,049,000€","[""\n\n\n\n\n\n\nFlat in La Dreta de l'Eixample"", ' Barcelona\n\n\n1', '049']",La Dreta de l'Eixample,167 m²,2nd,with lift,,"Charming apartment with terrace in Eixample Dret
We are pleased to introduce this charming apartment in the Quadrat d'Or in Barcelona. It is a double-oriented apartment that was renovated a few years ago with best qualities. The renovation was carried out keeping the essence of the flats of the Eixa"
311,Flat,/en/inmueble/100856818/,"340,000€","['\n\n\n\n\n\n\nFlat in Can Baró', ' Barcelona\n\n\n340', '000€\n\n\n4 bed.\n105 m²\n7th floor exterior with lift\n\n\nHigh property with terrace in Can Baró\nFantastic high', ' spacious and bright apartment with 8 sqm terrace', ' all exterior and bright']",Can Baró,105 m²,7th,with lift,,"High property with terrace in Can Baró
Fantastic high, spacious and bright apartment with 8 sqm terrace, all exterior and bright, located in a privileged area known for its spectacular views over Barcelona and the coast.
Upon entering we find ourselves in a practical hall that leads to a very spaci"
312,Flat,/en/inmueble/99728338/,"475,000€","['\n\n\n\n\n\n\nFlat in El Raval', ' Barcelona\n\n\n475', '000€\n\n\n2 bed.\n120 m²\n3rd floor exterior with lift\n\n\nFlat in a renovated regal building with elevator\nThis charming flat is found in a 4th floor of a 1936 regal building', ' located in old town Barcelona', ' in the emblematic district of Ciutat Vella', ' part of one of the oldest neighbourhoods in the city of Barcelona']",El Raval,120 m²,3rd,with lift,,"Flat in a renovated regal building with elevator
This charming flat is found in a 4th floor of a 1936 regal building, located in old town Barcelona, in the emblematic district of Ciutat Vella, part of one of the oldest neighbourhoods in the city of Barcelona, El Raval.
The building has undergone a"
313,Flat,/en/inmueble/93738105/,"1,450,000€","['\n\n\n\n\n\n\nFlat in Sant Gervasi - Galvany', ' Barcelona\n\n\n1', '450', '000€\nParking included\n\n\n4 bed.\n200 m²\n4th floor exterior with lift\n\n\nFantastic high apartment near Turó Parc\nIn an excellent location in the Galvany neighborhood', ' in one of the most prestigious streets and close to Turó Parc', ' we present this magnificent high and bright apartment thanks to its double orientation. Apartment of approximately 200sqm built']",Sant Gervasi - Galvany,200 m²,4th,with lift,Parking included,"Fantastic high apartment near Turó Parc
In an excellent location in the Galvany neighborhood, in one of the most prestigious streets and close to Turó Parc, we present this magnificent high and bright apartment thanks to its double orientation. Apartment of approximately 200sqm built, with spacious"
314,Penthouse,/en/inmueble/101596313/,"725,000€","[""\n\n\n\n\n\n\nPenthouse in L'Antiga Esquerra de l'Eixample"", ' Barcelona\n\n\n725', '000€\n\n\n3 bed.\n113 m²\n7th floor exterior with lift\n\n\nGreat and high flat in Enric Granados\nApartment very bright in Eixample Dret', ' in a building built in 1910 with orientation Southeast.\nIt is a comfortable and functional two double size bedrooms']",L'Antiga Esquerra de l'Eixample,113 m²,7th,with lift,,"Great and high flat in Enric Granados
Apartment very bright in Eixample Dret, in a building built in 1910 with orientation Southeast.
It is a comfortable and functional two double size bedrooms, two complete bathrooms and a toilette. It also has a spacious living room and a fully equipped kitchen w"
315,Flat,/en/inmueble/99102990/,"549,000€","['\n\n\n\n\n\n\nFlat in Sant Pere - Santa Caterina i la Ribera', ' Barcelona\n\n\n549', '000€\n\n\n3 bed.\n145 m²\n1st floor exterior with lift\n\n\nSpacious apartment in Born neighborhood\nWe offer an original house with a distribution on the corner of two streets', ' very close to Vía Layetana and the Santa Catalina Market', ' in a 1900 building with an elevator and a reform in the 2000 year.\nIt has a constructed area of 125m2']",Sant Pere - Santa Cater,145 m²,1st,with lift,,"Spacious apartment in Born neighborhood
We offer an original house with a distribution on the corner of two streets, very close to Vía Layetana and the Santa Catalina Market, in a 1900 building with an elevator and a reform in the 2000 year.
It has a constructed area of 125m2, with a longitudinal di"
316,Flat,/en/inmueble/100918100/,"365,000€","['\n\n\n\n\n\n\nFlat in El Raval', ' Barcelona\n\n\n365', '000€\n\n\n2 bed.\n81 m²\n8th floor exterior with lift\n\n\nWonderful views in the center of Barcelona\nNice apartment between Ciutat Vella and Eixample', ' in the eighth floor of a building of the 60s']",El Raval,81 m²,8th,with lift,,"Wonderful views in the center of Barcelona
Nice apartment between Ciutat Vella and Eixample, in the eighth floor of a building of the 60s, designed by the architect Antoni de Moragas i Gallissà. Discover this property with a spacious living room with excellent views of Barcelona. It has two spacious"
317,Flat,/en/inmueble/90242402/,"782,000€","[""\n\n\n\n\n\n\nFlat in L'Antiga Esquerra de l'Eixample"", ' Barcelona\n\n\n782', '000€\n\n\n3 bed.\n117 m²\n2nd floor exterior with lift\n\n\nElegant apartment near Plaça Universitat\nThis bright and elegant Principal (a real second floor) facing northwest is part of a Great Refurbishment in a magnificent 1900 Regal Estate building located near plaça Universitat. All of the details of this refurbishment have been taken care of']",L'Antiga Esquerra de l'Eixample,117 m²,2nd,with lift,,"Elegant apartment near Plaça Universitat
This bright and elegant Principal (a real second floor) facing northwest is part of a Great Refurbishment in a magnificent 1900 Regal Estate building located near plaça Universitat. All of the details of this refurbishment have been taken care of, including t"
318,Flat,/en/inmueble/100745714/,"300,000€","['\n\n\n\n\n\n\nFlat in rambla La', ' El Gòtic', ' Barcelona\n\n\n300', '000€\n\n\n1 bed.\n63 m²\nMezzanine interior with lift\n\n\nRefurbished apartment on the same Rambla in Barcelona\nIn La Rambla de Barcelona', ' surrounded by shops and leisure areas']",rambla La,63 m²,Mezzanine,lift,,"Refurbished apartment on the same Rambla in Barcelona
In La Rambla de Barcelona, surrounded by shops and leisure areas, we find this apartment completely renovated. It is located in a 1900 property in good condition and with a lift. It is a main floor segregated in 6 apartments reformed with high qu"
319,Flat,/en/inmueble/98268710/,"6,000,000€","['\n\n\n\n\n\n\nFlat in calle de Provença', "" La Dreta de l'Eixample"", ' Barcelona\n\n\n6', '000', '000€\n\n\n4 bed.\n475 m²\n3rd floor exterior with lift\n\n\nDuplex with terraces next to La Pedrera', ' Barcelona\nIn a spectacular catalogued royal estate', ' next to La Pedrera and Casa Milà. Surrounded by all the services', ' transports and the most exclusive shops in Barcelona', ' we find this wonderful property for sale']",calle de Provença,475 m²,3rd,with lift,,"Duplex with terraces next to La Pedrera, Barcelona
In a spectacular catalogued royal estate, next to La Pedrera and Casa Milà. Surrounded by all the services, transports and the most exclusive shops in Barcelona, we find this wonderful property for sale, renovated with all luxury details in 2010. It"
320,Penthouse,/en/inmueble/98269028/,"1,900,000€","['\n\n\n\n\n\n\nPenthouse in calle de Vidal i de Valenciano', ' El Poblenou', ' Barcelona\n\n\n1', '900', '000€\nParking included\n\n\n2 bed.\n134 m²\n14th floor exterior with lift\n\n\nPenthouse with terrace sale in El Poblenou (Barcelona)\nSpectacular 135 sqm penthouse with a sunny 30 sqm terrace on the seafront.\nLocated in Poblenou', ' a few meters from the Mediterranean Sea and the beaches']",calle de Vidal i de Valenciano,134 m²,14th,with lift,Parking included,"Penthouse with terrace sale in El Poblenou (Barcelona)
Spectacular 135 sqm penthouse with a sunny 30 sqm terrace on the seafront.
Located in Poblenou, a few meters from the Mediterranean Sea and the beaches, within walking distance of restaurants.
This fully equipped luxury apartment with high fin"
321,Flat,/en/inmueble/98271129/,"380,000€","[""\n\n\n\n\n\n\nFlat in calle d'en Carabassa"", ' El Gòtic', ' Barcelona\n\n\n380', '000€\n\n\n2 bed.\n92 m²\nGround floor exterior without lift\n\n\nRefurbished 2 bedroom apartment for sale next to the Church of La Mercè\nA few steps from the Basilica de la Mercè and the Moll de la Fusta', ' in the heart of the Gothic Quarter with more history of the city', ' we find this apartment of 92m2 built completely renovated']",calle d'en Carabassa,92 m²,Ground,without lift,,"Refurbished 2 bedroom apartment for sale next to the Church of La Mercè
A few steps from the Basilica de la Mercè and the Moll de la Fusta, in the heart of the Gothic Quarter with more history of the city, we find this apartment of 92m2 built completely renovated, located on the second floor of a bu"
322,Duplex,/en/inmueble/101199070/,"749,700€","[""\n\n\n\n\n\n\nDuplex in calle D'Abdó Terradas"", ' Vila de Gràcia', ' Barcelona\n\n\n749', '700€\n\n\n3 bed.\n128 m²\nGround floor exterior without lift\n\n\nTriplex in Vila De Gràcia', ' five minutes from Passeig de Gràcia.\nOn a corner with two winds in pedestrian streets', ' we find this house of 128m2 according to the registry note']",calle D'Abdó Terradas,128 m²,Ground,without lift,,"Triplex in Vila De Gràcia, five minutes from Passeig de Gràcia.
On a corner with two winds in pedestrian streets, we find this house of 128m2 according to the registry note, ready to move in with three bedrooms and three bathrooms.
Upon entering the house we find a very open space with a half open"
323,Flat,/en/inmueble/101612882/,"359,000€","['\n\nFlat in Hostafrancs', ' Barcelona\n\n\n359', '000€\n\n\n2 bed.\n57 m²\n1st floor exterior with lift\n\n\nThe property is located in a privileged area of the neighborhood of Hostafrancs', ' between the two large parks of the neighborhood', "" the Parc de Joan Miró and the Parc de la Espanya Industrial.\nIt is also located between two of Barcelona's major bus"", ' metro and train stations']",Hostafrancs,57 m²,1st,with lift,,"The property is located in a privileged area of the neighborhood of Hostafrancs, between the two large parks of the neighborhood, the Parc de Joan Miró and the Parc de la Espanya Industrial.
It is also located between two of Barcelona's major bus, metro and train stations, Sants Estació and Plaza"
324,Flat,/en/inmueble/98269110/,"1,095,000€","['\n\n\n\n\n\n\nFlat in calle de Provença', "" La Nova Esquerra de l'Eixample"", ' Barcelona\n\n\n1', '095', '000€\n\n\n4 bed.\n189 m²\n2nd floor exterior with lift\n\n\n4 bedrooms appartment on Sale in Eixample Esquerra', ' totally refurbished.\nWonderful property for sale located in the Eixample Esquerra of Barcelona']",calle de Provença,189 m²,2nd,with lift,,"4 bedrooms appartment on Sale in Eixample Esquerra, totally refurbished.
Wonderful property for sale located in the Eixample Esquerra of Barcelona, consists of 189m2 as a result of the union of two floors. (consists of two registry entities)
Refurbished with high quality materials in 2012. With a d"
325,Terraced,/en/inmueble/99271667/,"950,000€","['\n\n\n\n\n\n\nTerraced house in calle del Torrent de les Roses', ' Pedralbes', ' Barcelona\n\n\n950', '000€\n\n\n5 bed.\n150 m²\n\n\nSemi-detached house for sale in Pedralbes - Les Corts\nTwo-storey semi-detached house with gable roof', ' 150m2 in one of the quietest areas of Barcelona', ' within walking distance of prestigious schools and universities.\nThe house has two floors. On the first floor']",calle del Torrent de les Roses,150 m²,,,,"Semi-detached house for sale in Pedralbes - Les Corts
Two-storey semi-detached house with gable roof, 150m2 in one of the quietest areas of Barcelona, within walking distance of prestigious schools and universities.
The house has two floors. On the first floor, we find a living room with access to"
326,Flat,/en/inmueble/101043506/,"595,000€","['\n\n\n\n\n\n\nFlat in calle de Villarroel', "" L'Antiga Esquerra de l'Eixample"", ' Barcelona\n\n\n595', ""000€\n\n\n3 bed.\n105 m²\nMezzanine exterior with lift\n\n\nRefurbished apartment for sale in l'Eixample Esquerra\nIn the heart of Barcelona's Eixample Izquierdo"", ' in front of the ""Mercat del Ninot""', ' we find this fantastic apartment', ' completely renovated with elegant finishes and high quality materials', ' perfect for living or investing.\nIt is a second floor']",calle de Villarroel,105 m²,Mezzanine,lift,,"Refurbished apartment for sale in l'Eixample Esquerra
In the heart of Barcelona's Eixample Izquierdo, in front of the ""Mercat del Ninot"", we find this fantastic apartment, completely renovated with elegant finishes and high quality materials, perfect for living or investing.
It is a second floor, in"
327,Flat,/en/inmueble/98268685/,"4,500,000€","['\n\n\n\n\n\n\nFlat in paseo de la Bonanova', ' Sant Gervasi - La Bonanova', ' Barcelona\n\n\n4', '500', '000€\nParking included\n\n\n6 bed.\n492 m²\n1st floor exterior with lift\n\n\nLuxury flat for sale in Passeig Bonanova\nThis impressive property', ' located on the best section of Passeig Bonanova', ' has a surface area of 500sqm approx.\nDetached flat', ' perfectly laid out']",paseo de la Bonanova,492 m²,1st,with lift,Parking included,"Luxury flat for sale in Passeig Bonanova
This impressive property, located on the best section of Passeig Bonanova, has a surface area of 500sqm approx.
Detached flat, perfectly laid out, is located in one of the most exclusive buildings of the neighborhood. The flat has a large living-dining room"
328,Detached,/en/inmueble/99345419/,"3,950,000€","['\n\n\n\n\n\n\nDetached house in Pedralbes', ' Barcelona\n\n\n3', '950', '000€\n\n\n12 bed.\n593 m²\n\n\nFantastic house with a huge garden in Pedralbes\nIn the elegant neighborhood of Pedralbes', ' surrounded by multiple prestigious international schools', ' very well connected to the city center and one of the main arteries of Barcelona', ' we find this unique property.\nThe house has two entrances']",Pedralbes,593 m²,,,,"Fantastic house with a huge garden in Pedralbes
In the elegant neighborhood of Pedralbes, surrounded by multiple prestigious international schools, very well connected to the city center and one of the main arteries of Barcelona, we find this unique property.
The house has two entrances, one for pe"
329,Flat,/en/inmueble/99945410/,"1,350,000€","['\n\n\n\n\n\n\nFlat in Vila de Gràcia', ' Barcelona\n\n\n1', '350', '000€\n\n\n5 bed.\n226 m²\n3rd floor exterior with lift\n\n\nFablulous bright flat in Plaza Narcis Oller\nEngel&Völkers presents this unique piece in one of the most demanded locations', ' a few steps from Plaça de Narcís Oller', ' Gal. la Placidía; Rambla Catalunya', ' Passeig de Gràcia and Av. Diagonal. In a beautiful modernist building']",Vila de Gràcia,226 m²,3rd,with lift,,"Fablulous bright flat in Plaza Narcis Oller
Engel&Völkers presents this unique piece in one of the most demanded locations, a few steps from Plaça de Narcís Oller, Gal. la Placidía; Rambla Catalunya, Passeig de Gràcia and Av. Diagonal. In a beautiful modernist building, on the fifth floor there is t"
330,Flat,/en/inmueble/99393815/,"345,000€","['\n\n\n\n\n\n\nFlat in calle de Provença', "" La Nova Esquerra de l'Eixample"", ' Barcelona\n\n\n345', '000€\n\n\n2 bed.\n63 m²\n4th floor exterior with lift\n\n\nPiso en venta en La Nova Esquerra de l´Eixample\nEn la Nova Esquerra de l´Eixample', ' en la calle Provença', ' encontramos esta vivienda', ' compuesta de 63m2 construidos']",calle de Provença,63 m²,4th,with lift,,"Piso en venta en La Nova Esquerra de l´Eixample
En la Nova Esquerra de l´Eixample, en la calle Provença, encontramos esta vivienda, compuesta de 63m2 construidos, 58m2 útiles y construida en el año 1930.
La vivienda consta de dos habitaciones y 1 baño completo. La habitación principal tiene un balc"
331,Flat,/en/inmueble/98271638/,"370,000€","[""\n\n\n\n\n\n\nFlat in calle de l'Equador"", ' Les Corts', ' Barcelona\n\n\n370']",calle de l'Equador,107 m²,5th,with lift,,"Apartment for sale in Les Corts
This beautiful apartment is located in the district of Les Corts in a very quiet street near the Plaza de Les Corts and five minutes from the shopping center L'Illa Diagonal surrounded by all kinds of services and transport.
The house of 84m2 useful. Distributed in a"
332,Flat,/en/inmueble/101023180/,"349,000€","[""\n\n\n\n\n\n\nFlat in calle de l'Hostal de Sant Antoni"", ' Sant Pere - Santa Caterina i la Ribera', ' Barcelona\n\n\n349', '000€\n\n\n2 bed.\n45 m²\n1st floor exterior with lift\n\n\nNew Apartments in a Restored Medieval Building in El Born\nIn a quiet street next to the emblematic Born Market we find this corner building', ' of a total of 10 apartments', ' completely renovated maintaining its charm and original elements.\nIt has 2 bedroom apartments']",calle de l'Hostal de Sant Antoni,45 m²,1st,with lift,,"New Apartments in a Restored Medieval Building in El Born
In a quiet street next to the emblematic Born Market we find this corner building, of a total of 10 apartments, completely renovated maintaining its charm and original elements.
It has 2 bedroom apartments, with balconies overlooking the str"
