,type,reference,price,district,street,area,plant,lift,parking,description
0,Flat,/en/inmueble/97812760/,"599,000€","['\n\nFlat in Gran Via de les Corts Catalanes', "" La Dreta de l'Eixample"", ' Barcelona\n\n\n599', '000€\n\n\n2 bed.\n96 m²\n1st floor exterior with lift\n\n\nMagnificent completely renovated apartment of 96 m2', ' in a royal corner building next to Pl. Tetuán', ' has a large sunny living room facing south-east', ' with a gallery and views of Pl. Tetuán', ' semi-open kitchen with serving hatch', ' 2 double bedrooms (1 with en-suite bathroom)', ' toilet']",Gran Via de les Corts Catalanes,96 m²,1st,with lift,,"Magnificent completely renovated apartment of 96 m2, in a royal corner building next to Pl. Tetuán, has a large sunny living room facing south-east, with a gallery and views of Pl. Tetuán, semi-open kitchen with serving hatch, 2 double bedrooms (1 with en-suite bathroom), toilet, large balcony facin"
1,Flat,/en/inmueble/99096863/,"450,000€","['\n\n\n\n\n\n\nFlat in Passatge Madoz', ' 1', ' El Gòtic', ' Barcelona\n\n\n450', '000€\n\n\n5 bed.\n152 m²\n2nd floor exterior with lift\n\n\nApartment for sale in the Gothic Quarter in the passage that connects Calle Ferrán with Plaza Real.\nBuilding with elevator']",Passatge Madoz,152 m²,2nd,with lift,,"Apartment for sale in the Gothic Quarter in the passage that connects Calle Ferrán with Plaza Real.
Building with elevator, exterior with balconies facing Ferrán y Madoz street.
Room with balcony to the Madoz passage.
Dining room with balcony to Ferrán street.
It has 5 rooms:
4 with balcony to Ferrá"
2,Flat,/en/inmueble/97500398/,"795,000€","['\n\n\n\n\n\n\nFlat in via Laietana', ' Sant Pere - Santa Caterina i la Ribera', ' Barcelona\n\n\n795', '000€\n\n\n950']",via Laietana,88 m²,1st,with lift,,"This upscale apartment with high quality finishings is located in a completely refurbished regal estate building in El Born. The building has a historic façade and a completely renovated interior with an imposing entrance hall.
This flat has 88 built sqm and is located on the 1st floor. The hall gi"
3,Flat,/en/inmueble/101615213/,"750,000€","[""\n\nFlat in avenida d'Icària"", ' La Vila Olímpica del Poblenou', ' Barcelona\n\n\n750', '000€\nParking included\n\n\n4 bed.\n165 m²\n2nd floor with lift\n\n\nMagnificent totally exterior apartment located on Av Icaria', ' one street from the Mapfre towers']",avenida d'Icària,165 m²,2nd,lift,Parking included,"Magnificent totally exterior apartment located on Av Icaria, one street from the Mapfre towers, Hotel Arts and Puerto Olimpico. It has a community garden and a parking space included in the price. As we enter the apartment we find the hall that leads to a large living room with access to the terrace"
4,Flat,/en/inmueble/99970317/,"850,000€","['\n\nFlat in calle de Jordà', ' Sarrià', ' Barcelona\n\n\n850', '000€\nParking included\n\n\n3 bed.\n123 m²\n2nd floor exterior with lift\n\n\nApartment located in a magnificent area next to Calle Mayor de Sarriá. It has a built area of 123 m2 and has 3 double bedrooms and 2 bathrooms. In addition', ' you have the exclusive use of a 25 m2 solarium terrace and a 20m2 garage space with space for 2 vehicles.\nThe farm']",calle de Jordà,123 m²,2nd,with lift,Parking included,"Apartment located in a magnificent area next to Calle Mayor de Sarriá. It has a built area of 123 m2 and has 3 double bedrooms and 2 bathrooms. In addition, you have the exclusive use of a 25 m2 solarium terrace and a 20m2 garage space with space for 2 vehicles.
The farm, built in 1994 and exposed"
5,Flat,/en/inmueble/101563558/,"440,000€","['\n\n\n\n\n\n\nFlat in ronda de Sant Pau', ' Sant Antoni', ' Barcelona\n\n\n440', '000€\n\n\n3 bed.\n90 m²\n4th floor exterior with lift\n\n\nHigh flat with balconies in Mercat Sant Antoni\nEngel & Völkers has the pleasure of introduce with exclusivity this fantastic modernist-style apartment in a nice building', ' sixth in real height', ' with 85 m2', ' double orientation', ' with two balconies', ' one to the East and the other to the West']",ronda de Sant Pau,90 m²,4th,with lift,,"High flat with balconies in Mercat Sant Antoni
Engel & Völkers has the pleasure of introduce with exclusivity this fantastic modernist-style apartment in a nice building, sixth in real height, with 85 m2, double orientation, with two balconies, one to the East and the other to the West, currently co"
6,Flat,/en/inmueble/98356477/,"320,000€","['\n\n\n\n\n\n\nFlat in calle de Mallorca', ' La Sagrada Família', ' Barcelona\n\n\n320', '000€\nGarage optional 40', '000 €\n\n\n329', '000 €\n\n3%\n\n\n\n4 bed.\n82 m²\n5th floor exterior with lift\n\n\nBright apartment near the Sagrada Familia\nIn the Eixample district', ' a few meters from the Sagrada Familia', ' you will find this functional', ' quiet and bright four-bedroom apartment. Its location is just perfect', ' surrounded by essential shops', ' multiple leisure options']",calle de Mallorca,82 m²,5th,with lift,"Garage optional 40,000 €","Bright apartment near the Sagrada Familia
In the Eixample district, a few meters from the Sagrada Familia, you will find this functional, quiet and bright four-bedroom apartment. Its location is just perfect, surrounded by essential shops, multiple leisure options, restaurants and several public tra"
7,Penthouse,/en/inmueble/100071464/,"1,065,000€","['\n\n\n\n\n\n\nPenthouse in La Sagrada Família', ' Barcelona\n\n\n1', '065', '000€\n\n\n4 bed.\n237 m²\n8th floor exterior with lift\n\n\nROSSELLO - ESTRELLA DAMM magnificent corner penthouse of 190 m2 located in the Eixample a few minutes from the Temple of the Sagrada Familia and with extraordinary views of the entire city of Barcelona. Its excellent location', ' in front of the multipurpose space - Estrella Damm Museum']",La Sagrada Família,237 m²,8th,with lift,,"ROSSELLO - ESTRELLA DAMM magnificent corner penthouse of 190 m2 located in the Eixample a few minutes from the Temple of the Sagrada Familia and with extraordinary views of the entire city of Barcelona. Its excellent location, in front of the multipurpose space - Estrella Damm Museum, and its height"
8,Flat,/en/inmueble/101618144/,"830,000€","['\n\nFlat in ronda del General Mitre', ' Sant Gervasi - Galvany', ' Barcelona\n\n\n830', '000€\nParking included\n\n\n4 bed.\n155 m²\n3rd floor exterior with lift\n\n\nMagnificent home to reform located at the crossroads between General Miter and Calle Mandri', ' in the heart of the San Gervasio neighborhood.\nAs we enter the house', ' we find a hall that separates the day area from the night area']",ronda del General Mitre,155 m²,3rd,with lift,Parking included,"Magnificent home to reform located at the crossroads between General Miter and Calle Mandri, in the heart of the San Gervasio neighborhood.
As we enter the house, we find a hall that separates the day area from the night area, from which we access the living room and the kitchen. The living room is"
9,Flat,/en/inmueble/100012140/,"660,000€","['\n\nFlat in Diputacion', "" L'Antiga Esquerra de l'Eixample"", ' Barcelona\n\n\n660', '000€\n\n\n3 bed.\n141 m²\nMezzanine exterior with lift\n\n\nFantastic APARTMENT on the first floor in the Eixample neighborhood with TERRACE', ' located on Diputación street with Aribau in Barcelona.\nIt is an apartment that overlooks Diputación street and a very quiet interior patio of the block']",Diputacion,141 m²,Mezzanine,lift,,"Fantastic APARTMENT on the first floor in the Eixample neighborhood with TERRACE, located on Diputación street with Aribau in Barcelona.
It is an apartment that overlooks Diputación street and a very quiet interior patio of the block, with an area of 141.46 m2 distributed in a spacious LIVING-DININ"
10,Flat,/en/inmueble/101571602/,"425,000€","['\n\n\n\n\n\n\nFlat in calle de la Diputació', "" La Nova Esquerra de l'Eixample"", ' Barcelona\n\n\n425', '000€\n\n\n435', '000 €\n\n2%\n\n\n\n3 bed.\n88 m²\n3rd floor exterior with lift\n\n\nCozy apartment in the heart of Eixample\nRenovated furnished apartment with 3 bedrooms']",calle de la Diputació,88 m²,3rd,with lift,,"Cozy apartment in the heart of Eixample
Renovated furnished apartment with 3 bedrooms, 3 double beds. Living room well decorated and good quality furniture. The appliances are new. The dining room connects with the living room and a balcony to Diputació street.
Located in the heart of the Eixample."
11,Flat,/en/inmueble/101029410/,"975,000€","[""\n\n\n\n\n\n\nFlat in La Dreta de l'Eixample"", ' Barcelona\n\n\n975', '000€\n\n\n1 bed.\n103 m²\n3rd floor exterior with lift\n\n\nPASEO DE GRACIA - GRAN VÍA modern brand new apartment on Paseo de Gracia', ' in the heart of Barcelona']",La Dreta de l'Eixample,103 m²,3rd,with lift,,"PASEO DE GRACIA - GRAN VÍA modern brand new apartment on Paseo de Gracia, in the heart of Barcelona, offers a unique and great investment opportunity as it has a tourist license with the possibility of accommodating five people. This magnificent apartment is distributed in such a way that it allows"
12,Flat,/en/inmueble/99803688/,"840,000€","['\n\n\n\n\n\n\nFlat in Sarrià', ' Barcelona\n\n\n840', '000€\nParking included\n\n\n5 bed.\n125 m²\n1st floor with lift\n\n\nMAYOR DE SARRIA - SAGRADO CORAZÓN SCHOOL in Living we present this property exclusively. Located in the heart of Sarriá', ' this property reflects the soul of Sarriá', ' its shops', ' its gastronomic offer', "" its schools... so comfortable and peaceful that coming home is... it's a pleasure! 111 m2 useful""]",Sarrià,125 m²,1st,lift,Parking included,"MAYOR DE SARRIA - SAGRADO CORAZÓN SCHOOL in Living we present this property exclusively. Located in the heart of Sarriá, this property reflects the soul of Sarriá, its shops, its gastronomic offer, its schools... so comfortable and peaceful that coming home is... it's a pleasure! 111 m2 useful, good"
13,Flat,/en/inmueble/100375294/,"550,000€","['\n\nFlat in ronda de la Universitat', "" La Dreta de l'Eixample"", ' Barcelona\n\n\n550', '000€\n\n\n3 bed.\n110 m²\n3rd floor interior with lift\n\n\nLive in the right in the center of the city', ' next to all kinds of services and public transportation. And do not worry about the noise', ' as this flat faces a quiet and luminous patio of the block.\nYou may want to do some updates in kitchen and bathrooms', ' but the apartment is ready to move in']",ronda de la Universitat,110 m²,3rd,with lift,,"Live in the right in the center of the city, next to all kinds of services and public transportation. And do not worry about the noise, as this flat faces a quiet and luminous patio of the block.
You may want to do some updates in kitchen and bathrooms, but the apartment is ready to move in, well m"
14,Detached,/en/inmueble/99673590/,"660,000€","['\n\nDetached house in Passatge de Núria', ' La Sagrada Família', ' Barcelona\n\n\n660', '000€\n\n\n5 bed.\n145 m²\n\n\nIn a private passageway in the heart of Eixample', ' an unbeatable location.\nHouse with 2 floors of 200m2', ' 157m2 useful plus a 43m2 terrace on two levels.\n5 bedrooms']",Passatge de Núria,145 m²,,,,"In a private passageway in the heart of Eixample, an unbeatable location.
House with 2 floors of 200m2, 157m2 useful plus a 43m2 terrace on two levels.
5 bedrooms, 4 doubles and a dressing room with fitted wardrobes. All rooms have windows to the outside. Double presidential suite with full bathroom"
15,Flat,/en/inmueble/100018689/,"169,100€","['\n\nFlat in calle de les Torres', ' Les Roquetes', ' Barcelona\n\n\n169', '100€\n\n\n4 bed.\n110 m²\n3rd floor exterior without lift\n\n\n110 m² apartment built 87 m² useful according to cadastre', ' third real floor without elevator', ' divided into living-dining room with access to balcony', ' independent kitchen', ' four bedrooms -two doubles and two singles- and bathroom. Community terrace.\nLocated in the heart of Barcelona']",calle de les Torres,110 m²,3rd,without lift,,"110 m² apartment built 87 m² useful according to cadastre, third real floor without elevator, divided into living-dining room with access to balcony, independent kitchen, four bedrooms -two doubles and two singles- and bathroom. Community terrace.
Located in the heart of Barcelona, very close to C-1"
16,Flat,/en/inmueble/101184322/,"649,000€","['\n\n\n\n\n\n\nFlat in calle de Rocafort', "" La Nova Esquerra de l'Eixample"", ' Barcelona\n\n\n649', '000€\n\n\n680']",calle de Rocafort,170 m²,1st,with lift,,"Bright apartment to refurbish in Eixample
propiedad This great apartment to be renovated is located in a corner building next to the new Super Illa. It's very spacious and bright due to its many windows. This apartment of 170 m2 consists of 5 rooms of which there are 3 double bedrooms and 2 individu"
17,Flat,/en/inmueble/101606351/,"350,000€","[""\n\n\n\n\n\n\nFlat in calle d'Emèrita Augusta"", ' La Maternitat i Sant Ramon', ' Barcelona\n\n\n350', ""000€\n\n\n4 bed.\n75 m²\n7th floor exterior with lift\n\n\nThis unfurnished flat is at Carrer d'Emèrita Augusta"", ' 08028', ' Barcelona', ' Barcelona', ' is in the district of Les Corts', ' on floor 7. It is a flat', ' built in 1969', "" that has 75 m2 of which 70 m2 are useful and has 4 rooms and 1 bathrooms.\nWatch the property's video at\nBesides"", ' it includes wardrobe']",calle d'Emèrita Augusta,75 m²,7th,with lift,,"This unfurnished flat is at Carrer d'Emèrita Augusta, 08028, Barcelona, Barcelona, is in the district of Les Corts, on floor 7. It is a flat, built in 1969, that has 75 m2 of which 70 m2 are useful and has 4 rooms and 1 bathrooms.
Watch the property's video at
Besides, it includes wardrobe, luminou"
18,Penthouse,/en/inmueble/101284656/,"1,140,000€","[""\n\n\n\n\n\n\nPenthouse in La Nova Esquerra de l'Eixample"", ' Barcelona\n\n\n1', '140', '000€\n\n\n5 bed.\n182 m²\n8th floor exterior with lift\n\n\nROSELLÓ-ENTENÇA in Living we present this extraordinary duplex penthouse located in one of the best areas of Eixample Izquierdo']",La Nova Esquerra de l'Eixample,182 m²,8th,with lift,,"ROSELLÓ-ENTENÇA in Living we present this extraordinary duplex penthouse located in one of the best areas of Eixample Izquierdo, very well connected and close to all services. This property enjoys an unbeatable terrace with afternoon sun in front of the living room and a spacious solarium with 360 d"
19,Flat,/en/inmueble/99966827/,"590,000€","['\n\nFlat in plaza de Sants', ' Sants', ' Barcelona\n\n\n590', '000€\n\n\n5 bed.\n165 m²\n14th floor exterior with lift\n\n\nIn the heart of Sants. Impressive apartment with 5 bedrooms and two bathrooms. Panoramic views', ' totally exterior. Sunny and very bright. Very coherent distribution']",plaza de Sants,165 m²,14th,with lift,,"In the heart of Sants. Impressive apartment with 5 bedrooms and two bathrooms. Panoramic views, totally exterior. Sunny and very bright. Very coherent distribution, with a large hall that leads us to a generous 25m2 living room from which we can access the kitchen and service room that together can"
20,Flat,/en/inmueble/100692923/,"295,355€","['\n\nFlat in calle de Còrsega', "" El Camp de l'Arpa del Clot"", ' Barcelona\n\n\n295', '355€\n\n\n4 bed.\n65 m²\n1st floor exterior with lift\n\n\nLLarcelona sells this fantastic apartment located on the second floor of a beautiful classic building with an elevator.\nThe house is distributed in 3 bedrooms (previously 4)', ' one double with access to a balcony and two singles', ' dining room', ' living room (former bedroom) with access to a balcony']",calle de Còrsega,65 m²,1st,with lift,,"LLarcelona sells this fantastic apartment located on the second floor of a beautiful classic building with an elevator.
The house is distributed in 3 bedrooms (previously 4), one double with access to a balcony and two singles, dining room, living room (former bedroom) with access to a balcony, hall"
21,Flat,/en/inmueble/84114683/,"1,600,000€","['\n\nFlat in rambla de Cataluña', ' Barcelona', "" La Dreta de l'Eixample"", ' Barcelona\n\n\n1', '600']",rambla de Cataluña,180 m²,6th,with lift,,"SuiteLife Barcelona Presents…. Ref
SLS0150 “Silk Pijamas” / Lovers in a Dangerous Time / Romeo and Juliette
You will love this top of the line apartment from the second you walk in and are charmed by it’s beautiful chevron hardwood flooring and it’s unique and sleek hallway. The flat is newly ren"
22,Flat,/en/inmueble/101620696/,"470,000€","[""\n\nFlat in calle d'Aragó"", "" La Dreta de l'Eixample"", ' Barcelona\n\n\n470', ""000€\n\n\n3 bed.\n79 m²\n6th floor exterior with lift\n\n\nHousing located in the Quadrat d'or"", "" in the dreta de l'eixample.\nIt has a total area of 84 square meters\nSeventh real floor with elevator.\nNatural light all day"", ' since the height of the house and its orientation to the South allow it.\nIt is distributed in 3 rooms']",calle d'Aragó,79 m²,6th,with lift,,"Housing located in the Quadrat d'or, in the dreta de l'eixample.
It has a total area of 84 square meters
Seventh real floor with elevator.
Natural light all day, since the height of the house and its orientation to the South allow it.
It is distributed in 3 rooms, all of them exterior.
Full 4-piece"
23,Flat,/en/inmueble/100979333/,"196,000€","['\n\nFlat in calle del Santuari', ' El Coll', ' Barcelona\n\n\n196', '000€\n\n\n3 bed.\n62 m²\n2nd floor exterior with lift\n\n\nOnce upon a time there was a beautiful apartment in the area of La Teixonera', ' in Barcelona.Located on Calle Santuario', ' this apartment renovated with excellent quality materials was the perfect home for anyone looking for a quiet space well located in the city.\nUpon entering the apartment']",calle del Santuari,62 m²,2nd,with lift,,"Once upon a time there was a beautiful apartment in the area of La Teixonera, in Barcelona.Located on Calle Santuario, this apartment renovated with excellent quality materials was the perfect home for anyone looking for a quiet space well located in the city.
Upon entering the apartment, one was s"
24,Flat,/en/inmueble/98932013/,"1,150,000€","['\n\nFlat in calle de Ganduxer', ' Les Tres Torres', ' Barcelona\n\n\n1', '150', '000€\nParking included\n\n\n4 bed.\n232 m²\n2nd floor exterior with lift\n\n\n200 m2 apartment and two terraces of 12 m2 and 16 m2 for sale on Calle Ganduxer in Barcelona.\nVery bright house with a facade facing three streets', ' distributed in:\nLarge hall', ' office-library']",calle de Ganduxer,232 m²,2nd,with lift,Parking included,"200 m2 apartment and two terraces of 12 m2 and 16 m2 for sale on Calle Ganduxer in Barcelona.
Very bright house with a facade facing three streets, distributed in:
Large hall, office-library, 40 m2 living-dining room with fireplace and exit to one of the terraces that is on the corner with the enti"
25,Flat,/en/inmueble/101609530/,"899,000€","[""\n\n\n\n\n\n\nFlat in L'Antiga Esquerra de l'Eixample"", ' Barcelona\n\n\n899', '000€\n\n\n3 bed.\n129 m²\n1st floor exterior with lift\n\n\nSpacious and centrally located', ' totally refurbished in Eixample\nWe present this spectacular newly refurbished flat', ' in one of the most central areas of the city', ' considered by many', ' the heart of Barcelona with a large collection of modernist buildings.\nOn entering we find a spacious hall']",L'Antiga Esquerra de l'Eixample,129 m²,1st,with lift,,"Spacious and centrally located, totally refurbished in Eixample
We present this spectacular newly refurbished flat, in one of the most central areas of the city, considered by many, the heart of Barcelona with a large collection of modernist buildings.
On entering we find a spacious hall, which give"
26,Penthouse,/en/inmueble/99733525/,"725,000€","['\n\nPenthouse in paseo de Sant Joan', "" El Camp d'En Grassot i Gràcia Nova"", ' Barcelona\n\n\n725', '000€\n\n\n750', '000 €\n\n3%\n\n\n\n3 bed.\n99 m²\n9th floor exterior with lift\n\n\nLocated on one of the most beautiful and sought-after promenades in Barcelona']",paseo de Sant Joan,99 m²,9th,with lift,,"Located on one of the most beautiful and sought-after promenades in Barcelona, we present this exclusive penthouse due to its two level terraces (one currently covered) and its beautiful and unobstructed views of the Sagrada Familia and also Passeig de Sant Joan.
It is located on the ninth floor of"
27,Penthouse,/en/inmueble/100797571/,"195,000€","['\n\nPenthouse in santa rosalia', ' La Teixonera', ' Barcelona\n\n\n195', '000€\n\n\n2 bed.\n65 m²\n4th floor exterior without lift\n\n\nMagnificent Penthouse of 45 M2.\n1 Terrace of 20 M2. + Office on the terrace.\n1 Balcony (adjacent to C/ Cardedeu-Veciana).\nDispose of:\nLiving room.\n2 rooms.\nBathroom with shower.\nKitchen ( Exterior views ).\nAluminum enclosures.\nIt has an alarm', ' security door.\nVery bright.\nFarm in perfect condition']",santa rosalia,65 m²,4th,without lift,,"Magnificent Penthouse of 45 M2.
1 Terrace of 20 M2. + Office on the terrace.
1 Balcony (adjacent to C/ Cardedeu-Veciana).
Dispose of:
Living room.
2 rooms.
Bathroom with shower.
Kitchen ( Exterior views ).
Aluminum enclosures.
It has an alarm, security door.
Very bright.
Farm in perfect condition,"
28,Duplex,/en/inmueble/101392682/,"1,095,000€","['\n\n\n\n\n\n\nDuplex in El Poble Sec - Parc de Montjuïc', ' Barcelona\n\n\n1', '095', '000€\n\n\n5 bed.\n189 m²\n5th floor exterior with lift\n\n\nCENTURY21 WELHOME exclusively sells this unique DUPLEX PENTHOUSE.Framed in the center of Barcelona', ' 5 minutes from Pça.Spain and a 15-minute walk from Pça Catalunya and La Rambla', ' we find this unique piece of its kind\nIt is a house with 5 bedrooms']",El Poble Sec - Parc de Montjuïc,189 m²,5th,with lift,,"CENTURY21 WELHOME exclusively sells this unique DUPLEX PENTHOUSE.Framed in the center of Barcelona, 5 minutes from Pça.Spain and a 15-minute walk from Pça Catalunya and La Rambla, we find this unique piece of its kind
It is a house with 5 bedrooms, 2 bathrooms and 1 toilet.On the lower floor the da"
29,Flat,/en/inmueble/99561116/,"110,000€","['\n\n\n\n\n\n\nFlat in camino de la Verneda', ' La Verneda i la Pau', ' Barcelona\n\n\n110', '000€\n\n\n120', '000 €\n\n8%\n\n\n\n2 bed.\n51 m²\n2nd floor exterior with lift\n\n\nAPARTMENT OCCUPIED BY PERSON WITHOUT FAIR TITLE THIS PROPERTY DUE TO ITS OCCUPATIONAL STATE DOES NOT ALLOW VISITS 51 m² apartment', ' according to Cadastre']",cam,51 m²,2nd,with lift,,"APARTMENT OCCUPIED BY PERSON WITHOUT FAIR TITLE THIS PROPERTY DUE TO ITS OCCUPATIONAL STATE DOES NOT ALLOW VISITS 51 m² apartment, according to Cadastre, distributed in several units. It is a 2nd floor in a block with an elevator. Well connected by public transport and road. There are all kinds of s"
30,Penthouse,/en/inmueble/100797571/,"195,000€","['\n\nPenthouse in santa rosalia', ' La Teixonera', ' Barcelona\n\n\n195', '000€\n\n\n2 bed.\n65 m²\n4th floor exterior without lift\n\n\nMagnificent Penthouse of 45 M2.\n1 Terrace of 20 M2. + Office on the terrace.\n1 Balcony (adjacent to C/ Cardedeu-Veciana).\nDispose of:\nLiving room.\n2 rooms.\nBathroom with shower.\nKitchen ( Exterior views ).\nAluminum enclosures.\nIt has an alarm', ' security door.\nVery bright.\nFarm in perfect condition']",santa rosalia,65 m²,4th,without lift,,"Magnificent Penthouse of 45 M2.
1 Terrace of 20 M2. + Office on the terrace.
1 Balcony (adjacent to C/ Cardedeu-Veciana).
Dispose of:
Living room.
2 rooms.
Bathroom with shower.
Kitchen ( Exterior views ).
Aluminum enclosures.
It has an alarm, security door.
Very bright.
Farm in perfect condition,"
31,Penthouse,/en/inmueble/98512318/,"190,000€","['\n\n\n\n\n\n\nPenthouse in El Carmel', ' Barcelona\n\n\n190', '000€\n\n\n195', '000 €\n\n3%\n\n\n\n3 bed.\n69 m²\n4th floor exterior\n\n\nPENTHOUSE IN C/LUGO WITH LARGE TERRACE. The penthouse that we offer you has 3 rooms on the top floor of the building without neighbors. The 25 m2 terrace has views over all of Barcelona']",El Carmel,69 m²,4th,,,"PENTHOUSE IN C/LUGO WITH LARGE TERRACE. The penthouse that we offer you has 3 rooms on the top floor of the building without neighbors. The 25 m2 terrace has views over all of Barcelona, with a view of the sea. It has a large renovated kitchen. Renovated bathroom. Radiator heating. Parquet floor. Ve"
32,Flat,/en/inmueble/101604431/,"690,000€","['\n\n\n\n\n\n\nFlat in calle de la Fruita', ' El Gòtic', ' Barcelona\n\n\n690']",calle de la Fruita,135 m²,1st,with lift,,"We present this newly renovated apartment in a very quiet street in the emblematic Gothic Quarter.
The property is very spacious and is divided into two areas: day area and night area.
Upon entering we find a large entrance hall that leads to a hallway that leads to a large living room with an ope"
33,Flat,/en/inmueble/101615268/,"315,000€","['\n\nFlat in calle de Chapí', ' Horta', ' Barcelona\n\n\n315', '000€\nParking included\n\n\n2 bed.\n86 m²\nGround floor with lift\n\n\nBright duplex with terrace. Under duplex that you can access directly from Chapí street', ' it is located in a 2003 farm', ' very well preserved. It offers you bright spaces', ' with a very good distribution and use of its spaces. It is an exterior property with neighboring low-rise farms']",calle de Chapí,86 m²,Ground,lift,Parking included,"Bright duplex with terrace. Under duplex that you can access directly from Chapí street, it is located in a 2003 farm, very well preserved. It offers you bright spaces, with a very good distribution and use of its spaces. It is an exterior property with neighboring low-rise farms, both on the façade"
