,type,reference,price,district,street,area,plant,lift,parking,description
197,Flat,/en/inmueble/101189920/,"1,050,000€","[""\n\n\n\n\n\n\nFlat in La Dreta de l'Eixample"", ' Barcelona\n\n\n1', '050', '000€\n\n\n5 bed.\n209 m²\n exterior with lift\n\n\nTurn this spacious apartment to renovate into the home of your dreams. Located on the top floor of a period building with an lift', ' this beautiful property offers you an unbeatable location in the heart of Barcelona', ' with impressive views of the Arc de Triomf.\nBuilt with an area of 209 m2']",La Dreta de l'Eixample,209 m²,,,,"Turn this spacious apartment to renovate into the home of your dreams. Located on the top floor of a period building with an lift, this beautiful property offers you an unbeatable location in the heart of Barcelona, with impressive views of the Arc de Triomf.
Built with an area of 209 m2, this apa"
198,Flat,/en/inmueble/101206218/,"230,000€","['\n\nFlat in Sants', ' Barcelona\n\n\n230', '000€\n\n\n2 bed.\n80 m²\nMezzanine exterior without lift\n\n\nHABITAT VITAL', ' exclusively presents the sale of this fantastic property:\nHousing', ' from ____________________', ' (according to cadastre)', ' cozy and functional housing.\nThe property is located in the Sants neighborhood.\nIt is distributed as follows: entrance hall', ' large kitchen', ' living room', ' bathroom']",Sants,80 m²,Mezzanine,lift,,"HABITAT VITAL, exclusively presents the sale of this fantastic property:
Housing, from ____________________, (according to cadastre), cozy and functional housing.
The property is located in the Sants neighborhood.
It is distributed as follows: entrance hall, large kitchen, living room, bathroom,"
199,Flat,/en/inmueble/90407835/,"795,000€","['\n\n\n\n\n\n\nFlat in El Gòtic', ' Barcelona\n\n\n795', '000€\n\n\n950', '000 €\n\n16%\n\n\n\n2 bed.\n88 m²\n1st floor exterior with lift\n\n\nLocated in ‘Via Laietana’', ' in the cultural heart of Barcelona', ' ‘El Gòtic’', ' in an area surrounded by services and shops of all kinds']",El Gòtic,88 m²,1st,with lift,,"Located in ‘Via Laietana’, in the cultural heart of Barcelona, ‘El Gòtic’, in an area surrounded by services and shops of all kinds, we find this fantastic totally refurbished 88sq m apartment. It offers a spacious living-dining room with open fully equipped induction kitchen and separate laundry ar"
200,Flat,/en/inmueble/101110964/,"250,000€","[""\n\n\n\n\n\n\nFlat in El Camp de l'Arpa del Clot"", ' Barcelona\n\n\n250', '000€\n\n\n259', ""000 €\n\n3%\n\n\n\n3 bed.\n69 m²\n1st floor exterior without lift\n\n\nCharming flat in Camp de l'Arpa del Clot\nBeautiful apartment located in a century-old estate"", "" built in 1920 in the Camp de l'Arpa del Clot neighborhood"", ' just steps away from Sagrada Familia.\nThe property has 73m2 built square meters and 69m2 useful square meters. Upon entering we find the day area']",El Camp de l'Arpa del Clot,69 m²,1st,without lift,,"Charming flat in Camp de l'Arpa del Clot
Beautiful apartment located in a century-old estate, built in 1920 in the Camp de l'Arpa del Clot neighborhood, just steps away from Sagrada Familia.
The property has 73m2 built square meters and 69m2 useful square meters. Upon entering we find the day area,"
201,Flat,/en/inmueble/92377661/,"1,350,000€","['\n\n\n\n\n\n\nFlat in calle Nou de la Rambla', ' El Raval', ' Barcelona\n\n\n1', '350', '000€\n\n\n5 bed.\n263 m²\n1st floor exterior without lift\n\n\nTwo steps away from the Ramblas and the Liceo', ' in a 1910 building with few neighbours', ' is located this large flat completely renovated', ' with interior courtyard', ' bright and completely soundproof. This property can be segregated.\nThe property', ' with 242 interior built sqm']",calle Nou de la Rambla,263 m²,1st,without lift,,"Two steps away from the Ramblas and the Liceo, in a 1910 building with few neighbours, is located this large flat completely renovated, with interior courtyard, bright and completely soundproof. This property can be segregated.
The property, with 242 interior built sqm, consists of 4 bedrooms (2 su"
202,Flat,/en/inmueble/100521534/,"376,000€","['\n\n\n\n\n\n\nFlat in calle del Príncep de Viana', ' El Raval', ' Barcelona\n\n\n376', '000€\n\n\n2 bed.\n60 m²\n1st floor exterior with lift\n\n\nThis flat is at Carrer del Príncep de Viana', ' 08001', ' Barcelona', ' Barcelona']",calle del Príncep de Viana,60 m²,1st,with lift,,"This flat is at Carrer del Príncep de Viana, 08001, Barcelona, Barcelona, on floor 2. It is a flat that has 60 m2 and has 2 rooms and 1 bathrooms.
It has balcón and ascensor."
203,Flat,/en/inmueble/101182749/,"365,000€","['\n\n\n\n\n\n\nFlat in Sants', ' Barcelona\n\n\n365', '000€\nGarage optional 125', '000 €\n\n\n380', '000 €\n\n4%\n\n\n\n2 bed.\n116 m²\n exterior without lift\n\n\nEngel & Völkers presenta aquest exclusiu pis al barri de Sants\nEngel&Volkers presents this exclusive property', ' located in one of the most emblematic areas of Sants. It is a completely renovated ground floor tract with a total of 116m2 (76m2 habitat']",Sants,116 m²,,,"Garage optional 125,000 €","Engel & Völkers presenta aquest exclusiu pis al barri de Sants
Engel&Volkers presents this exclusive property, located in one of the most emblematic areas of Sants. It is a completely renovated ground floor tract with a total of 116m2 (76m2 habitat, and 40m2 garden). It is a tract of a unique habita"
204,Detached,/en/inmueble/99880656/,"5,000,000€","['\n\n\n\n\n\n\nDetached house in Sant Gervasi - La Bonanova', ' Barcelona\n\n\n5', '000', '000€\nParking included\n\n\n6 bed.\n639 m²\n\n\nBeautiful Modernist house in Sant Gervasi\nThis is a beautiful Modernist style house completely renovated', ' with private garden and outdoor saltwater pool.\nThe house enjoys total privacy and the natural light that are distributed throughout it', ' as well as many other virtues']",Sant Gervasi - La Bonanova,639 m²,,,Parking included,"Beautiful Modernist house in Sant Gervasi
This is a beautiful Modernist style house completely renovated, with private garden and outdoor saltwater pool.
The house enjoys total privacy and the natural light that are distributed throughout it, as well as many other virtues, are one of its main value"
205,Flat,/en/inmueble/100469291/,"420,000€","['\n\n\n\n\n\n\nFlat in Sant Gervasi - Galvany', ' Barcelona\n\n\n420', '000€\n\n\n2 bed.\n74 m²\n7th floor exterior with lift\n\n\nSunny high apartment with terrace in Aribau\nEngel & Völkers presents this comfortable high-rise and bright apartment with a fantastic terrace.\nThe apartment has a very rational distribution and good use of spaces. As it is a very high floor', ' it has a lot of light']",Sant Gervasi - Galvany,74 m²,7th,with lift,,"Sunny high apartment with terrace in Aribau
Engel & Völkers presents this comfortable high-rise and bright apartment with a fantastic terrace.
The apartment has a very rational distribution and good use of spaces. As it is a very high floor, it has a lot of light, which gives it a lot of joy and com"
206,Flat,/en/inmueble/99625804/,"808,000€","[""\n\n\n\n\n\n\nFlat in L'Antiga Esquerra de l'Eixample"", ' Barcelona\n\n\n808']",L'Antiga Esquerra de l'Eixample,123 m²,1st,with lift,,"Stylish apartment near Plaça Universitat
This bright and elegant apartment on the first floor (a real third floor) facing northwest is part of a Great Refurbishment in a magnificent 1900 Regal Estate building located near plaça Universitat. All of the details of this refurbishment have been taken ca"
207,Flat,/en/inmueble/100735426/,"2,200,000€","['\n\n\n\n\n\n\nFlat in Sant Gervasi - Galvany', ' Barcelona\n\n\n2', '200']",Sant Gervasi - Galvany,338 m²,3rd,with lift,Parking included,"Elegance and luxury in Reina Victoria
In one of the best streets of Barcelona we find this great apartment of more than 330 meters a few steps from the Turo Parc. It is an apartment located on the prestigious Reina Victoria street in which its homes are characterized by elegance and luxury both in t"
208,Flat,/en/inmueble/98991184/,"725,000€","[""\n\n\n\n\n\n\nFlat in L'Antiga Esquerra de l'Eixample"", ' Barcelona\n\n\n725', '000€\n\n\n4 bed.\n134 m²\n3rd floor exterior with lift\n\n\nExcellent flat near Francesc Macià\nSpacious and updated flat of approximately 134sq m of total built surface and with most of the rooms exterior', ' in an unbeatable location of the city', ' close to Francesc Macià']",L'Antiga Esquerra de l'Eixample,134 m²,3rd,with lift,,"Excellent flat near Francesc Macià
Spacious and updated flat of approximately 134sq m of total built surface and with most of the rooms exterior, in an unbeatable location of the city, close to Francesc Macià, Turó Park and Av. Josep Tarradellas. This flat is ideal for optimal comfort due to the pos"
209,Flat,/en/inmueble/99791671/,"960,000€","['\n\n\n\n\n\n\nFlat in El Gòtic', ' Barcelona\n\n\n960', '000€\n\n\n3 bed.\n166 m²\n3rd floor exterior with lift\n\n\nCharming 3 apartments on Las Ramblas\nRenovated building of only 5 levels with lift and balconies overlooking the Boqueria Market.\nThis unit located on the third floor', ' a real fourth floor']",El Gòtic,166 m²,3rd,with lift,,"Charming 3 apartments on Las Ramblas
Renovated building of only 5 levels with lift and balconies overlooking the Boqueria Market.
This unit located on the third floor, a real fourth floor, are 3 renovated apartments ready to rent. They are sell as a single unit. Each apartment has a fully equipped"
210,Flat,/en/inmueble/85716462/,"1,580,000€","[""\n\n\n\n\n\n\nFlat in La Dreta de l'Eixample"", ' Barcelona\n\n\n1', '580', '000€\nParking included\n\n\n3 bed.\n174 m²\n5th floor exterior with lift\n\n\nExclusive flat with terrace in Rambla Catalunya\nLocated in a traditional building from the beginning of the 20th century', ' in the prestigious Rambla Catalunya', ' the flat is located on an upper floor that belongs to a rise of the year 2016']",La Dreta de l'Eixample,174 m²,5th,with lift,Parking included,"Exclusive flat with terrace in Rambla Catalunya
Located in a traditional building from the beginning of the 20th century, in the prestigious Rambla Catalunya, the flat is located on an upper floor that belongs to a rise of the year 2016, perfectly integrated into the original building. The price inc"
211,Flat,/en/inmueble/99170339/,"440,000€","['\n\n\n\n\n\n\nFlat in El Raval', ' Barcelona\n\n\n440', '000€\n\n\n3 bed.\n110 m²\n3rd floor exterior with lift\n\n\nApartment close to Las Ramblas and the Sea\nExcellent apartment located in fantastic Nuñez y Navarro estate', ' built in 2006. It has a swimming pool and solarium on the communal terrace', ' solar panel system to heat the water of the property and video intercom.\nFully equipped']",El Raval,110 m²,3rd,with lift,,"Apartment close to Las Ramblas and the Sea
Excellent apartment located in fantastic Nuñez y Navarro estate, built in 2006. It has a swimming pool and solarium on the communal terrace, solar panel system to heat the water of the property and video intercom.
Fully equipped, with ducted air conditionin"
212,Flat,/en/inmueble/101198896/,"1,650,000€","['\n\n\n\n\n\n\nFlat in Pedralbes', ' Barcelona\n\n\n1', '650', '000€\nParking included\n\n\n1', '700', '000 €\n\n3%\n\n\n\n3 bed.\n154 m²\n3rd floor exterior with lift\n\n\nRenovated apartment with parking and pool in Pedralbes\nExclusive aparment in Pedralbes', ' building with garden', ' pool and parking space.\nSpectacular home of 145 m2 built', ' plus 13 m2 of terrace and 26 m2 of community areas. A parking space for car included in the price.\nThis magnificent home']",Pedralbes,154 m²,3rd,with lift,Parking included,"Renovated apartment with parking and pool in Pedralbes
Exclusive aparment in Pedralbes, building with garden, pool and parking space.
Spectacular home of 145 m2 built, plus 13 m2 of terrace and 26 m2 of community areas. A parking space for car included in the price.
This magnificent home, which is b"
213,Flat,/en/inmueble/100743451/,"1,240,000€","['\n\n\n\n\n\n\nFlat in El Gòtic', ' Barcelona\n\n\n1', '240', '000€\n\n\n6 bed.\n232 m²\n4th floor exterior with lift\n\n\nPenthouse in the Gothic with large terrace\nUnique opportunity in the area. Two penthouses in a spectacular property next to Plaça de la Mercé', ' Medinacelli and Soho House', ' two streets away from the seafront.\nWe present two penthouses of 82 and 100 metres approximately']",El Gòtic,232 m²,4th,with lift,,"Penthouse in the Gothic with large terrace
Unique opportunity in the area. Two penthouses in a spectacular property next to Plaça de la Mercé, Medinacelli and Soho House, two streets away from the seafront.
We present two penthouses of 82 and 100 metres approximately, with a total of 6 bedrooms and"
214,Penthouse,/en/inmueble/91480010/,"950,000€","['\n\n\n\n\n\n\nPenthouse in Sarrià', ' Barcelona\n\n\n950', '000€\nGarage optional 30', '000 €\n\n\n2 bed.\n124 m²\n6th floor exterior with lift\n\n\nBeautiful Penthouse in Sarria\nIn the wonderful and residential neighborhood of Sarrià', ' surrounded by shops', ' restaurants and very close to large green areas']",Sarrià,124 m²,6th,with lift,"Garage optional 30,000 €","Beautiful Penthouse in Sarria
In the wonderful and residential neighborhood of Sarrià, surrounded by shops, restaurants and very close to large green areas, we find this exclusive recently renovated penthouse.
We access the apartment and from the first moment we can appreciate the magnificent lumino"
215,Detached,/en/inmueble/98213494/,"2,795,000€","['\n\n\n\n\n\n\nDetached house in Sant Gervasi - La Bonanova', ' Barcelona\n\n\n2', '795']",Sant Gervasi - La Bonanova,934 m²,,,,"Wonderful catalogued house
Located in Sant Gervasi district there is this beautiful house ideal for residencial or workplace with wonderful views of the city and Tibidabo Mountain. The house is completely refurbished and it´s distributed in four floors with large spaces for work and meetings. It has"
216,Flat,/en/inmueble/100763910/,"1,150,000€","[""\n\n\n\n\n\n\nFlat in La Dreta de l'Eixample"", ' Barcelona\n\n\n1', '150', '000€\n\n\n4 bed.\n221 m²\n2nd floor exterior with lift\n\n\nExceptional flat to refurbish in Eixample\nIt is located in a beautiful', ' well-preserved historic building from 1910 built by the renowned architect Juli Batllevell']",La Dreta de l'Eixample,221 m²,2nd,with lift,,"Exceptional flat to refurbish in Eixample
It is located in a beautiful, well-preserved historic building from 1910 built by the renowned architect Juli Batllevell, a disciple of Antoni Gaudí.
The flat is distributed on a typical Eixample plan floor that faces the street on one side and a cozy and qu"
217,Flat,/en/inmueble/100625805/,"1,490,000€","['\n\n\n\n\n\n\nFlat in Sant Gervasi - Galvany', ' Barcelona\n\n\n1', '490', '000€\nParking included\n\n\n6 bed.\n248 m²\n3rd floor exterior with lift\n\n\nElegant flat in Turó Parc\nThis elegant property is located in a classic building', ' in one of the most prestigious streets of Barcelona', ' right next to the Turó Parc. The flat has large spaces', ' among which we find a large hall', ' a beautiful living room with three areas']",Sant Gervasi - Galvany,248 m²,3rd,with lift,Parking included,"Elegant flat in Turó Parc
This elegant property is located in a classic building, in one of the most prestigious streets of Barcelona, right next to the Turó Parc. The flat has large spaces, among which we find a large hall, a beautiful living room with three areas, a spacious kitchen with an office"
218,Flat,/en/inmueble/100757414/,"325,000€","['\n\n\n\n\n\n\nFlat in plaza Cosmos', ' El Carmel', ' Barcelona\n\n\n325', '000€\nGarage optional 20', '000 €\n\n\n345', '000 €\n\n6%\n\n\n\n3 bed.\n93 m²\n1st floor exterior with lift\n\n\nApartment with terrace and views in La Teixonera\nEngel&Völkers exclusively presents this beautiful exterior apartment with terrace and parking. It is an apartment with double orientation', ' very bright', ' located on the first floor of a building from 2008']",plaza Cosmos,93 m²,1st,with lift,"Garage optional 20,000 €","Apartment with terrace and views in La Teixonera
Engel&Völkers exclusively presents this beautiful exterior apartment with terrace and parking. It is an apartment with double orientation, very bright, located on the first floor of a building from 2008, with parking on the same building for cars and"
219,Flat,/en/inmueble/101597208/,"515,000€","['\n\n\n\n\n\n\nFlat in El Raval', ' Barcelona\n\n\n515', '000€\n\n\n2 bed.\n115 m²\n5th floor exterior with lift\n\n\nFabulous flat in Tallers street in Raval\nIn the heart of the old quarter of Barcelona', ' next to Las Ramblas', ' we find this fabulous apartment of 115 square meters.\nThe property is perfectly divided through a large corridor', ' in night zone and day zone. It consists of two double bedrooms']",El Raval,115 m²,5th,with lift,,"Fabulous flat in Tallers street in Raval
In the heart of the old quarter of Barcelona, next to Las Ramblas, we find this fabulous apartment of 115 square meters.
The property is perfectly divided through a large corridor, in night zone and day zone. It consists of two double bedrooms, one with a lar"
220,Duplex,/en/inmueble/101398852/,"1,190,000€","['\n\nDuplex in Sant Gervasi - Galvany', ' Barcelona\n\n\n1', '190', '000€\nParking included\n\n\n7 bed.\n230 m²\n2nd floor exterior with lift\n\n\n230m2 duplex in Sarria Sant Gervasi next to Vía Augusta and Ganduxer street\nIn a stately estate with a pool and common area we find a house on two floors in the best area of Sant Gervasi next to Via Augusta', ' with all services.\nThese are two entities', ' currently a house with 6 bedrooms', ' 3 bathrooms']",Sant Gervasi - Galvany,230 m²,2nd,with lift,Parking included,"230m2 duplex in Sarria Sant Gervasi next to Vía Augusta and Ganduxer street
In a stately estate with a pool and common area we find a house on two floors in the best area of Sant Gervasi next to Via Augusta, with all services.
These are two entities, currently a house with 6 bedrooms, 3 bathrooms,"
221,Flat,/en/inmueble/99728338/,"475,000€","['\n\n\n\n\n\n\nFlat in El Raval', ' Barcelona\n\n\n475', '000€\n\n\n2 bed.\n120 m²\n3rd floor exterior with lift\n\n\nFlat in a renovated regal building with elevator\nThis charming flat is found in a 4th floor of a 1936 regal building', ' located in old town Barcelona', ' in the emblematic district of Ciutat Vella', ' part of one of the oldest neighbourhoods in the city of Barcelona']",El Raval,120 m²,3rd,with lift,,"Flat in a renovated regal building with elevator
This charming flat is found in a 4th floor of a 1936 regal building, located in old town Barcelona, in the emblematic district of Ciutat Vella, part of one of the oldest neighbourhoods in the city of Barcelona, El Raval.
The building has undergone a"
222,Flat,/en/inmueble/101140475/,"1,590,000€","[""\n\n\n\n\n\n\nFlat in La Dreta de l'Eixample"", ' Barcelona\n\n\n1', '590']",La Dreta de l'Eixample,185 m²,5th,with lift,,"Fabulous apartment in the best part of Barcelona
Engel & Völkers presents this spectacular 185 square meter property for sale located in the heart of Eixample. The apartment is located on the fifth floor of the building built in 1950 that offers stunning views of the Casa de les Punxes.
The apartmen"
223,Flat,/en/inmueble/88934232/,"370,000€","['\n\n\n\n\n\n\nFlat in Sant Pere - Santa Caterina i la Ribera', ' Barcelona\n\n\n370', '000€\n\n\n1 bed.\n65 m²\n2nd floor exterior with lift\n\n\nSpacious renovated apartment in Born\nThis spacious flat has undergone an extensive renovation that has maximized the space and integrated the luxuries of a modern property. With high ceilings notable of the principal level']",Sant Pere - Santa Cater,65 m²,2nd,with lift,,"Spacious renovated apartment in Born
This spacious flat has undergone an extensive renovation that has maximized the space and integrated the luxuries of a modern property. With high ceilings notable of the principal level, the natural light travels throughout the property and imparts a sensation of"
224,Penthouse,/en/inmueble/100157413/,"525,000€","['\n\n\n\n\n\n\nPenthouse in El Gòtic', ' Barcelona\n\n\n525', '000€\n\n\n2 bed.\n75 m²\n5th floor exterior with lift\n\n\nPenthouse with terrace in the Gòtic\nCompletely renovated penthouse in the Gothic Quarter in a regal 1885 building with elevator.\nThis penthouse of 65m2', ' is distributed in a spacious living room with open kitchen. A bedroom of 17m2 and an office/study of 10m2. Housing completely renovated brand new']",El Gòtic,75 m²,5th,with lift,,"Penthouse with terrace in the Gòtic
Completely renovated penthouse in the Gothic Quarter in a regal 1885 building with elevator.
This penthouse of 65m2, is distributed in a spacious living room with open kitchen. A bedroom of 17m2 and an office/study of 10m2. Housing completely renovated brand new,"
225,Flat,/en/inmueble/97398481/,"570,000€","[""\n\n\n\n\n\n\nFlat in L'Antiga Esquerra de l'Eixample"", ' Barcelona\n\n\n570', '000€\n\n\n3 bed.\n117 m²\n4th floor exterior with lift\n\n\nFantastic property in Eixample Esquerra\nEngel and Völkers presents a classic property that preserves the high ceilings with mouldings on the living room from the beginning of the last century. The property has 117 sqm']",L'Antiga Esquerra de l'Eixample,117 m²,4th,with lift,,"Fantastic property in Eixample Esquerra
Engel and Völkers presents a classic property that preserves the high ceilings with mouldings on the living room from the beginning of the last century. The property has 117 sqm, three double bedrooms and two bathrooms. The property also has 5 balconies and a"
226,Flat,/en/inmueble/93738105/,"1,450,000€","['\n\n\n\n\n\n\nFlat in Sant Gervasi - Galvany', ' Barcelona\n\n\n1', '450', '000€\nParking included\n\n\n4 bed.\n200 m²\n4th floor exterior with lift\n\n\nFantastic high apartment near Turó Parc\nIn an excellent location in the Galvany neighborhood', ' in one of the most prestigious streets and close to Turó Parc', ' we present this magnificent high and bright apartment thanks to its double orientation. Apartment of approximately 200sqm built']",Sant Gervasi - Galvany,200 m²,4th,with lift,Parking included,"Fantastic high apartment near Turó Parc
In an excellent location in the Galvany neighborhood, in one of the most prestigious streets and close to Turó Parc, we present this magnificent high and bright apartment thanks to its double orientation. Apartment of approximately 200sqm built, with spacious"
227,Flat,/en/inmueble/100231770/,"299,000€","['\n\n\n\n\n\n\nFlat in Vila de Gràcia', ' Barcelona\n\n\n299', '000€\n\n\n1 bed.\n77 m²\nGround floor exterior with lift\n\n\nDesign loft in the heart of Vila de Gràcia\nPreserving all the energy and creativity of what was once an art gallery', ' we find this beautiful designer loft on the first floor of a 1979 building in the prestigious Verdi street', ' a few steps from the Plaça del Nord.\nUpon entering']",Vila de Gràcia,77 m²,Ground,with lift,,"Design loft in the heart of Vila de Gràcia
Preserving all the energy and creativity of what was once an art gallery, we find this beautiful designer loft on the first floor of a 1979 building in the prestigious Verdi street, a few steps from the Plaça del Nord.
Upon entering, the hall gives way to"
228,Flat,/en/inmueble/83950120/,"1,040,000€","['\n\n\n\n\n\n\nFlat in El Gòtic', ' Barcelona\n\n\n1', '040']",El Gòtic,178 m²,2nd,with lift,,"Charming 2 flats on Ramblas
Newly renovated 2 apartments in one of the most emblematic streets of the city. Entering you find on the right a modern kitchen with quality finishes and Siemens brand in all appliances. On the left we find a spacious living room with 2 large windows and a balcony that ru"
229,Flat,/en/inmueble/101278025/,"420,000€","['\n\n\n\n\n\n\nFlat in Sarrià', ' Barcelona\n\n\n420', '000€\n\n\n450', '000 €\n\n7%\n\n\n\n3 bed.\n87 m²\n1st floor exterior without lift\n\n\nBright apartment in Plaza Artòs de Sarrià\nIt is a flat to reform in the Artos de Sarrià square. The house has three exterior rooms to patio or street']",Sarrià,87 m²,1st,without lift,,"Bright apartment in Plaza Artòs de Sarrià
It is a flat to reform in the Artos de Sarrià square. The house has three exterior rooms to patio or street, and a bathroom of a good measure.
The apartment is a first floor and with the possibility of a reform obtaining two bathrooms.
On the farm they are a"
230,Flat,/en/inmueble/94943374/,"770,000€","['\n\n\n\n\n\n\nFlat in El Gòtic', ' Barcelona\n\n\n770', '000€\n\n\n3 bed.\n101 m²\n4th floor exterior with lift\n\n\nPenthouse in the Gotico\nAmazing penthouse in a modernist building from 1900 with lift', ' completly rehabilitated in 2011. Unique in Barcelona', ' in which we can consider the best building in Gotico.\nDistributed in a big living room with exit to a balcony', ' open kitchen. Three double bedrooms']",El Gòtic,101 m²,4th,with lift,,"Penthouse in the Gotico
Amazing penthouse in a modernist building from 1900 with lift, completly rehabilitated in 2011. Unique in Barcelona, in which we can consider the best building in Gotico.
Distributed in a big living room with exit to a balcony, open kitchen. Three double bedrooms, all exterio"
