,type,reference,price,district,street,area,plant,lift,parking,description
99,Flat,/en/inmueble/101129215/,"135,500€","[""\n\n\n\n\n\n\nFlat in calle d'Andrade"", ' La Verneda i la Pau', ' Barcelona\n\n\n135', '500€\n\n\n148', '500 €\n\n9%\n\n\n\n3 bed.\n69 m²\n4th floor without lift\n\n\nFloor 4th', ' flat total surface area 69 m²', ' usable floor area 59 m²', ' single bedrooms: 1', ' double bedrooms: 2', ' 1 bathrooms', ' age over 50 years', ' built-in wardrobes']",calle d'Andrade,69 m²,4th,lift,,"Floor 4th, flat total surface area 69 m², usable floor area 59 m², single bedrooms: 1, double bedrooms: 2, 1 bathrooms, age over 50 years, built-in wardrobes, ext. woodwork (aluminum)."
100,Flat,/en/inmueble/101501195/,"330,000€","['\n\n\n\n\n\n\nFlat in calle de Mallorca', ' La Sagrada Família', ' Barcelona\n\n\n330', '000€\n\n\n2 bed.\n59 m²\n2nd floor exterior with lift\n\n\nUnique brand new home!\nClikalia puts this 59 m2 exterior property for sale under renovation.It is located on the 2nd floor with a lift', ' on Calle Mallorca']",calle de Mallorca,59 m²,2nd,with lift,,"Unique brand new home!
Clikalia puts this 59 m2 exterior property for sale under renovation.It is located on the 2nd floor with a lift, on Calle Mallorca, in the Sagrada Familia.
The house is being completely renovated and is represented by hyper-realistic images subject to possible modifications"
101,Flat,/en/inmueble/100740676/,"895,000€","['\n\n\n\n\n\n\nFlat in calle de Laforja', ' Sant Gervasi - Galvany', ' Barcelona\n\n\n895', '000€\n\n\n3 bed.\n170 m²\n7th floor exterior with lift\n\n\n170 m2 apartment with three bedrooms and two bathrooms located on the sixth floor of a 1945 building with two elevators and concierge service. It is a unique opportunity for those buyers who want a property to put to their liking.\nCurrently']",calle de Laforja,170 m²,7th,with lift,,"170 m2 apartment with three bedrooms and two bathrooms located on the sixth floor of a 1945 building with two elevators and concierge service. It is a unique opportunity for those buyers who want a property to put to their liking.
Currently, the property consists of a large 30 m2 living room that"
102,Flat,/en/inmueble/101526370/,"500,000€","['\n\n\n\n\n\n\nFlat in calle de Casp', ' El Fort Pienc', ' Barcelona\n\n\n500', '000€\n\n\n3 bed.\n104 m²\n6th floor exterior with lift\n\n\nUnique brand new home!\nClikalia puts this 104 m2 exterior property for sale under renovation. It is located on the 6th floor with elevator', ' on Casp street']",calle de Casp,104 m²,6th,with lift,,"Unique brand new home!
Clikalia puts this 104 m2 exterior property for sale under renovation. It is located on the 6th floor with elevator, on Casp street, in Fort Pienc.
Would you like to customize the finishes of this apartment? Visit this house that is being renovated from anywhere through a 3D"
103,Flat,/en/inmueble/100740666/,"690,000€","['\n\n\n\n\n\n\nFlat in avenida Diagonal', "" La Dreta de l'Eixample"", ' Barcelona\n\n\n690', '000€\n\n\n5 bed.\n133 m²\n3rd floor exterior with lift\n\n\nThis 132 m² property to renovate is located on the third floor of a classic-style building dating back to 1955 with a newly renovated façade', ' communal areas and utility installations. The clean appearance of the elegant façade and the bright']",avenida Diagonal,133 m²,3rd,with lift,,"This 132 m² property to renovate is located on the third floor of a classic-style building dating back to 1955 with a newly renovated façade, communal areas and utility installations. The clean appearance of the elegant façade and the bright, chic lobby set the tone for the high-end homes found with"
104,Flat,/en/inmueble/96779380/,"1,200,000€","['\n\n\n\n\n\n\nFlat in calle de la Princesa', ' Sant Pere - Santa Caterina i la Ribera', ' Barcelona\n\n\n1', '200', '000€\n\n\n4 bed.\n239 m²\n1st floor exterior with lift\n\n\nOne-of-a-kind apartment in the most sought after street in Born. This 4-bedroom apartment measures 240 sqm and boasts 4m high ceilings', ' original paintings']",calle de la Pr,239 m²,1st,with lift,,"One-of-a-kind apartment in the most sought after street in Born. This 4-bedroom apartment measures 240 sqm and boasts 4m high ceilings, original paintings, beautiful catalan vaulted ceilings and a stunning open plan day area.
The layout of the apartment is very intuitive and functional. Upon enter"
105,Flat,/en/inmueble/101525932/,"275,000€","['\n\n\n\n\n\n\nFlat in calle de Llagostera', "" El Camp de l'Arpa del Clot"", ' Barcelona\n\n\n275', '000€\n\n\n2 bed.\n59 m²\n4th floor exterior with lift\n\n\nUnique brand new home!\nClikalia puts this 59 m2 exterior property for sale under renovation.It is located on the 4th floor with an elevator being installed', ' on Llagostera street']",calle de Llagostera,59 m²,4th,with lift,,"Unique brand new home!
Clikalia puts this 59 m2 exterior property for sale under renovation.It is located on the 4th floor with an elevator being installed, on Llagostera street, in Camp de l'Arpa del Clot.
Would you like to customize the finishes of this apartment? Visit this house that is being"
106,Detached,/en/inmueble/81345140/,"2,500,000€","[""\n\n\n\n\n\n\nDetached house in calle d'Angel Guimerà"", ' Les Tres Torres', ' Barcelona\n\n\n2', '500', '000€\nParking included\n\n\n2 bed.\n224 m²\n\n\nThis fabulous property is located in one of the most exclusive areas of the city', ' Tres Torres', ' close to services', ' shops', ' parks', ' top schools and restaurants. Being one of the 3 buildings giving the neighbourhood its name']",calle d'Angel Guimerà,224 m²,,,Parking included,"This fabulous property is located in one of the most exclusive areas of the city, Tres Torres, close to services, shops, parks, top schools and restaurants. Being one of the 3 buildings giving the neighbourhood its name, this is a truly emblematic property in the Zona Alta.
Distributed across 2 le"
107,Flat,/en/inmueble/101041993/,"740,000€","['\n\n\n\n\n\n\nFlat in Gran Via de les Corts Catalanes', "" La Dreta de l'Eixample"", ' Barcelona\n\n\n740', '000€\n\n\n3 bed.\n165 m²\n2nd floor exterior with lift\n\n\nStep into this spacious 3-bedroom', ' 2-bathroom property located in the heart of a prime neighbourhood and experience ultimate comfort and convenience. This stunning home boasts a well-distributed floor plan', ' daylight', ' a good orientation']",Gran Via de les Corts Catalanes,165 m²,2nd,with lift,,"Step into this spacious 3-bedroom, 2-bathroom property located in the heart of a prime neighbourhood and experience ultimate comfort and convenience. This stunning home boasts a well-distributed floor plan, daylight, a good orientation, as well as an optional parking space in the same building.
On"
108,Flat,/en/inmueble/100663683/,"795,000€","['\n\n\n\n\n\n\nFlat in Passatge del Patriarca', ' El Gòtic', ' Barcelona\n\n\n795', '000€\n\n\n2 bed.\n109 m²\n3rd floor exterior with lift\n\n\nFully renovated', ' furnished apartment of 109 m² located on the third floor of a fully renovated building on Portal del Angel', ' with its entrance on Passatge Patriarca. It is at the heart of the Gothic neighbourhood', "" on one of the most popular shopping streets in the city. What's more""]",Passatge del Patriarca,109 m²,3rd,with lift,,"Fully renovated, furnished apartment of 109 m² located on the third floor of a fully renovated building on Portal del Angel, with its entrance on Passatge Patriarca. It is at the heart of the Gothic neighbourhood, on one of the most popular shopping streets in the city. What's more, the building boa"
109,Flat,/en/inmueble/101150821/,"1,590,000€","['\n\n\n\n\n\n\nFlat in calle del Bruc', "" La Dreta de l'Eixample"", ' Barcelona\n\n\n1', '590', '000€\n\n\n3 bed.\n187 m²\n5th floor exterior with lift\n\n\nLucas Fox is happy to present this stunning property with breathtaking views of Casa de les Punxes.\nThis exceptional home features three spacious double bedrooms and three uniquely designed bathrooms. The living space is cleverly defined by an open concept kitchen', ' living']",calle del Bruc,187 m²,5th,with lift,,"Lucas Fox is happy to present this stunning property with breathtaking views of Casa de les Punxes.
This exceptional home features three spacious double bedrooms and three uniquely designed bathrooms. The living space is cleverly defined by an open concept kitchen, living, and dining room entirely"
110,Semi-detached,/en/inmueble/100603035/,"4,950,000€","['\n\n\n\n\n\n\nSemi-detached house in calle dels Cavallers', ' Pedralbes', ' Barcelona\n\n\n4', '950', '000€\nParking included\n\n\n5 bed.\n670 m²\n\n\nLucas Fox presents this exceptional detached house in Pedralbes', ' surrounded by private gardens and trees in the heart of Catalan capital.\nThe property', ' from 1989 and with a functional design']",calle dels Cavallers,670 m²,,,Parking included,"Lucas Fox presents this exceptional detached house in Pedralbes, surrounded by private gardens and trees in the heart of Catalan capital.
The property, from 1989 and with a functional design, is divided into four floors and stands out for the luminosity and tranquility of its spacious rooms. In ad"
111,Flat,/en/inmueble/101609480/,"460,000€","['\n\n\n\n\n\n\nFlat in Aragó', "" La Nova Esquerra de l'Eixample"", ' Barcelona\n\n\n460', '000€\nGarage optional 25', '000 €\n\n\n3 bed.\n120 m²\nMezzanine exterior with lift\n\n\nAndor Home offers you this property located on Aragó street', ' crossing Vilamarí street.\nIt has a built area of 120m2', ' distributed in two double rooms and one single room', ' 2 full bathrooms']",Aragó,120 m²,Mezzanine,lift,"Garage optional 25,000 €","Andor Home offers you this property located on Aragó street, crossing Vilamarí street.
It has a built area of 120m2, distributed in two double rooms and one single room, 2 full bathrooms, an independent office-style kitchen and a living-dining room facing the block patio. The property has two interi"
112,Flat,/en/inmueble/99124224/,"405,000€","['\n\n\n\n\n\n\nFlat in calle de Varsòvia', ' El Guinardó', ' Barcelona\n\n\n405', '000€\n\n\n425', '000 €\n\n5%\n\n\n\n3 bed.\n93 m²\n2nd floor exterior with lift\n\n\nThe apartment is located on the 2nd floor of the building', ' being a real 3rd floor with a small balcony', ' as well as a practical and comfortable layout. And on the top floor of the building']",calle de Varsòvia,93 m²,2nd,with lift,,"The apartment is located on the 2nd floor of the building, being a real 3rd floor with a small balcony, as well as a practical and comfortable layout. And on the top floor of the building, a 16 sqm solarium terrace for private use with fantastic views of the city.
We access when entering a large li"
113,Penthouse,/en/inmueble/101090719/,"1,450,000€","['\n\n\n\n\n\n\nPenthouse in calle de Trafalgar', ' Sant Pere - Santa Caterina i la Ribera', ' Barcelona\n\n\n1', '450', '000€\n\n\n2 bed.\n135 m²\n4th floor exterior with lift\n\n\nLocated in one of the most sought-after neighborhoods in the city', ' this apartment features high-quality finishes and modern amenities that will make you feel right at home. With 110 m² of interior space and a 84 m² terrace']",calle de Trafalgar,135 m²,4th,with lift,,"Located in one of the most sought-after neighborhoods in the city, this apartment features high-quality finishes and modern amenities that will make you feel right at home. With 110 m² of interior space and a 84 m² terrace, this apartment is perfect for those looking for a spacious space with lots o"
114,Penthouse,/en/inmueble/97028172/,"5,200,000€","['\n\n\n\n\n\n\nPenthouse in paseo de Sant Joan', "" La Dreta de l'Eixample"", ' Barcelona\n\n\n5', '200', '000€\n\n\n5 bed.\n367 m²\n9th floor exterior with lift\n\n\nThis stunning penthouse hosts 269 m2 distributed across two floors and a turret with 360º exposures. With straight access from the main lift']",paseo de Sant Joan,367 m²,9th,with lift,,"This stunning penthouse hosts 269 m2 distributed across two floors and a turret with 360º exposures. With straight access from the main lift, we walk through a hall that leads to a large central space composed by the living area and a dining room and an access to a terrace at the same level.  A full"
115,Flat,/en/inmueble/100754520/,"1,195,000€","[""\n\n\n\n\n\n\nFlat in calle d'Aribau"", ' Sant Gervasi - Galvany', ' Barcelona\n\n\n1', '195', '000€\n\n\n5 bed.\n226 m²\n4th floor exterior with lift\n\n\nThe flat offers an excellent orientation', ' with sun and natural light. It can be accessed through two entrances', ' the main one and the service one', ' so it can be segregated. The day area is oriented to the street']",calle d'Aribau,226 m²,4th,with lift,,"The flat offers an excellent orientation, with sun and natural light. It can be accessed through two entrances, the main one and the service one, so it can be segregated. The day area is oriented to the street, while the night area overlooks a quiet and spacious courtyard. The apartment has 218 m2 a"
116,Penthouse,/en/inmueble/100678816/,"3,850,000€","['\n\n\n\n\n\n\nPenthouse in calle de Bellesguard', ' Sant Gervasi - La Bonanova', ' Barcelona\n\n\n3', '850', '000€\nParking included\n\n\n4 bed.\n364 m²\n3rd floor exterior with lift\n\n\nThe property consists of 220 m2 built plus a magnificent terrace of 210 m2 that surrounds the entire property. From the kitchen dining room living room', ' we access the largest area of the terrace', ' where we find several independent areas']",calle de Bellesguard,364 m²,3rd,with lift,Parking included,"The property consists of 220 m2 built plus a magnificent terrace of 210 m2 that surrounds the entire property. From the kitchen dining room living room, we access the largest area of the terrace, where we find several independent areas, such as a barbecue-summer dining room area and several chillout"
117,Flat,/en/inmueble/101300670/,"1,650,000€","['\n\n\n\n\n\n\nFlat in calle de Mallorca', "" La Dreta de l'Eixample"", ' Barcelona\n\n\n1', '650', ""000€\n\n\n3 bed.\n202 m²\n1st floor exterior without lift\n\n\nSotheby's International Realty is pleased to present this stately master in one of the best corners of Eixample Dret. The property stands out for its high ceilings"", ' abundant aesthetic details', ' such as moldings and ceilings']",calle de Mallorca,202 m²,1st,without lift,,"Sotheby's International Realty is pleased to present this stately master in one of the best corners of Eixample Dret. The property stands out for its high ceilings, abundant aesthetic details, such as moldings and ceilings, and the Versailles Parquet that can be found in the living room and dining r"
118,Penthouse,/en/inmueble/99250370/,"1,140,000€","['\n\n\n\n\n\n\nPenthouse in calle del Rosselló', "" La Nova Esquerra de l'Eixample"", ' Barcelona\n\n\n1', '140', '000€\nGarage optional 30', ""000 €\n\n\n5 bed.\n179 m²\n7th floor exterior with lift\n\n\nNice duplex penthouse to renovate located in l'Eixample Izquierdo"", ' with 170 m2', ' open and bright. It has five bedrooms (one suite)', ' a large living room with a fireplace that opens onto a 17 m2 terrace with afternoon sun']",calle del Rosselló,179 m²,7th,with lift,"Garage optional 30,000 €","Nice duplex penthouse to renovate located in l'Eixample Izquierdo, with 170 m2, open and bright. It has five bedrooms (one suite), a large living room with a fireplace that opens onto a 17 m2 terrace with afternoon sun, and four bedrooms plus an office.
A small entrance hall gives us access to the"
119,Flat,/en/inmueble/100319450/,"420,000€","[""\n\n\n\n\n\n\nFlat in calle d'Aribau"", ' Sant Gervasi - Galvany', ' Barcelona\n\n\n420', '000€\n\n\n2 bed.\n70 m²\n6th floor exterior with lift\n\n\nWe enter a small entrance hall that leads to the first room with views of the light well. Next', ' we have the kitchen with access to a small utility area where the washing machine and the boiler are located. Before reaching the spacious living room - dining room']",calle d'Aribau,70 m²,6th,with lift,,"We enter a small entrance hall that leads to the first room with views of the light well. Next, we have the kitchen with access to a small utility area where the washing machine and the boiler are located. Before reaching the spacious living room - dining room, we see a good-sized bathroom with a ba"
120,Flat,/en/inmueble/99993952/,"515,000€","[""\n\n\n\n\n\n\nFlat in calle d'Aragó"", ' La Sagrada Família', ' Barcelona\n\n\n515', '000€\nGarage optional 30', '000 €\n\n\n2 bed.\n115 m²\n1st floor interior with lift\n\n\nUpon accessing this apartment of almost 80 m2 and in perfect condition', ' we find a small entrance hall that leads to a modern', ' functional', ' independent', ' fully equipped kitchen and with access to a closed gallery ideal for storage.\nNext']",calle d'Aragó,115 m²,1st,with lift,"Garage optional 30,000 €","Upon accessing this apartment of almost 80 m2 and in perfect condition, we find a small entrance hall that leads to a modern, functional, independent, fully equipped kitchen and with access to a closed gallery ideal for storage.
Next, we see a spacious and cozy living room with direct access to a"
121,Flat,/en/inmueble/101150821/,"1,590,000€","['\n\n\n\n\n\n\nFlat in calle del Bruc', "" La Dreta de l'Eixample"", ' Barcelona\n\n\n1', '590', '000€\n\n\n3 bed.\n187 m²\n5th floor exterior with lift\n\n\nLucas Fox is happy to present this stunning property with breathtaking views of Casa de les Punxes.\nThis exceptional home features three spacious double bedrooms and three uniquely designed bathrooms. The living space is cleverly defined by an open concept kitchen', ' living']",calle del Bruc,187 m²,5th,with lift,,"Lucas Fox is happy to present this stunning property with breathtaking views of Casa de les Punxes.
This exceptional home features three spacious double bedrooms and three uniquely designed bathrooms. The living space is cleverly defined by an open concept kitchen, living, and dining room entirely"
122,Flat,/en/inmueble/101514831/,"580,000€","['\n\n\n\n\n\n\nFlat in via Augusta', ' Sant Gervasi - Galvany', ' Barcelona\n\n\n580', '000€\n\n\n4 bed.\n106 m²\n1st floor exterior with lift\n\n\nUnique brand new home!\nClikalia offers this exterior property of 106 m2 for sale under renovation.It is located on the 1st floor with a lift', ' on Via Augusta street']",via Augusta,106 m²,1st,with lift,,"Unique brand new home!
Clikalia offers this exterior property of 106 m2 for sale under renovation.It is located on the 1st floor with a lift, on Via Augusta street, in Sant Gervasi-Galvany.
Would you like to customize the finishes of this apartment? Visit this house that is being renovated from an"
123,Flat,/en/inmueble/101525932/,"275,000€","['\n\n\n\n\n\n\nFlat in calle de Llagostera', "" El Camp de l'Arpa del Clot"", ' Barcelona\n\n\n275', '000€\n\n\n2 bed.\n59 m²\n4th floor exterior with lift\n\n\nUnique brand new home!\nClikalia puts this 59 m2 exterior property for sale under renovation.It is located on the 4th floor with an elevator being installed', ' on Llagostera street']",calle de Llagostera,59 m²,4th,with lift,,"Unique brand new home!
Clikalia puts this 59 m2 exterior property for sale under renovation.It is located on the 4th floor with an elevator being installed, on Llagostera street, in Camp de l'Arpa del Clot.
Would you like to customize the finishes of this apartment? Visit this house that is being"
124,Penthouse,/en/inmueble/101251587/,"890,000€","['\n\n\n\n\n\n\nPenthouse in calle de Mallorca', "" La Dreta de l'Eixample"", ' Barcelona\n\n\n890', '000€\n\n\n2 bed.\n89 m²\n7th floor exterior with lift\n\n\nAt the crossroads of Carrer Mallorca and Rambla de Catalunya', ' at the heart of the Eixample Right district', ' we find this impressive renovated listed building with a beautiful', ' stately façade. On entering the building']",calle de Mallorca,89 m²,7th,with lift,,"At the crossroads of Carrer Mallorca and Rambla de Catalunya, at the heart of the Eixample Right district, we find this impressive renovated listed building with a beautiful, stately façade. On entering the building, we find an elegant lobby that sets the scene for the high-end homes found within. F"
125,Flat,/en/inmueble/101526625/,"265,000€","['\n\n\n\n\n\n\nFlat in calle de Llagostera', "" El Camp de l'Arpa del Clot"", ' Barcelona\n\n\n265', '000€\n\n\n2 bed.\n56 m²\n2nd floor exterior with lift\n\n\nUnique brand new home!\nClikalia puts this 56 m2 exterior property for sale under renovation.It is located on the 2nd floor with an elevator being installed', ' on Llagostera street']",calle de Llagostera,56 m²,2nd,with lift,,"Unique brand new home!
Clikalia puts this 56 m2 exterior property for sale under renovation.It is located on the 2nd floor with an elevator being installed, on Llagostera street, in the Camp de l'arpa del Clot.
Would you like to customize the finishes of this apartment? Visit this house that is be"
126,Detached,/en/inmueble/81345140/,"2,500,000€","[""\n\n\n\n\n\n\nDetached house in calle d'Angel Guimerà"", ' Les Tres Torres', ' Barcelona\n\n\n2', '500', '000€\nParking included\n\n\n2 bed.\n224 m²\n\n\nThis fabulous property is located in one of the most exclusive areas of the city', ' Tres Torres', ' close to services', ' shops', ' parks', ' top schools and restaurants. Being one of the 3 buildings giving the neighbourhood its name']",calle d'Angel Guimerà,224 m²,,,Parking included,"This fabulous property is located in one of the most exclusive areas of the city, Tres Torres, close to services, shops, parks, top schools and restaurants. Being one of the 3 buildings giving the neighbourhood its name, this is a truly emblematic property in the Zona Alta.
Distributed across 2 le"
127,Flat,/en/inmueble/101313495/,"399,000€","[""\n\n\n\n\n\n\nFlat in calle d'Aragó"", "" La Nova Esquerra de l'Eixample"", ' Barcelona\n\n\n399', '000€\n\n\n3 bed.\n91 m²\n1st floor exterior with lift\n\n\nUnique brand new home!\nClikalia puts this 91 m2 exterior property for sale under renovation.It is located on the 1st floor with a lift', ' on Aragó street']",calle d'Aragó,91 m²,1st,with lift,,"Unique brand new home!
Clikalia puts this 91 m2 exterior property for sale under renovation.It is located on the 1st floor with a lift, on Aragó street, in the new Esquerra de l'Eixample.
The house is being completely renovated and is represented by hyper-realistic images subject to possible modif"
128,Flat,/en/inmueble/100740666/,"690,000€","['\n\n\n\n\n\n\nFlat in avenida Diagonal', "" La Dreta de l'Eixample"", ' Barcelona\n\n\n690', '000€\n\n\n5 bed.\n133 m²\n3rd floor exterior with lift\n\n\nThis 132 m² property to renovate is located on the third floor of a classic-style building dating back to 1955 with a newly renovated façade', ' communal areas and utility installations. The clean appearance of the elegant façade and the bright']",avenida Diagonal,133 m²,3rd,with lift,,"This 132 m² property to renovate is located on the third floor of a classic-style building dating back to 1955 with a newly renovated façade, communal areas and utility installations. The clean appearance of the elegant façade and the bright, chic lobby set the tone for the high-end homes found with"
129,Semi-detached,/en/inmueble/101611957/,"560,000€","['\n\n\n\n\n\n\nSemi-detached house in calle de Besalú', "" El Camp de l'Arpa del Clot"", ' Barcelona\n\n\n560', ""000€\n\n\n4 bed.\n208 m²\n\n\nLa Casa Agency presents an exceptional property for sale in the coveted neighborhood of Camp de l'Arpa.\nThis spacious residence is distributed over two floors and has a large terrace at the top"", ' making it an ideal option for those looking for a home in a privileged location.\nOn the ground floor']",calle de Besalú,208 m²,,,,"La Casa Agency presents an exceptional property for sale in the coveted neighborhood of Camp de l'Arpa.
This spacious residence is distributed over two floors and has a large terrace at the top, making it an ideal option for those looking for a home in a privileged location.
On the ground floor, t"
130,Flat,/en/inmueble/101606595/,"290,000€","['\n\n\n\n\n\n\nFlat in Passatge de Simó', ' Nn', ' La Sagrada Família', ' Barcelona\n\n\n290', '000€\n\n\n2 bed.\n55 m²\n1st floor exterior without lift\n\n\nPROPERTY TO BE COMPLETELY REFORMED WITH TERRACE!\nIn one of the best areas', ' near La Sagrada Familia', ' very close to all kinds of shops', ' Sant Pau hospital', ' schools']",Passatge de Simó,55 m²,1st,without lift,,"PROPERTY TO BE COMPLETELY REFORMED WITH TERRACE!
In one of the best areas, near La Sagrada Familia, very close to all kinds of shops, Sant Pau hospital, schools, CC Les Glorias. Very well connected with line 5 (Blue) and line 2 (Purple) Sagrada Familia stop and with various bus lines.
Farm from 19"
131,Flat,/en/inmueble/100990263/,"1,580,000€","['\n\n\n\n\n\n\nFlat in calle de Roger de Llúria', "" La Dreta de l'Eixample"", ' Barcelona\n\n\n1', '580', '000€\n\n\n1', '620']",calle de Roger de Llúria,200 m²,5th,with lift,,"Wonderful corner property of approximately 200m in a royal estate with the best orientation in the heart of the Eixample.
It is located a few steps from Paseo de Gracia in one of the most beautiful corners of Cuadrado de Oro in Barcelona. It is a property located on one of the top floors of a royal"
