,type,reference,price,district,street,area,rooms,plant,lift,parking,description
0,Flat,/en/inmueble/97934037/,"1,200,000€","[""\n\n\n\n\n\n\nFlat in La Dreta de l'Eixample"", ' Barcelona\n\n\n1', '200', '000€\n\n\n4 bed.\n223 m²\n exterior with lift\n\n\nOn the main floor of a fully restored 1900 building with a valid\xa0 ITE (technical inspection) certificate', ' we find this fantastic home to renovate', ' ideal for creating a new home with large spaces and a 60 m² south-facing terrace according to the plans.\nCurrently']",La Dreta de l'Eixample,223 m²,4 bed.,,,,"On the main floor of a fully restored 1900 building with a valid  ITE (technical inspection) certificate, we find this fantastic home to renovate, ideal for creating a new home with large spaces and a 60 m² south-facing terrace according to the plans.
Currently, the apartment has four good-sized b"
1,Flat,/en/inmueble/99953283/,"440,000€","['\n\n\n\n\n\n\nFlat in calle del Camp', ' Sant Gervasi - Galvany', ' Barcelona\n\n\n440', '000€\n\n\n448', '000 €\n\n2%\n\n\n\n3 bed.\n90 m²\n1st floor exterior with lift\n\n\n90 sqm apartment built', ' according to cadastre', ' in one of the most sought after neighborhoods in Barcelona', ' San Gervasio', ' Galvany. It has a spacious living room with access to a balcony that overlooks Camp street', ' an independent kitchen and two complete bathrooms. It also has three bedrooms']",calle del Camp,90 m²,3 bed.,1st,with lift,,"90 sqm apartment built, according to cadastre, in one of the most sought after neighborhoods in Barcelona, San Gervasio, Galvany. It has a spacious living room with access to a balcony that overlooks Camp street, an independent kitchen and two complete bathrooms. It also has three bedrooms, one of w"
2,Penthouse,/en/inmueble/101154138/,"725,000€","[""\n\n\n\n\n\n\nPenthouse in calle d'Aragó"", "" La Dreta de l'Eixample"", ' Barcelona\n\n\n725', '000€\nParking included\n\n\n750', '000 €\n\n3%\n\n\n\n4 bed.\n135 m²\n6th floor interior with lift\n\n\nDuplex penthouse in Aragó street between Roger de Llúria i Bruc. The first floor consists of a spacious hall', ' a living room with access to a balcony', ' an independent kitchen with a utility room', ' a double bedroom with access to a second balcony']",calle d'Aragó,135 m²,4 bed.,6th,with lift,Parking included,"Duplex penthouse in Aragó street between Roger de Llúria i Bruc. The first floor consists of a spacious hall, a living room with access to a balcony, an independent kitchen with a utility room, a double bedroom with access to a second balcony, three single bedrooms and two complete bathrooms. On the"
3,Flat,/en/inmueble/99113286/,"1,095,000€","[""\n\n\n\n\n\n\nFlat in La Dreta de l'Eixample"", ' Barcelona\n\n\n1', '095', '000€\n\n\n4 bed.\n192 m²\n1st floor exterior with lift\n\n\nMagnificent home in a stately building']",La Dreta de l'Eixample,192 m²,4 bed.,1st,with lift,,"Magnificent home in a stately building, located on one of the most iconic avenues in Barcelona (Avenida Diagonal). It is located a few meters from Pau Claris Street and Paseo de Gracia. The property is located on the first floor of the building with access to a large private terrace and storage room"
4,Penthouse,/en/inmueble/101617808/,"460,000€","['\n\nPenthouse in calle Font den Fargas', ' 64', "" La Font d'En Fargues"", ' Barcelona\n\n\n460', '000€\n\n\n2 bed.\n66 m²\n3rd floor exterior with lift\n\n\nThis completed New Construction is located in the Horta Guinardo District', ' a few steps from the enormous Parc del Guinardo and a few meters from the Horta metro station', ' blue line L5. Close to it we find neighborhood market areas', ' supermarkets', ' leisure area', ' schools']",calle Font den Fargas,66 m²,2 bed.,3rd,with lift,,"This completed New Construction is located in the Horta Guinardo District, a few steps from the enormous Parc del Guinardo and a few meters from the Horta metro station, blue line L5. Close to it we find neighborhood market areas, supermarkets, leisure area, schools, transport and a multitude of ser"
5,Flat,/en/inmueble/100499881/,"1,200,000€","['\n\n\n\n\n\n\nFlat in Sarrià', ' Barcelona\n\n\n1', '200', '000€\nParking included\n\n\n4 bed.\n195 m²\n2nd floor exterior with lift\n\n\nThe property is located in a modern building from 1995', ' the work of the architect Carlos Ferrater', ' which has two elevators', ' a concierge service and community areas', ' as well as a garage on the same building', ' storage rooms and rooms for common use.\nThe property', ' which needs some small renovation']",Sarrià,195 m²,4 bed.,2nd,with lift,Parking included,"The property is located in a modern building from 1995, the work of the architect Carlos Ferrater, which has two elevators, a concierge service and community areas, as well as a garage on the same building, storage rooms and rooms for common use.
The property, which needs some small renovation,"
6,Flat,/en/inmueble/100420061/,"945,000€","[""\n\n\n\n\n\n\nFlat in L'Antiga Esquerra de l'Eixample"", ' Barcelona\n\n\n945', '000€\n\n\n3 bed.\n128 m²\n3rd floor exterior with lift\n\n\nThis bright apartment is located on the third floor of a fully refurbished property with a direct lift to the building. It is ready to move into']",L'Antiga Esquerra de l'Eixample,128 m²,3 bed.,3rd,with lift,,"This bright apartment is located on the third floor of a fully refurbished property with a direct lift to the building. It is ready to move into, since it is in perfect condition and fully equipped thanks to its recent renovation.
The layout of the property differentiates the day area from the nig"
7,Flat,/en/inmueble/99702055/,"1,149,000€","['\n\n\n\n\n\n\nFlat in La Vila Olímpica del Poblenou', ' Barcelona\n\n\n1', '149', '000€\nParking included\n\n\n3 bed.\n174 m²\n3rd floor exterior with lift\n\n\nLucas Fox is pleased to present this property with lots of natural light', ' thanks to its sunny aspect', ' for sale in Vila Olímpica', ' Barcelona', ' an exclusive location.\nIt is an apartment that consists of three bedrooms', ' two of them with private bathrooms']",La Vila Olímpica del Poblenou,174 m²,3 bed.,3rd,with lift,Parking included,"Lucas Fox is pleased to present this property with lots of natural light, thanks to its sunny aspect, for sale in Vila Olímpica, Barcelona, an exclusive location.
It is an apartment that consists of three bedrooms, two of them with private bathrooms, a guest toilet and a living-dining room with an"
8,Flat,/en/inmueble/100984200/,"1,250,000€","[""\n\n\n\n\n\n\nFlat in L'Antiga Esquerra de l'Eixample"", ' Barcelona\n\n\n1', '250', '000€\n\n\n3 bed.\n156 m²\n exterior with lift\n\n\nLucas Fox presents this brand new renovated apartment for sale with 154m2 and a 4m2 balcony', ' according to the plan.\nIt is located on the third floor of a period building with an lift built in the period of Catalan modernism. The apartment has a double orientation']",L'Antiga Esquerra de l'Eixample,156 m²,3 bed.,,,,"Lucas Fox presents this brand new renovated apartment for sale with 154m2 and a 4m2 balcony, according to the plan.
It is located on the third floor of a period building with an lift built in the period of Catalan modernism. The apartment has a double orientation, it has morning sun in the day are"
9,Flat,/en/inmueble/98682172/,"480,000€","[""\n\n\n\n\n\n\nFlat in calle d'Ataülf"", ' El Gòtic', ' Barcelona\n\n\n480', '000€\n\n\n3 bed.\n105 m²\n3rd floor exterior without lift\n\n\nExcellent renovated and bright apartment in Gotic\nFantastic renovated apartment in the Gothic Quarter', ' 105m2 on a second real floor and with three double bedrooms. The original elements such as windows and doors']",calle d'Ataülf,105 m²,3 bed.,3rd,without lift,,"Excellent renovated and bright apartment in Gotic
Fantastic renovated apartment in the Gothic Quarter, 105m2 on a second real floor and with three double bedrooms. The original elements such as windows and doors, hydraulic floors and crafted ceilings with wooden beams have been preserved. The distri"
10,Flat,/en/inmueble/101617771/,"605,000€","['\n\nFlat in calle Font den Fargas', ' 64', "" La Font d'En Fargues"", ' Barcelona\n\n\n605', '000€\n\n\n3 bed.\n79 m²\nGround floor exterior with lift\n\n\nThis completed New Construction is located in the Horta Guinardo District', ' a few steps from the enormous Parc del Guinardo and a few meters from the Horta metro station', ' blue line L5. Close to it we find neighborhood market areas', ' supermarkets', ' leisure area', ' schools']",calle Font den Fargas,79 m²,3 bed.,Ground,with lift,,"This completed New Construction is located in the Horta Guinardo District, a few steps from the enormous Parc del Guinardo and a few meters from the Horta metro station, blue line L5. Close to it we find neighborhood market areas, supermarkets, leisure area, schools, transport and a multitude of ser"
11,Flat,/en/inmueble/96428372/,"880,000€","[""\n\n\n\n\n\n\nFlat in La Dreta de l'Eixample"", ' Barcelona\n\n\n880', '000€\n\n\n2 bed.\n114 m²\n exterior with lift\n\n\nWonderful 110 m² apartment with 2 bedrooms and 2 bathrooms on the top floor of a stately building with concierge service on Rambla de Catalunya', ' in the heart of the city.\nUpon entering the apartment']",La Dreta de l'Eixample,114 m²,2 bed.,,,,"Wonderful 110 m² apartment with 2 bedrooms and 2 bathrooms on the top floor of a stately building with concierge service on Rambla de Catalunya, in the heart of the city.
Upon entering the apartment, an exposed brick hall leads to a bright bedroom with a built-in wardrobe to the left and access to"
12,Flat,/en/inmueble/101617793/,"630,000€","['\n\nFlat in calle Font den Fargas', ' 64', "" La Font d'En Fargues"", ' Barcelona\n\n\n630', '000€\n\n\n3 bed.\n95 m²\n1st floor exterior with lift\n\n\nThis completed New Construction is located in the Horta Guinardo District', ' a few steps from the enormous Parc del Guinardo and a few meters from the Horta metro station', ' blue line L5. Close to it we find neighborhood market areas', ' supermarkets', ' leisure area', ' schools']",calle Font den Fargas,95 m²,3 bed.,1st,with lift,,"This completed New Construction is located in the Horta Guinardo District, a few steps from the enormous Parc del Guinardo and a few meters from the Horta metro station, blue line L5. Close to it we find neighborhood market areas, supermarkets, leisure area, schools, transport and a multitude of ser"
13,Flat,/en/inmueble/101617745/,"435,000€","['\n\nFlat in calle Font den Fargas', ' 64', "" La Font d'En Fargues"", ' Barcelona\n\n\n435', '000€\n\n\n3 bed.\n72 m²\n2nd floor exterior with lift\n\n\nThis completed New Construction is located in the Horta Guinardo District', ' a few steps from the enormous Parc del Guinardo and a few meters from the Horta metro station', ' blue line L5. Close to it we find neighborhood market areas', ' supermarkets', ' leisure area', ' schools']",calle Font den Fargas,72 m²,3 bed.,2nd,with lift,,"This completed New Construction is located in the Horta Guinardo District, a few steps from the enormous Parc del Guinardo and a few meters from the Horta metro station, blue line L5. Close to it we find neighborhood market areas, supermarkets, leisure area, schools, transport and a multitude of ser"
14,Flat,/en/inmueble/100957510/,"890,000€","[""\n\n\n\n\n\n\nFlat in El Camp d'En Grassot i Gràcia Nova"", ' Barcelona\n\n\n890', '000€\n\n\n4 bed.\n184 m²\n with lift\n\n\nMagnificent apartment in the Gràcia Nova neighbourhood (Barcelona)', ' with 184 m² (according to the plan)']",El Camp d'En Grassot i Gràcia Nova,184 m²,4 bed.,,,,"Magnificent apartment in the Gràcia Nova neighbourhood (Barcelona), with 184 m² (according to the plan), four luxurious bedrooms and three bathrooms.
It is located on the tenth floor of a beautiful building from the 70s with a concierge service and a private area for the exclusive use of residents"
15,Detached,/en/inmueble/99099866/,"1,490,000€","['\n\n\n\n\n\n\nDetached house in La Salut', ' Barcelona\n\n\n1', '490', '000€\nParking included\n\n\n5 bed.\n334 m²\n\n\nLucas Fox presents this magnificent property in Gracia', ' with 334 m2 of living space and a 213 m2 garden.\nThe house is divided into three floors', ' plus a cozy loft.\nA spectacular 213 m2 garden welcomes us', ' with natural light and different areas: chill out area']",La Salut,334 m²,5 bed.,,,Parking included,"Lucas Fox presents this magnificent property in Gracia, with 334 m2 of living space and a 213 m2 garden.
The house is divided into three floors, plus a cozy loft.
A spectacular 213 m2 garden welcomes us, with natural light and different areas: chill out area, dining/barbecue area and a small rea"
16,Terraced,/en/inmueble/98498530/,"930,000€","['\n\n\n\n\n\n\nTerraced house in El Putxet i el Farró', ' Barcelona\n\n\n930', '000€\nParking included\n\n\n5 bed.\n263 m²\n\n\nBeautiful semi- semi-detached house located in the beautiful and cozy neighbourhood of Putxet el Farró.\nThis wonderful five-story house with a private lift is located in a very quiet street next to the Putxet railway station.\nOn the street level we find a welcome hall']",El Putxet i el Farró,263 m²,5 bed.,,,Parking included,"Beautiful semi- semi-detached house located in the beautiful and cozy neighbourhood of Putxet el Farró.
This wonderful five-story house with a private lift is located in a very quiet street next to the Putxet railway station.
On the street level we find a welcome hall, the connection to the priv"
17,Penthouse,/en/inmueble/100910324/,"1,100,000€","[""\n\n\n\n\n\n\nPenthouse in L'Antiga Esquerra de l'Eixample"", ' Barcelona\n\n\n1', '100', '000€\n\n\n2 bed.\n102 m²\n exterior with lift\n\n\nThis magnificent penthouse is located on the eighth floor of a building in perfect condition', ' with an elevator and with the ITE in force. The property is completely renovated and has a large garden terrace', ' furnished']",L'Antiga Esquerra de l'Eixample,102 m²,2 bed.,,,,"This magnificent penthouse is located on the eighth floor of a building in perfect condition, with an elevator and with the ITE in force. The property is completely renovated and has a large garden terrace, furnished, with a wooden deck and unobstructed views of much of the city.
The penthouse"
18,Flat,/en/inmueble/97332453/,"585,000€","['\n\n\n\n\n\n\nFlat in Sant Antoni', ' Barcelona\n\n\n585', '000€\n\n\n3 bed.\n126 m²\n1st floor exterior with lift\n\n\nThis recently renovated 116 m² apartment is located on the main floor of a well-preserved building on Carrer Sepúlveda', ' in the Barcelona neighbourhood of Sant Antoni.\nThe apartment enjoys high ceilings of more than 3 metres and has been renovated in a beautiful style', ' with wooden floors']",Sant Antoni,126 m²,3 bed.,1st,with lift,,"This recently renovated 116 m² apartment is located on the main floor of a well-preserved building on Carrer Sepúlveda, in the Barcelona neighbourhood of Sant Antoni.
The apartment enjoys high ceilings of more than 3 metres and has been renovated in a beautiful style, with wooden floors, porcelain"
19,Flat,/en/inmueble/100678806/,"1,395,000€","['\n\n\n\n\n\n\nFlat in El Gòtic', ' Barcelona\n\n\n1', '395']",El Gòtic,336 m²,5 bed.,,,,"This impressive 309 m² house is located on the main floor of a fine listed property with a lift in the heart of Barcelona's Gothic Quarter. It is an old palace that preserves the original architectural elements in perfect condition.
The main floor flat has a separate entrance. It is distributed as"
20,Flat,/en/inmueble/101468258/,"1,195,000€","[""\n\n\n\n\n\n\nFlat in La Dreta de l'Eixample"", ' Barcelona\n\n\n1', '195', '000€\n\n\n3 bed.\n195 m²\n with lift\n\n\nSituated on the tenth floor of the first skyscraper built in Barcelona', ' this spacious property spans approximately 200sqm. As you enter', ' you are welcomed by a living-dining room measuring almost 100sqm']",La Dreta de l'Eixample,195 m²,3 bed.,,,,"Situated on the tenth floor of the first skyscraper built in Barcelona, this spacious property spans approximately 200sqm. As you enter, you are welcomed by a living-dining room measuring almost 100sqm, with access to a small covered balcony overlooking the street. Integrated into the living room is"
21,Flat,/en/inmueble/101605799/,"858,000€","['\n\n\n\n\n\n\nFlat in Pau Claris', "" La Dreta de l'Eixample"", ' Barcelona\n\n\n858', '000€\n\n\n2 bed.\n89 m²\n3rd floor exterior with lift\n\n\nNew construction apartment for sale in Eixample Dreta', "" Barcelona\nMagnificent new construction apartment located in the Quadrat d'or of the Eixample of Barcelona and a few meters from Paseo de Gracia""]",Pau Claris,89 m²,2 bed.,3rd,with lift,,"New construction apartment for sale in Eixample Dreta, Barcelona
Magnificent new construction apartment located in the Quadrat d'or of the Eixample of Barcelona and a few meters from Paseo de Gracia, one of the most luxurious areas of the city.
It consists of 85 m² built housing and 4 m² of terrac"
22,Flat,/en/inmueble/99993986/,"1,499,000€","[""\n\n\n\n\n\n\nFlat in La Dreta de l'Eixample"", ' Barcelona\n\n\n1', '499', '000€\n\n\n3 bed.\n115 m²\n exterior with lift\n\n\nThis magnificent property is located on the fifth royal floor of a rehabilitated period building', ' with an lift and concierge service. It is a completely renovated property']",La Dreta de l'Eixample,115 m²,3 bed.,,,,"This magnificent property is located on the fifth royal floor of a rehabilitated period building, with an lift and concierge service. It is a completely renovated property, with all the comforts and ready to move into.
The property consists of a large and luxurious living room - dining room wit"
23,Flat,/en/inmueble/99671987/,"460,000€","[""\n\n\n\n\n\n\nFlat in L'Antiga Esquerra de l'Eixample"", ' Barcelona\n\n\n460', '000€\n\n\n2 bed.\n66 m²\n1st floor exterior without lift\n\n\nLucas Fox presents this renovated property located a few steps from Avenida Diagonal and Plaza de Francesc Macià.\nIt is located on the main floor of the building', ' so it has high ceilings.\nIn the day area']",L'Antiga Esquerra de l'Eixample,66 m²,2 bed.,1st,without lift,,"Lucas Fox presents this renovated property located a few steps from Avenida Diagonal and Plaza de Francesc Macià.
It is located on the main floor of the building, so it has high ceilings.
In the day area, we find a fully equipped Open kitchen. The dining room living room is exterior and has a sm"
24,Penthouse,/en/inmueble/101614656/,"510,000€","['\n\nPenthouse in calle de Provença', "" El Camp de l'Arpa del Clot"", ' Barcelona\n\n\n510', '000€\n\n\n4 bed.\n94 m²\n9th floor exterior with lift\n\n\nPENTHOUSE OF 94M2 PLUS 16 M2 OF TERRACE', ' 4 BEDROOMS', ' 2 BATHROOMS', ' WITH BEAUTIFUL VIEWS TO THE SEA', ' TORRE AGBAR', ' MONTJUIC', ' SAGRAD FAMILIA!\nIts 94m2 are distributed in a spacious living room outside the terrace with beautiful views', ' very sunny', ' quiet since the house is inside a large block patio']",calle de Provença,94 m²,4 bed.,9th,with lift,,"PENTHOUSE OF 94M2 PLUS 16 M2 OF TERRACE, 4 BEDROOMS, 2 BATHROOMS, WITH BEAUTIFUL VIEWS TO THE SEA, TORRE AGBAR, MONTJUIC, SAGRAD FAMILIA!
Its 94m2 are distributed in a spacious living room outside the terrace with beautiful views, very sunny, quiet since the house is inside a large block patio, the"
25,Flat,/en/inmueble/100984201/,"1,295,000€","[""\n\n\n\n\n\n\nFlat in La Dreta de l'Eixample"", ' Barcelona\n\n\n1', '295', '000€\n\n\n3 bed.\n145 m²\n exterior with lift\n\n\nThis spacious property is located on the main floor of a building building on Rambla de Catalunya with a lift and concierge service. The apartment is completely renovated']",La Dreta de l'Eixample,145 m²,3 bed.,,,,"This spacious property is located on the main floor of a building building on Rambla de Catalunya with a lift and concierge service. The apartment is completely renovated, ready to move into and with beautiful views over the Rambla itself.
The apartment consists of three double bedrooms with ba"
26,Flat,/en/inmueble/101617744/,"440,000€","['\n\nFlat in calle Font den Fargas', ' 64', "" La Font d'En Fargues"", ' Barcelona\n\n\n440', '000€\n\n\n3 bed.\n79 m²\n1st floor exterior with lift\n\n\nThis completed New Construction is located in the Horta Guinardo District', ' a few steps from the enormous Parc del Guinardo and a few meters from the Horta metro station', ' blue line L5. Close to it we find neighborhood market areas', ' supermarkets', ' leisure area', ' schools']",calle Font den Fargas,79 m²,3 bed.,1st,with lift,,"This completed New Construction is located in the Horta Guinardo District, a few steps from the enormous Parc del Guinardo and a few meters from the Horta metro station, blue line L5. Close to it we find neighborhood market areas, supermarkets, leisure area, schools, transport and a multitude of ser"
27,Flat,/en/inmueble/100506418/,"330,000€","['\n\n\n\n\n\n\nFlat in avenida Xile', ' La Maternitat i Sant Ramon', ' Barcelona\n\n\n330', '000€\nParking included\n\n\n350', '000 €\n\n6%\n\n\n\n1 bed.\n65 m²\n6th floor exterior with lift\n\n\nCosy flat located in Barcelona in the neighbourhood of La Maternitat i Sant Ramon', ' located on the sixth floor', ' so it receives a lot of natural light during the whole day.\nIt has 65 sqm m distributed in a spacious hall that gives access to the flat']",avenida Xile,65 m²,1 bed.,6th,with lift,Parking included,"Cosy flat located in Barcelona in the neighbourhood of La Maternitat i Sant Ramon, located on the sixth floor, so it receives a lot of natural light during the whole day.
It has 65 sqm m distributed in a spacious hall that gives access to the flat, followed by a bright living-dining room with open"
28,Flat,/en/inmueble/101610463/,"790,000€","['\n\n\n\n\n\n\nFlat in El Gòtic', ' Barcelona\n\n\n790', '000€\n\n\n3 bed.\n106 m²\n3rd floor exterior with lift\n\n\nGorgeous refurbished flat in Gothic quarter\nLocated in the heart of the Gotic quarter', ' one of the most characterful and booming neighborhoods in Barcelona', ' surrounded by multiple shops and top-quality leisure and restaurant options']",El Gòtic,106 m²,3 bed.,3rd,with lift,,"Gorgeous refurbished flat in Gothic quarter
Located in the heart of the Gotic quarter, one of the most characterful and booming neighborhoods in Barcelona, surrounded by multiple shops and top-quality leisure and restaurant options, as well as very well connected with all kinds of transport with the"
29,Flat,/en/inmueble/99463756/,"106,500€","['\n\n\n\n\n\n\nFlat in calle del Carme', ' El Raval', ' Barcelona\n\n\n106', '500€\n\n\n112', '000 €\n\n5%\n\n\n\n1 bed.\n43 m²\n3rd floor without lift\n\n\nFloor', ' flat total surface area 43 m²', ' double bedrooms: 1', ' 1 bathrooms', ' balcony', ' state of repair: needs remodeling', ' floor no. : 1', ' facing south', ' energy emission rate: E', ' 47', ' energy consumption rate: G']",calle del Carme,43 m²,1 bed.,3rd,lift,,"Floor, flat total surface area 43 m², double bedrooms: 1, 1 bathrooms, balcony, state of repair: needs remodeling, floor no. : 1, facing south, energy emission rate: E, 47, energy consumption rate: G, 281."
30,Flat,/en/inmueble/101610633/,"995,000€","['\n\n\n\n\n\n\nFlat in El Gòtic', ' Barcelona\n\n\n995', '000€\n\n\n3 bed.\n156 m²\n1st floor exterior with lift\n\n\nRefurbished flat with original elements\nLocated in the heart of the Gotic quarter', ' one of the most characterful and booming neighborhoods in Barcelona', ' surrounded by multiple shops and top-quality leisure and restaurant options']",El Gòtic,156 m²,3 bed.,1st,with lift,,"Refurbished flat with original elements
Located in the heart of the Gotic quarter, one of the most characterful and booming neighborhoods in Barcelona, surrounded by multiple shops and top-quality leisure and restaurant options, as well as very well connected with all kinds of transport with the res"
31,Flat,/en/inmueble/101610463/,"790,000€","['\n\n\n\n\n\n\nFlat in El Gòtic', ' Barcelona\n\n\n790', '000€\n\n\n3 bed.\n106 m²\n3rd floor exterior with lift\n\n\nGorgeous refurbished flat in Gothic quarter\nLocated in the heart of the Gotic quarter', ' one of the most characterful and booming neighborhoods in Barcelona', ' surrounded by multiple shops and top-quality leisure and restaurant options']",El Gòtic,106 m²,3 bed.,3rd,with lift,,"Gorgeous refurbished flat in Gothic quarter
Located in the heart of the Gotic quarter, one of the most characterful and booming neighborhoods in Barcelona, surrounded by multiple shops and top-quality leisure and restaurant options, as well as very well connected with all kinds of transport with the"
32,Flat,/en/inmueble/101610383/,"745,000€","['\n\n\n\n\n\n\nFlat in El Gòtic', ' Barcelona\n\n\n745', '000€\n\n\n3 bed.\n106 m²\n1st floor exterior with lift\n\n\nGorgeous refurbished flat in Gothic quarter\nLocated in the heart of the Gotic quarter', ' one of the most characterful and booming neighborhoods in Barcelona', ' surrounded by multiple shops and top-quality leisure and restaurant options']",El Gòtic,106 m²,3 bed.,1st,with lift,,"Gorgeous refurbished flat in Gothic quarter
Located in the heart of the Gotic quarter, one of the most characterful and booming neighborhoods in Barcelona, surrounded by multiple shops and top-quality leisure and restaurant options, as well as very well connected with all kinds of transport with the"
