,type,reference,price,district,street,area,rooms,plant,lift,parking,description
458,Flat,/en/inmueble/100012140/,"660,000€","['\n\nFlat in Diputacion', "" L'Antiga Esquerra de l'Eixample"", ' Barcelona\n\n\n660', '000€\n\n\n3 bed.\n141 m²\nMezzanine exterior with lift\n\n\nFantastic APARTMENT on the first floor in the Eixample neighborhood with TERRACE', ' located on Diputación street with Aribau in Barcelona.\nIt is an apartment that overlooks Diputación street and a very quiet interior patio of the block']",Diputacion,141 m²,3 bed.,Mezzanine,lift,,"Fantastic APARTMENT on the first floor in the Eixample neighborhood with TERRACE, located on Diputación street with Aribau in Barcelona.
It is an apartment that overlooks Diputación street and a very quiet interior patio of the block, with an area of 141.46 m2 distributed in a spacious LIVING-DININ"
459,Flat,/en/inmueble/99966827/,"590,000€","['\n\nFlat in plaza de Sants', ' Sants', ' Barcelona\n\n\n590', '000€\n\n\n5 bed.\n165 m²\n14th floor exterior with lift\n\n\nIn the heart of Sants. Impressive apartment with 5 bedrooms and two bathrooms. Panoramic views', ' totally exterior. Sunny and very bright. Very coherent distribution']",plaza de Sants,165 m²,5 bed.,14th,with lift,,"In the heart of Sants. Impressive apartment with 5 bedrooms and two bathrooms. Panoramic views, totally exterior. Sunny and very bright. Very coherent distribution, with a large hall that leads us to a generous 25m2 living room from which we can access the kitchen and service room that together can"
460,Flat,/en/inmueble/99803688/,"840,000€","['\n\n\n\n\n\n\nFlat in Sarrià', ' Barcelona\n\n\n840', '000€\nParking included\n\n\n5 bed.\n125 m²\n1st floor with lift\n\n\nMAYOR DE SARRIA - SAGRADO CORAZÓN SCHOOL in Living we present this property exclusively. Located in the heart of Sarriá', ' this property reflects the soul of Sarriá', ' its shops', ' its gastronomic offer', "" its schools... so comfortable and peaceful that coming home is... it's a pleasure! 111 m2 useful""]",Sarrià,125 m²,5 bed.,1st,lift,Parking included,"MAYOR DE SARRIA - SAGRADO CORAZÓN SCHOOL in Living we present this property exclusively. Located in the heart of Sarriá, this property reflects the soul of Sarriá, its shops, its gastronomic offer, its schools... so comfortable and peaceful that coming home is... it's a pleasure! 111 m2 useful, good"
461,Flat,/en/inmueble/98356477/,"320,000€","['\n\n\n\n\n\n\nFlat in calle de Mallorca', ' La Sagrada Família', ' Barcelona\n\n\n320', '000€\nGarage optional 40', '000 €\n\n\n329', '000 €\n\n3%\n\n\n\n4 bed.\n82 m²\n5th floor exterior with lift\n\n\nBright apartment near the Sagrada Familia\nIn the Eixample district', ' a few meters from the Sagrada Familia', ' you will find this functional', ' quiet and bright four-bedroom apartment. Its location is just perfect', ' surrounded by essential shops', ' multiple leisure options']",calle de Mallorca,82 m²,4 bed.,5th,with lift,"Garage optional 40,000 €","Bright apartment near the Sagrada Familia
In the Eixample district, a few meters from the Sagrada Familia, you will find this functional, quiet and bright four-bedroom apartment. Its location is just perfect, surrounded by essential shops, multiple leisure options, restaurants and several public tra"
462,Detached,/en/inmueble/99673590/,"660,000€","['\n\nDetached house in Passatge de Núria', ' La Sagrada Família', ' Barcelona\n\n\n660', '000€\n\n\n5 bed.\n145 m²\n\n\nIn a private passageway in the heart of Eixample', ' an unbeatable location.\nHouse with 2 floors of 200m2', ' 157m2 useful plus a 43m2 terrace on two levels.\n5 bedrooms']",Passatge de Núria,145 m²,5 bed.,,,,"In a private passageway in the heart of Eixample, an unbeatable location.
House with 2 floors of 200m2, 157m2 useful plus a 43m2 terrace on two levels.
5 bedrooms, 4 doubles and a dressing room with fitted wardrobes. All rooms have windows to the outside. Double presidential suite with full bathroom"
463,Flat,/en/inmueble/100692923/,"295,355€","['\n\nFlat in calle de Còrsega', "" El Camp de l'Arpa del Clot"", ' Barcelona\n\n\n295', '355€\n\n\n4 bed.\n65 m²\n1st floor exterior with lift\n\n\nLLarcelona sells this fantastic apartment located on the second floor of a beautiful classic building with an elevator.\nThe house is distributed in 3 bedrooms (previously 4)', ' one double with access to a balcony and two singles', ' dining room', ' living room (former bedroom) with access to a balcony']",calle de Còrsega,65 m²,4 bed.,1st,with lift,,"LLarcelona sells this fantastic apartment located on the second floor of a beautiful classic building with an elevator.
The house is distributed in 3 bedrooms (previously 4), one double with access to a balcony and two singles, dining room, living room (former bedroom) with access to a balcony, hall"
464,Flat,/en/inmueble/101620696/,"470,000€","[""\n\nFlat in calle d'Aragó"", "" La Dreta de l'Eixample"", ' Barcelona\n\n\n470', ""000€\n\n\n3 bed.\n79 m²\n6th floor exterior with lift\n\n\nHousing located in the Quadrat d'or"", "" in the dreta de l'eixample.\nIt has a total area of 84 square meters\nSeventh real floor with elevator.\nNatural light all day"", ' since the height of the house and its orientation to the South allow it.\nIt is distributed in 3 rooms']",calle d'Aragó,79 m²,3 bed.,6th,with lift,,"Housing located in the Quadrat d'or, in the dreta de l'eixample.
It has a total area of 84 square meters
Seventh real floor with elevator.
Natural light all day, since the height of the house and its orientation to the South allow it.
It is distributed in 3 rooms, all of them exterior.
Full 4-piece"
465,Penthouse,/en/inmueble/99733525/,"725,000€","['\n\nPenthouse in paseo de Sant Joan', "" El Camp d'En Grassot i Gràcia Nova"", ' Barcelona\n\n\n725', '000€\n\n\n750', '000 €\n\n3%\n\n\n\n3 bed.\n99 m²\n9th floor exterior with lift\n\n\nLocated on one of the most beautiful and sought-after promenades in Barcelona']",paseo de Sant Joan,99 m²,3 bed.,9th,with lift,,"Located on one of the most beautiful and sought-after promenades in Barcelona, we present this exclusive penthouse due to its two level terraces (one currently covered) and its beautiful and unobstructed views of the Sagrada Familia and also Passeig de Sant Joan.
It is located on the ninth floor of"
466,Terraced,/en/inmueble/98889613/,"1,200,000€","['\n\nTerraced house in Rabassada', ' Vallcarca i els Penitents', ' Barcelona\n\n\n1', '200', '000€\nParking included\n\n\n4 bed.\n264 m²\n\n\nMagnificent semi-detached house with a 4-storey garden. On the 1st floor it has an entrance at street level', ' with a large double-height living room with access to the terrace and garden']",Rabassada,264 m²,4 bed.,,,Parking included,"Magnificent semi-detached house with a 4-storey garden. On the 1st floor it has an entrance at street level, with a large double-height living room with access to the terrace and garden, kitchen with access to the dining room and a courtesy bathroom. On the 2nd floor there is a suite room with balco"
467,Penthouse,/en/inmueble/101627262/,"350,000€","['\n\n\n\n\n\n\nPenthouse in Vila de Gràcia', ' Barcelona\n\n\n350', '000€\n\n\n1 bed.\n54 m²\n1st floor exterior without lift\n\n\nPENTHOUSE WITH TWO TERRACES.\n40m2 penthouse that is distributed in a living-dining room with an integrated kitchen with access to the terrace', ' a suite bedroom with a walk-in wardrobe']",Vila de Gràcia,54 m²,1 bed.,1st,without lift,,"PENTHOUSE WITH TWO TERRACES.
40m2 penthouse that is distributed in a living-dining room with an integrated kitchen with access to the terrace, a suite bedroom with a walk-in wardrobe, a bathroom with a shower.
The property has a small closed balcony with gallery.
The apartment has direct access to a"
468,Duplex,/en/inmueble/101392682/,"1,095,000€","['\n\n\n\n\n\n\nDuplex in El Poble Sec - Parc de Montjuïc', ' Barcelona\n\n\n1', '095', '000€\n\n\n5 bed.\n189 m²\n5th floor exterior with lift\n\n\nCENTURY21 WELHOME exclusively sells this unique DUPLEX PENTHOUSE.Framed in the center of Barcelona', ' 5 minutes from Pça.Spain and a 15-minute walk from Pça Catalunya and La Rambla', ' we find this unique piece of its kind\nIt is a house with 5 bedrooms']",El Poble Sec - Parc de Montjuïc,189 m²,5 bed.,5th,with lift,,"CENTURY21 WELHOME exclusively sells this unique DUPLEX PENTHOUSE.Framed in the center of Barcelona, 5 minutes from Pça.Spain and a 15-minute walk from Pça Catalunya and La Rambla, we find this unique piece of its kind
It is a house with 5 bedrooms, 2 bathrooms and 1 toilet.On the lower floor the da"
469,Penthouse,/en/inmueble/100797571/,"195,000€","['\n\nPenthouse in santa rosalia', ' La Teixonera', ' Barcelona\n\n\n195', '000€\n\n\n2 bed.\n65 m²\n4th floor exterior without lift\n\n\nMagnificent Penthouse of 45 M2.\n1 Terrace of 20 M2. + Office on the terrace.\n1 Balcony (adjacent to C/ Cardedeu-Veciana).\nDispose of:\nLiving room.\n2 rooms.\nBathroom with shower.\nKitchen ( Exterior views ).\nAluminum enclosures.\nIt has an alarm', ' security door.\nVery bright.\nFarm in perfect condition']",santa rosalia,65 m²,2 bed.,4th,without lift,,"Magnificent Penthouse of 45 M2.
1 Terrace of 20 M2. + Office on the terrace.
1 Balcony (adjacent to C/ Cardedeu-Veciana).
Dispose of:
Living room.
2 rooms.
Bathroom with shower.
Kitchen ( Exterior views ).
Aluminum enclosures.
It has an alarm, security door.
Very bright.
Farm in perfect condition,"
470,Flat,/en/inmueble/99561116/,"110,000€","['\n\n\n\n\n\n\nFlat in camino de la Verneda', ' La Verneda i la Pau', ' Barcelona\n\n\n110', '000€\n\n\n120', '000 €\n\n8%\n\n\n\n2 bed.\n51 m²\n2nd floor exterior with lift\n\n\nAPARTMENT OCCUPIED BY PERSON WITHOUT FAIR TITLE THIS PROPERTY DUE TO ITS OCCUPATIONAL STATE DOES NOT ALLOW VISITS 51 m² apartment', ' according to Cadastre']",cam,51 m²,2 bed.,2nd,with lift,,"APARTMENT OCCUPIED BY PERSON WITHOUT FAIR TITLE THIS PROPERTY DUE TO ITS OCCUPATIONAL STATE DOES NOT ALLOW VISITS 51 m² apartment, according to Cadastre, distributed in several units. It is a 2nd floor in a block with an elevator. Well connected by public transport and road. There are all kinds of s"
471,Penthouse,/en/inmueble/98287086/,"1,490,000€","['\n\nPenthouse in calle de Guillem Tell', ' Nn', ' El Putxet i el Farró', ' Barcelona\n\n\n1', '490', '000€\n\n\n3 bed.\n169 m²\n4th floor exterior with lift\n\n\nBeautiful apartment of 49m2 built', ' community terrace of 49m2 with swimming pool on the roof of the building and 1 balcony of 4m2. Located on the third floor of a new building in the exclusive neighborhood of Putxet i el Farró']",calle de Guillem Tell,169 m²,3 bed.,4th,with lift,,"Beautiful apartment of 49m2 built, community terrace of 49m2 with swimming pool on the roof of the building and 1 balcony of 4m2. Located on the third floor of a new building in the exclusive neighborhood of Putxet i el Farró, just a few minutes from Plaza Lesseps and Plaza Molina.
This magnificent"
472,Flat,/en/inmueble/101625842/,"652,500€","['\n\n\n\n\n\n\nFlat in calle de Pau Alsina', "" El Camp d'En Grassot i Gràcia Nova"", ' Barcelona\n\n\n652', '500€\n\n\n2 bed.\n116 m²\n1st floor exterior with lift\n\n\nFlat for sale in Barcelona', ' with 1', '249 ft²', ' 2 rooms and 2 bathrooms', ' Storage room']",calle de Pau Als,116 m²,2 bed.,1st,with lift,,"Flat for sale in Barcelona, with 1,249 ft², 2 rooms and 2 bathrooms, Storage room, Lift and Air conditioning."
473,Flat,/en/inmueble/101604431/,"690,000€","['\n\n\n\n\n\n\nFlat in calle de la Fruita', ' El Gòtic', ' Barcelona\n\n\n690']",calle de la Fruita,135 m²,3 bed.,1st,with lift,,"We present this newly renovated apartment in a very quiet street in the emblematic Gothic Quarter.
The property is very spacious and is divided into two areas: day area and night area.
Upon entering we find a large entrance hall that leads to a hallway that leads to a large living room with an ope"
474,Flat,/en/inmueble/100882871/,"535,000€","['\n\n\n\n\n\n\nFlat in avenida de Josep Tarradellas', ' 119', ' Les Corts', ' Barcelona\n\n\n535', '000€\n\n\n3 bed.\n106 m²\n5th floor exterior with lift\n\n\nMagnificent apartment located in the Les Corts district', ' one of the most appreciated neighborhoods in the city', ' where green and quiet areas converge with all kinds of services necessary for day-to-day life such as shops']",avenida de Josep Tarradellas,106 m²,3 bed.,5th,with lift,,"Magnificent apartment located in the Les Corts district, one of the most appreciated neighborhoods in the city, where green and quiet areas converge with all kinds of services necessary for day-to-day life such as shops, restaurants and leisure. It is less than 10 minutes away from areas such as Pla"
475,Flat,/en/inmueble/96509669/,"410,000€","['\n\n\n\n\n\n\nFlat in calle de Sant Elies', ' 1', ' Sant Gervasi - Galvany', ' Barcelona\n\n\n410', '000€\n\n\n4 bed.\n98 m²\nGround floor exterior with lift\n\n\nGround floor apartment in a typical Barcelona royal building next to Plaza Molina.\nThe apartment (renovated) consists of a large outdoor dining room', ' separate kitchen (there is a project to make the kitchen open to the dining room).\n4 rooms']",calle de Sant Elies,98 m²,4 bed.,Ground,with lift,,"Ground floor apartment in a typical Barcelona royal building next to Plaza Molina.
The apartment (renovated) consists of a large outdoor dining room, separate kitchen (there is a project to make the kitchen open to the dining room).
4 rooms, all of them exterior and 2 bathrooms.
Laundry area (to loc"
476,Flat,/en/inmueble/98210897/,"427,250€","['\n\nFlat in calle de Guillem Tell', ' Nn', ' El Putxet i el Farró', ' Barcelona\n\n\n427', '250€\n\n\n1 bed.\n50 m²\n3rd floor exterior with lift\n\n\nBeautiful apartment of 49m2 built', ' community terrace of 49m2 with swimming pool on the roof of the building and 1 balcony of 4m2. Located on the third floor of a new building in the exclusive neighborhood of Putxet i el Farró']",calle de Guillem Tell,50 m²,1 bed.,3rd,with lift,,"Beautiful apartment of 49m2 built, community terrace of 49m2 with swimming pool on the roof of the building and 1 balcony of 4m2. Located on the third floor of a new building in the exclusive neighborhood of Putxet i el Farró, just a few minutes from Plaza Lesseps and Plaza Molina.
This magnificent"
477,Flat,/en/inmueble/101615268/,"315,000€","['\n\nFlat in calle de Chapí', ' Horta', ' Barcelona\n\n\n315', '000€\nParking included\n\n\n2 bed.\n86 m²\nGround floor with lift\n\n\nBright duplex with terrace. Under duplex that you can access directly from Chapí street', ' it is located in a 2003 farm', ' very well preserved. It offers you bright spaces', ' with a very good distribution and use of its spaces. It is an exterior property with neighboring low-rise farms']",calle de Chapí,86 m²,2 bed.,Ground,lift,Parking included,"Bright duplex with terrace. Under duplex that you can access directly from Chapí street, it is located in a 2003 farm, very well preserved. It offers you bright spaces, with a very good distribution and use of its spaces. It is an exterior property with neighboring low-rise farms, both on the façade"
478,Penthouse,/en/inmueble/98512318/,"190,000€","['\n\n\n\n\n\n\nPenthouse in El Carmel', ' Barcelona\n\n\n190', '000€\n\n\n195', '000 €\n\n3%\n\n\n\n3 bed.\n69 m²\n4th floor exterior\n\n\nPENTHOUSE IN C/LUGO WITH LARGE TERRACE. The penthouse that we offer you has 3 rooms on the top floor of the building without neighbors. The 25 m2 terrace has views over all of Barcelona']",El Carmel,69 m²,3 bed.,4th,,,"PENTHOUSE IN C/LUGO WITH LARGE TERRACE. The penthouse that we offer you has 3 rooms on the top floor of the building without neighbors. The 25 m2 terrace has views over all of Barcelona, with a view of the sea. It has a large renovated kitchen. Renovated bathroom. Radiator heating. Parquet floor. Ve"
479,Flat,/en/inmueble/101613384/,"395,000€","['\n\n\n\n\n\n\nFlat in plaza de les Olles', ' Nn', ' Sant Pere - Santa Caterina i la Ribera', ' Barcelona\n\n\n395', ""000€\n\n\n2 bed.\n80 m²\n4th floor \n\n\nBright and completely renovated apartment in a corner building overlooking one of the squares in El Born. It's located in the lower part of Born""]",plaza de les Olles,80 m²,2 bed.,4th,,,"Bright and completely renovated apartment in a corner building overlooking one of the squares in El Born. It's located in the lower part of Born, near the port and the beach.
Charming layout distributed on two levels with a small block of stairs dividing the apartment leaving the living room area w"
480,Penthouse,/en/inmueble/98287086/,"1,490,000€","['\n\nPenthouse in calle de Guillem Tell', ' Nn', ' El Putxet i el Farró', ' Barcelona\n\n\n1', '490', '000€\n\n\n3 bed.\n169 m²\n4th floor exterior with lift\n\n\nBeautiful apartment of 49m2 built', ' community terrace of 49m2 with swimming pool on the roof of the building and 1 balcony of 4m2. Located on the third floor of a new building in the exclusive neighborhood of Putxet i el Farró']",calle de Guillem Tell,169 m²,3 bed.,4th,with lift,,"Beautiful apartment of 49m2 built, community terrace of 49m2 with swimming pool on the roof of the building and 1 balcony of 4m2. Located on the third floor of a new building in the exclusive neighborhood of Putxet i el Farró, just a few minutes from Plaza Lesseps and Plaza Molina.
This magnificent"
481,Penthouse,/en/inmueble/101620690/,"375,000€","['\n\n\n\n\n\n\nPenthouse in calle de la Lleialtat', ' 6', ' El Raval', ' Barcelona\n\n\n375', '000€\n\n\n2 bed.\n78 m²\n5th floor exterior without lift\n\n\nRenovated duplex penthouse with terrace and views over Barcelona. The property is unique', ' design', ' with an extraordinary entrance of natural light. The first floor consists of two bedrooms. One is large', ' loft-style']",calle de la Lleialtat,78 m²,2 bed.,5th,without lift,,"Renovated duplex penthouse with terrace and views over Barcelona. The property is unique, design, with an extraordinary entrance of natural light. The first floor consists of two bedrooms. One is large, loft-style, with a bed on Japanese tatami and with a bookcase and built-in wooden shelves. The se"
482,Flat,/en/inmueble/101625867/,"453,000€","['\n\n\n\n\n\n\nFlat in calle de Finlàndia', ' Sants', ' Barcelona\n\n\n453', '000€\n\n\n2 bed.\n82 m²\n2nd floor exterior with lift\n\n\nFlat for sale in Barcelona', ' with 883 ft²', ' 2 rooms and 2 bathrooms']",calle de F,82 m²,2 bed.,2nd,with lift,,"Flat for sale in Barcelona, with 883 ft², 2 rooms and 2 bathrooms, Furnished and Air conditioning."
483,Flat,/en/inmueble/101611216/,"545,000€","['\n\n\n\n\n\n\nFlat in calle de Nicaragua', ' 52', ' Sants', ' Barcelona\n\n\n545', '000€\nGarage optional 25']",calle de Nicaragua,127 m²,4 bed.,2nd,with lift,"Garage optional 25,000 €","WE PRESENT AN EXCLUSIVE PROPERTY FROM LA TEVA IMMOBILIÀRIA!
Apartment for sale in a beautiful brick building
+ Located on Nicaragua street with Berlin
+ Very well preserved exposed brick farm
+ 2nd real floor height with lots of natural light
+ Three rooms facing the street (living room and two do"
484,Flat,/en/inmueble/100663693/,"1,050,000€","['\n\n\n\n\n\n\nFlat in plaza del Doctor Letamendi', "" L'Antiga Esquerra de l'Eixample"", ' Barcelona\n\n\n1', '050', '000€\n\n\n1', '200', '000 €\n\n13%\n\n\n\n7 bed.\n270 m²\n2nd floor exterior with lift\n\n\nThis impressive property to renovate has an area of 269 m²', ' and currently has seven double bedrooms', ' including the main bedroom', ' three bathrooms and an office with access to the interior gallery']",plaza del Doctor Letamendi,270 m²,7 bed.,2nd,with lift,,"This impressive property to renovate has an area of 269 m², and currently has seven double bedrooms, including the main bedroom, three bathrooms and an office with access to the interior gallery, but the layout can be transformed to adapt to the buyer's lifestyle and personal requirements.
The pro"
485,Flat,/en/inmueble/101559956/,"1,250,000€","['\n\n\n\n\n\n\nFlat in calle de Balmes', ' Sant Gervasi - La Bonanova', ' Barcelona\n\n\n1', '250', '000€\n\n\n4 bed.\n262 m²\n7th floor exterior with lift\n\n\nLucas Fox presents this bright and spacious property.\nThe property is located on the highest floors of the building']",calle de Balmes,262 m²,4 bed.,7th,with lift,,"Lucas Fox presents this bright and spacious property.
The property is located on the highest floors of the building, so its spectacular 19 m 2 terrace has incredible panoramic views of Tibidabo and Barcelona.
The day area is southeast facing and the dining room and living room are glazed to enjo"
486,Flat,/en/inmueble/101537176/,"250,000€","['\n\n\n\n\n\n\nFlat in calle de Guifré', ' El Raval', ' Barcelona\n\n\n250', '000€\nGarage optional 20', '000 €\n\n\n1 bed.\n60 m²\n2nd floor exterior without lift\n\n\nAICAT 7252-Ancora Real Estate\nWE ATTEND REQUESTS BY WHATSAPP.\nFor more information', ' contact our sales team']",calle de Guifré,60 m²,1 bed.,2nd,without lift,"Garage optional 20,000 €","AICAT 7252-Ancora Real Estate
WE ATTEND REQUESTS BY WHATSAPP.
For more information, contact our sales team, we will attend to all requests but we will give priority to those in which we are provided with a contact telephone number.
Visit our private area by accessing through our logo in this adver"
487,Duplex,/en/inmueble/101625215/,"430,000€","['\n\n\n\n\n\n\nDuplex in Arizala', ' La Maternitat i Sant Ramon', ' Barcelona\n\n\n430', '000€\n\n\n450', '000 €\n\n4%\n\n\n\n3 bed.\n105 m²\n8th floor exterior with lift\n\n\nDuplex penthouse with terrace! Andor Home offers you this property located on Arizala street in the La Maternitat-Les Corts neighborhood of Barcelona.\nThe house has 105 m2 built', ' 95 m2 of useful space (50m2 and 45m2)', ' distributed in 3 bedrooms', ' 2 doubles and 1 medium']",Arizala,105 m²,3 bed.,8th,with lift,,"Duplex penthouse with terrace! Andor Home offers you this property located on Arizala street in the La Maternitat-Les Corts neighborhood of Barcelona.
The house has 105 m2 built, 95 m2 of useful space (50m2 and 45m2), distributed in 3 bedrooms, 2 doubles and 1 medium, all exterior and a master bedr"
488,Flat,/en/inmueble/101617415/,"215,000€","['\n\n\n\n\n\n\nFlat in calle del Poeta Cabanyes', ' El Poble Sec - Parc de Montjuïc', ' Barcelona\n\n\n215', '000€\n\n\n2 bed.\n51 m²\n2nd floor exterior without lift\n\n\nUNBEATABLE OPPORTUNITY! Housing in good state of conservation. It has 2 exterior rooms in the Barrio El Poble-sec.\nKitchen', ' balcony and bathroom.\nIts location is a highlight', ' being within walking distance of the Mirador del Poble Sec Park', ' El Molino Barcelona', ' Antic monestir de Sant Pau del Camp']",calle del Poeta Cabanyes,51 m²,2 bed.,2nd,without lift,,"UNBEATABLE OPPORTUNITY! Housing in good state of conservation. It has 2 exterior rooms in the Barrio El Poble-sec.
Kitchen, balcony and bathroom.
Its location is a highlight, being within walking distance of the Mirador del Poble Sec Park, El Molino Barcelona, Antic monestir de Sant Pau del Camp,"
489,Flat,/en/inmueble/101478731/,"585,000€","['\n\n\n\n\n\n\nFlat in calle de Buenos Aires', "" L'Antiga Esquerra de l'Eixample"", ' Barcelona\n\n\n585', '000€\n\n\n4 bed.\n111 m²\n6th floor with lift\n\n\nHigh and bright apartment in Buenos Aires street', ' located on the sixth floor of a building with 2 elevators and concierge service.\nThe house is distributed in a hall', ' 4 bedrooms (3 doubles and 1 single)', ' a spacious living-dining room']",calle de Buenos Aires,111 m²,4 bed.,6th,lift,,"High and bright apartment in Buenos Aires street, located on the sixth floor of a building with 2 elevators and concierge service.
The house is distributed in a hall, 4 bedrooms (3 doubles and 1 single), a spacious living-dining room, an independent kitchen with access to a laundry room and two bath"
490,Flat,/en/inmueble/101083072/,"315,000€","['\n\n\n\n\n\n\nFlat in avenida de Madrid', ' Sants - Badal', ' Barcelona\n\n\n315', '000€\nGarage optional 35', '000 €\n\n\n3 bed.\n96 m²\n1st floor exterior with lift\n\n\nBeautiful apartment located on Avenida de Madrid very close to Avenida de Carlos III', ' in the delimitation area of the neighborhoods of ""Les Corts"" i ""Sants"" and very close of the ""Nou Camp"" of Fútbol Club Barcelona.\nThe flat', ' very well preserved and in perfect condition']",avenida de Madrid,96 m²,3 bed.,1st,with lift,"Garage optional 35,000 €","Beautiful apartment located on Avenida de Madrid very close to Avenida de Carlos III, in the delimitation area of the neighborhoods of ""Les Corts"" i ""Sants"" and very close of the ""Nou Camp"" of Fútbol Club Barcelona.
The flat, very well preserved and in perfect condition, currently has 87 useful m2 a"
491,Flat,/en/inmueble/101556151/,"995,000€","['\n\n\n\n\n\n\nFlat in calle de Mallorca', "" La Dreta de l'Eixample"", ' Barcelona\n\n\n995', '000€\n\n\n4 bed.\n160 m²\n1st floor exterior with lift\n\n\nCharming apartment in the heart of Eixample Right.\nLocated on the principal floor of a stunning classic building dating back to 1920', ' this spacious residence boasts a beautiful entrance and a newly installed lift.\nThe apartment preserves its original features']",calle de Mallorca,160 m²,4 bed.,1st,with lift,,"Charming apartment in the heart of Eixample Right.
Located on the principal floor of a stunning classic building dating back to 1920, this spacious residence boasts a beautiful entrance and a newly installed lift.
The apartment preserves its original features, including high ceilings adorned wit"
