,type,reference,price,district,street,area,rooms,plant,lift,parking,description
656,Flat,/en/inmueble/97585421/,"109,000€","[""\n\n\n\n\n\n\nFlat in avenida d'Escolapi Càncer"", ' Ciutat Meridiana - Torre Baró - Vallbona', ' Barcelona\n\n\n109', ""000€\n\n\n3 bed.\n72 m²\nGround floor exterior without lift\n\n\nThis unfurnished flat is at Avinguda d'Escolapi Càncer"", ' 08033', ' Barcelona', ' Barcelona', ' is in the district of Nou Barris', ' on floor ground floor. It is a sunny flat', ' built in 2004']",avenida d'Escolapi Càncer,72 m²,3 bed.,Ground,without lift,,"This unfurnished flat is at Avinguda d'Escolapi Càncer, 08033, Barcelona, Barcelona, is in the district of Nou Barris, on floor ground floor. It is a sunny flat, built in 2004, that has 72 m2 of which 59 m2 are useful and has 3 rooms and 2 bathrooms.
Watch the property's video at
It includes furnis"
657,Flat,/en/inmueble/92710574/,"235,000€","['\n\nFlat in calle del Carme', ' El Raval', ' Barcelona\n\n\n235', '000€\n\n\n2 bed.\n65 m²\n1st floor interior without lift\n\n\nBeautiful renovated apartment very cozy and quiet', ' a lot of charm', ' located in Carmen Raval alto street', ' it consists of 62 m2', ' a living room with a fully equipped American kitchen (ceramic hob', ' oven', ' dishwasher', ' fridge and washing machine)', ' a double bedroom and a spacious single bedroom']",calle del Carme,65 m²,2 bed.,1st,without lift,,"Beautiful renovated apartment very cozy and quiet, a lot of charm, located in Carmen Raval alto street, it consists of 62 m2, a living room with a fully equipped American kitchen (ceramic hob, oven, dishwasher, fridge and washing machine), a double bedroom and a spacious single bedroom, bathroom wit"
658,Detached,/en/inmueble/99936989/,"1,725,000€","['\n\n\n\n\n\n\nDetached house in calle de Campoamor', ' Horta', ' Barcelona\n\n\n1', '725', '000€\nParking included\n\n\n17 bed.\n668 m²\n\n\nHouse in Campoamor', ' Horta\nBeautiful catalogued house in the best street of Horta with unbeatable views', ' garden', ' outside space for 3 cars']",calle de Campoamor,668 m²,17 bed.,,,Parking included,"House in Campoamor, Horta
Beautiful catalogued house in the best street of Horta with unbeatable views, garden, outside space for 3 cars, outside house currently workshop and lots of character.
Currently the house is divided into four independent floors; two of 180 sqm and 2 smaller; one of 60 sqm a"
659,Flat,/en/inmueble/95464865/,"740,000€","['\n\n\n\n\n\n\nFlat in calle de la Canuda', ' El Gòtic', ' Barcelona\n\n\n740', '000€\n\n\n4 bed.\n195 m²\n3rd floor exterior with lift\n\n\nLarge house with sun and views in Ciutat Vella\nLocated in the heart of the old town in Barcelona', ' with wide views of Plaza Vila de Madrid', ' we offer you a big house to reform of 195m2 in a high-class building well preserved with elevator.\nOriented to Sud and North']",calle de la Canuda,195 m²,4 bed.,3rd,with lift,,"Large house with sun and views in Ciutat Vella
Located in the heart of the old town in Barcelona, with wide views of Plaza Vila de Madrid, we offer you a big house to reform of 195m2 in a high-class building well preserved with elevator.
Oriented to Sud and North, on the third floor with a large bal"
660,Flat,/en/inmueble/101246427/,"750,000€","['\n\n\n\n\n\n\nFlat in calle de Còrsega', "" L'Antiga Esquerra de l'Eixample"", ' Barcelona\n\n\n750', '000€\n\n\n790', '000 €\n\n5%\n\n\n\n4 bed.\n155 m²\n1st floor exterior with lift\n\n\nLarge flat with terrace in Eixample Esquerra\nWe present you a completely refurbished 140sqm property with a 30sqm terrace in the best area of Eixample Esquerra on the 1st floor of a classical building']",calle de Còrsega,155 m²,4 bed.,1st,with lift,,"Large flat with terrace in Eixample Esquerra
We present you a completely refurbished 140sqm property with a 30sqm terrace in the best area of Eixample Esquerra on the 1st floor of a classical building, two blocks from Diagonal Avenue and two block from the very sought-after Enric Granados Street.
Fr"
661,Flat,/en/inmueble/101614307/,"365,000€","[""\n\nFlat in calle d'Escornalbou"", ' El Guinardó', ' Barcelona\n\n\n365', '000€\n\n\n3 bed.\n100 m²\n2nd floor exterior with lift\n\n\nBecause you are special', ' your home should be too.\nSpectacular home for sale\nIt is a very well connected and central area.\nPrice: €365', '000\nThis charming apartment is located on the second floor of a building in the heart of Barcelona']",calle d'Escornalbou,100 m²,3 bed.,2nd,with lift,,"Because you are special, your home should be too.
Spectacular home for sale
It is a very well connected and central area.
Price: €365,000
This charming apartment is located on the second floor of a building in the heart of Barcelona, in an area with easy access to all services.
It is in very good"
662,Flat,/en/inmueble/99711669/,"460,000€","['\n\n\n\n\n\n\nFlat in calle de Casanova', "" L'Antiga Esquerra de l'Eixample"", ' Barcelona\n\n\n460', '000€\n\n\n2 bed.\n63 m²\n1st floor exterior without lift\n\n\nFantastic refurbished flat near Francesc Macià\nFantastic refurbished flat in Finca Regia', ' with original elements very close to Plaça de Francesc Macià']",calle de Casanova,63 m²,2 bed.,1st,without lift,,"Fantastic refurbished flat near Francesc Macià
Fantastic refurbished flat in Finca Regia, with original elements very close to Plaça de Francesc Macià, in one of the best areas for location in the city. This property stands out for its refurbishment in every detail. From the entrance of the flat the"
663,Flat,/en/inmueble/98691779/,"790,000€","['\n\n\n\n\n\n\nFlat in calle del Rosselló', "" La Dreta de l'Eixample"", ' Barcelona\n\n\n790', ""000€\n\n\n3 bed.\n105 m²\n1st floor exterior with lift\n\n\nLocated in the Quadrat d'Or of Barcelona we find this renovated property"", ' exterior']",calle del Rosselló,105 m²,3 bed.,1st,with lift,,"Located in the Quadrat d'Or of Barcelona we find this renovated property, exterior, bright and with 2 balconies overlooking the famous Rambla Catalunya.
In addition to having an excellent location it also has concierge service. This apartment of 105m2 distributed in 3 bedrooms which 2 doubles and o"
664,Detached,/en/inmueble/99936989/,"1,725,000€","['\n\n\n\n\n\n\nDetached house in calle de Campoamor', ' Horta', ' Barcelona\n\n\n1', '725', '000€\nParking included\n\n\n17 bed.\n668 m²\n\n\nHouse in Campoamor', ' Horta\nBeautiful catalogued house in the best street of Horta with unbeatable views', ' garden', ' outside space for 3 cars']",calle de Campoamor,668 m²,17 bed.,,,Parking included,"House in Campoamor, Horta
Beautiful catalogued house in the best street of Horta with unbeatable views, garden, outside space for 3 cars, outside house currently workshop and lots of character.
Currently the house is divided into four independent floors; two of 180 sqm and 2 smaller; one of 60 sqm a"
665,Flat,/en/inmueble/100720693/,"260,000€","['\n\nFlat in plaza del Virrei Amat', ' Vilapicina i la Torre Llobeta', ' Barcelona\n\n\n260', '000€\n\n\n4 bed.\n85 m²\n5th floor exterior with lift\n\n\nApartment located on the corner of the Plaza Virrei Amat itself', ' together with all kinds of shops', ' transport and services. It has an area of about 85 m2 built and has a large balcony. It has 4 rooms (3 of them are of good dimensions and a fourth that is intended for study', ' ironing room. etc)']",plaza del Virrei Amat,85 m²,4 bed.,5th,with lift,,"Apartment located on the corner of the Plaza Virrei Amat itself, together with all kinds of shops, transport and services. It has an area of about 85 m2 built and has a large balcony. It has 4 rooms (3 of them are of good dimensions and a fourth that is intended for study, ironing room. etc), 1 bath"
666,Flat,/en/inmueble/98285241/,"3,600,000€","['\n\n\n\n\n\n\nFlat in calle de Jacinto Benavente', ' Sant Gervasi - Galvany', ' Barcelona\n\n\n3', '600', '000€\nParking included\n\n\n7 bed.\n484 m²\n7th floor exterior without lift\n\n\nExcellent apartment in the exclusive Turó Parc\nWe place this impressive and bright apartment in one of the most privileged residential areas of Barcelona']",calle de Jac,484 m²,7 bed.,7th,without lift,Parking included,"Excellent apartment in the exclusive Turó Parc
We place this impressive and bright apartment in one of the most privileged residential areas of Barcelona, Turó Parc.
We are welcomed to the property by a large hall that separates the day area from the night area. From the hall we enter the large dini"
667,Terraced,/en/inmueble/98394977/,"329,000€","[""\n\n\n\n\n\n\nTerraced house in calle d'Horta"", ' Horta', ' Barcelona\n\n\n329', '000€\n\n\n2 bed.\n95 m²\n\n\nRenovated house next to Plaça Eivissa\nBeautiful 90m2 house on two floors', ' completely renovated', ' brand new']",calle d'Horta,95 m²,2 bed.,,,,"Renovated house next to Plaça Eivissa
Beautiful 90m2 house on two floors, completely renovated, brand new, with two bedrooms and 2 bathrooms
Kitchen equipped with high-end appliances. Pre-installation of Air Conditioning in all rooms and Home Automation.
On the ground floor we find an open room with"
668,Flat,/en/inmueble/100868336/,"249,000€","['\n\nFlat in calle de Pujades', ' El Poblenou', ' Barcelona\n\n\n249', '000€\n\n\n3 bed.\n57 m²\n3rd floor exterior with lift\n\n\nApartment located in the area of Poblenou - Sant Martí', ' Barcelona. It has 57m2 built', ' of which 54m2 are useful. It is distributed in entrance hall', ' living room', ' 3 bedrooms', ' kitchen and a bathroom with bathtub. It is located in a third real', ' in a building built in 1920']",calle de Pujades,57 m²,3 bed.,3rd,with lift,,"Apartment located in the area of Poblenou - Sant Martí, Barcelona. It has 57m2 built, of which 54m2 are useful. It is distributed in entrance hall, living room, 3 bedrooms, kitchen and a bathroom with bathtub. It is located in a third real, in a building built in 1920, which has an elevator. The bui"
669,Flat,/en/inmueble/97112390/,"550,000€","['\n\n\n\n\n\n\nFlat in calle de Berlín', ' Les Corts', ' Barcelona\n\n\n550', '000€\n\n\n4 bed.\n90 m²\n5th floor exterior with lift\n\n\nApartment with large balcony in Les Corts\nVery well distributed and bright apartment of 90 m2 with a large balcony', ' former sixth real floor']",calle de Berlín,90 m²,4 bed.,5th,with lift,,"Apartment with large balcony in Les Corts
Very well distributed and bright apartment of 90 m2 with a large balcony, former sixth real floor, 4 bedrooms and 2 bathrooms in the central area of Les Corts. Upon entering the hall of the property there are two spacious single rooms with a window to the in"
670,Flat,/en/inmueble/101610057/,"219,000€","['\n\nFlat in calle de Blasco de Garay', ' El Poble Sec - Parc de Montjuïc', ' Barcelona\n\n\n219', '000€\n\n\n3 bed.\n90 m²\nGround floor with lift\n\n\nMagnificent apartment of 72 useful square meters in the heart of Poble Sec.It is a mezzanine in a restored farm from 1902 and consists of 3 double rooms and an additional one as a storage room.The modern kitchen', ' in an office format and equipped']",calle de Blasco de Garay,90 m²,3 bed.,Ground,lift,,"Magnificent apartment of 72 useful square meters in the heart of Poble Sec.It is a mezzanine in a restored farm from 1902 and consists of 3 double rooms and an additional one as a storage room.The modern kitchen, in an office format and equipped, is located next to the dining room in the distributor"
671,Flat,/en/inmueble/97367283/,"1,250,000€","['\n\n\n\n\n\n\nFlat in avenida Diagonal', ' Les Corts', ' Barcelona\n\n\n1', '250', '000€\nParking included\n\n\n5 bed.\n215 m²\n7th floor exterior with lift\n\n\nApartment with terrace and parking space in Sarria\nOn Diagonal avenue', ' between Francesc Masia Square and Sarriá Avenue', ' surrounded by shops', ' services', ' parks', ' and with unbeatable communication', ' we locate this large and bright home with wide spaces.\nApartment on the seventh floor']",avenida Diagonal,215 m²,5 bed.,7th,with lift,Parking included,"Apartment with terrace and parking space in Sarria
On Diagonal avenue, between Francesc Masia Square and Sarriá Avenue, surrounded by shops, services, parks, and with unbeatable communication, we locate this large and bright home with wide spaces.
Apartment on the seventh floor, 200sqm with noble a"
672,Flat,/en/inmueble/99851679/,"730,000€","['\n\nFlat in calle de València', "" L'Antiga Esquerra de l'Eixample"", ' Barcelona\n\n\n730', ""000€\n\n\n4 bed.\n178 m²\n2nd floor exterior with lift\n\n\nImpressive flat totally refurbished of 170 m2 (according to the cadastre) located in a classic building of l'Eixample.\nIt has 3 large bedrooms and 1 single bedroom. All of them have wardrobes. The small room and one of the large rooms overlook the interior courtyard. The other two""]",calle de València,178 m²,4 bed.,2nd,with lift,,"Impressive flat totally refurbished of 170 m2 (according to the cadastre) located in a classic building of l'Eixample.
It has 3 large bedrooms and 1 single bedroom. All of them have wardrobes. The small room and one of the large rooms overlook the interior courtyard. The other two, apart from being"
673,Flat,/en/inmueble/93702927/,"1,150,000€","['\n\n\n\n\n\n\nFlat in calle de Pau Claris', "" La Dreta de l'Eixample"", ' Barcelona\n\n\n1', '150', '000€\n\n\n3 bed.\n181 m²\n3rd floor exterior with lift\n\n\nSpectacular renovated apartment in Eixample\nThis magnificent property is situated in a spectacular building from 1900 in the Eixample Dreta. It is a 183 sqm apartment with an exquisite high-quality refurbishment that preserves original elements such as its high ceilings with Catalan volta']",calle de Pau Claris,181 m²,3 bed.,3rd,with lift,,"Spectacular renovated apartment in Eixample
This magnificent property is situated in a spectacular building from 1900 in the Eixample Dreta. It is a 183 sqm apartment with an exquisite high-quality refurbishment that preserves original elements such as its high ceilings with Catalan volta, which pr"
674,Flat,/en/inmueble/95464865/,"740,000€","['\n\n\n\n\n\n\nFlat in calle de la Canuda', ' El Gòtic', ' Barcelona\n\n\n740', '000€\n\n\n4 bed.\n195 m²\n3rd floor exterior with lift\n\n\nLarge house with sun and views in Ciutat Vella\nLocated in the heart of the old town in Barcelona', ' with wide views of Plaza Vila de Madrid', ' we offer you a big house to reform of 195m2 in a high-class building well preserved with elevator.\nOriented to Sud and North']",calle de la Canuda,195 m²,4 bed.,3rd,with lift,,"Large house with sun and views in Ciutat Vella
Located in the heart of the old town in Barcelona, with wide views of Plaza Vila de Madrid, we offer you a big house to reform of 195m2 in a high-class building well preserved with elevator.
Oriented to Sud and North, on the third floor with a large bal"
675,Flat,/en/inmueble/100026242/,"1,300,000€","['\n\n\n\n\n\n\nFlat in rambla de Catalunya', "" La Dreta de l'Eixample"", ' Barcelona\n\n\n1', '300', '000€\n\n\n6 bed.\n211 m²\n exterior with lift\n\n\nExclusive apartment in Rambla de Catalunya\nProperty located next to the exclusive Passeig de Gràcia', ' very close to all services and very well connected to the whole city. This apartment is located in a perfectly preserved Regia estate']",rambla de Catalunya,211 m²,6 bed.,,,,"Exclusive apartment in Rambla de Catalunya
Property located next to the exclusive Passeig de Gràcia, very close to all services and very well connected to the whole city. This apartment is located in a perfectly preserved Regia estate, and has concierge service and elevator.
It has an area of 211 sq"
676,Penthouse,/en/inmueble/89456641/,"435,000€","['\n\n\n\n\n\n\nPenthouse in calle del Consell de Cent', "" La Dreta de l'Eixample"", ' Barcelona\n\n\n435', '000€\nGarage optional 25', '000 €\n\n\n2 bed.\n73 m²\n exterior with lift\n\n\nCharming penthouse with tenants in Eixample Dret. Rented until Nov2025.\nBeautiful penthouse recently refurbished of 60sqm and a 26 sqm terrace.\nRented since November 2020']",calle del Consell de Cent,73 m²,2 bed.,,,"Garage optional 25,000 €","Charming penthouse with tenants in Eixample Dret. Rented until Nov2025.
Beautiful penthouse recently refurbished of 60sqm and a 26 sqm terrace.
Rented since November 2020, it is sold with with tenants.
It is accessed through a hallway with plenty space for cabinets. To the right we find a single bed"
677,Flat,/en/inmueble/100684527/,"890,000€","['\n\n\n\n\n\n\nFlat in calle del Rosselló', "" L'Antiga Esquerra de l'Eixample"", ' Barcelona\n\n\n890', '000€\n\n\n5 bed.\n205 m²\n6th floor exterior with lift\n\n\nBright and large flat in Eixample Esquerra\nWe present you a large property in the best area of Eixample Esquerra on the 6th floor of a classical building']",calle del Rosselló,205 m²,5 bed.,6th,with lift,,"Bright and large flat in Eixample Esquerra
We present you a large property in the best area of Eixample Esquerra on the 6th floor of a classical building, 2 blocks from Diagonal Avenue and one block from the very sought-after Enric Granados Street.
The property has 205sqm with a very optimized squar"
678,Flat,/en/inmueble/97585421/,"109,000€","[""\n\n\n\n\n\n\nFlat in avenida d'Escolapi Càncer"", ' Ciutat Meridiana - Torre Baró - Vallbona', ' Barcelona\n\n\n109', ""000€\n\n\n3 bed.\n72 m²\nGround floor exterior without lift\n\n\nThis unfurnished flat is at Avinguda d'Escolapi Càncer"", ' 08033', ' Barcelona', ' Barcelona', ' is in the district of Nou Barris', ' on floor ground floor. It is a sunny flat', ' built in 2004']",avenida d'Escolapi Càncer,72 m²,3 bed.,Ground,without lift,,"This unfurnished flat is at Avinguda d'Escolapi Càncer, 08033, Barcelona, Barcelona, is in the district of Nou Barris, on floor ground floor. It is a sunny flat, built in 2004, that has 72 m2 of which 59 m2 are useful and has 3 rooms and 2 bathrooms.
Watch the property's video at
It includes furnis"
679,Flat,/en/inmueble/100290546/,"495,000€","['\n\n\n\n\n\n\nFlat in calle de Sanpere i Miquel', ' Horta', ' Barcelona\n\n\n495', '000€\nGarage optional 30', '000 €\n\n\n4 bed.\n110 m²\n1st floor exterior with lift\n\n\nFantastic apartment in the center of Horta\nFantastic apartment in the center of the Horta neighborhood', ' very new construction', ' from the year 2001', ' consisting of 103 sqm of floor space and 5 sqm between three balconies.\nUpon entering the apartment', ' we find a distributor']",calle de Sanpere i Miquel,110 m²,4 bed.,1st,with lift,"Garage optional 30,000 €","Fantastic apartment in the center of Horta
Fantastic apartment in the center of the Horta neighborhood, very new construction, from the year 2001, consisting of 103 sqm of floor space and 5 sqm between three balconies.
Upon entering the apartment, we find a distributor, which gives us access to a la"
680,Flat,/en/inmueble/101128667/,"528,000€","[""\n\n\n\n\n\n\nFlat in calle d'Evarist Arnús"", ' Les Corts', ' Barcelona\n\n\n528', '000€\n\n\n3 bed.\n90 m²\n1st floor exterior with lift\n\n\nModern and spacious Flat in Les Corts\nEngel & Völkers presents this fantastic property with 3 bedrooms with a terrace overlooking the interior of the building', ' 2 complete bathrooms']",calle d'Evarist Arnús,90 m²,3 bed.,1st,with lift,,"Modern and spacious Flat in Les Corts
Engel & Völkers presents this fantastic property with 3 bedrooms with a terrace overlooking the interior of the building, 2 complete bathrooms, a large living-dining room with a large terrace and large windows. It also has a fully equipped kitchen.
The distribut"
681,Penthouse,/en/inmueble/98016761/,"999,000€","['\n\n\n\n\n\n\nPenthouse in calle de Can Segalar', ' Les Corts', ' Barcelona\n\n\n999', '000€\nGarage optional 40', '000 €\n\n\n3 bed.\n110 m²\n6th floor exterior with lift\n\n\nExclusive penthouse with roof-top pool', "" l'Illa Diagonal\nEngel & Völkers presents this exclusive penthouse located in the best area of Les Corts""]",calle de Can Segalar,110 m²,3 bed.,6th,with lift,"Garage optional 40,000 €","Exclusive penthouse with roof-top pool, l'Illa Diagonal
Engel & Völkers presents this exclusive penthouse located in the best area of Les Corts, next to CC L'illa and Diagonal Avenue. Very close to the emblematic area of Les Corts that surrounds Plaza Concordia.
It is a young building with high-end"
682,Flat,/en/inmueble/100884337/,"550,000€","['\n\n\n\n\n\n\nFlat in calle de la Mare de Déu de la Salut', ' La Salut', ' Barcelona\n\n\n550', '000€\nGarage optional 30', '000 €\n\n\n3 bed.\n138 m²\nGround floor exterior without lift\n\n\nModern Triplex in la Salut', ' Gràcia\nLocated in the Salut neighborhood in Gràcia', ' we present this beautiful 138 sqm triplex ground floor that it has been completely renovated with a modern and elegant design.\nOn the +1 floor you will find a very bright double corner room', ' with built-in wardrobes']",calle de la Mare de Déu de la Salut,138 m²,3 bed.,Ground,without lift,"Garage optional 30,000 €","Modern Triplex in la Salut, Gràcia
Located in the Salut neighborhood in Gràcia, we present this beautiful 138 sqm triplex ground floor that it has been completely renovated with a modern and elegant design.
On the +1 floor you will find a very bright double corner room, with built-in wardrobes, a s"
683,Flat,/en/inmueble/101308853/,"1,150,000€","['\n\n\n\n\n\n\nFlat in calle de Ferran Valls i Taberner', ' Sant Gervasi - Galvany', ' Barcelona\n\n\n1', '150', '000€\nParking included\n\n\n1', '250', '000 €\n\n8%\n\n\n\n4 bed.\n205 m²\n3rd floor exterior with lift\n\n\nApartment for sale with parking in Galvany\nBeautiful apartment of 181m2 built for sale in classic and stately estate in the upper part of the Galvany area. \xa0\nElegant entrance hall with toilet from where we can access the rest of the rooms of the house.\nLiving room in two rooms with large windows']",calle de Ferran Valls i Taberner,205 m²,4 bed.,3rd,with lift,Parking included,"Apartment for sale with parking in Galvany
Beautiful apartment of 181m2 built for sale in classic and stately estate in the upper part of the Galvany area.  
Elegant entrance hall with toilet from where we can access the rest of the rooms of the house.
Living room in two rooms with large windows, a"
684,Flat,/en/inmueble/101223692/,"149,000€","['\n\nFlat in calle Sant vicenç', ' El Raval', ' Barcelona\n\n\n149', '000€\n\n\n2 bed.\n41 m²\n3rd floor exterior without lift\n\n\nOccasion for price! To live or as an investment to rent. Next to Ronda Sant Antoni', ' in Sant Vicenç street', ' apartment in a corner building', ' facing the street with a balcony. of 41 m2 useful', ' the apartment is ready to move into', ' regular condition', ' preferable to update it']",calle Sant vicenç,41 m²,2 bed.,3rd,without lift,,"Occasion for price! To live or as an investment to rent. Next to Ronda Sant Antoni, in Sant Vicenç street, apartment in a corner building, facing the street with a balcony. of 41 m2 useful, the apartment is ready to move into, regular condition, preferable to update it, it has two bedrooms (one in a"
685,Flat,/en/inmueble/99017571/,"840,000€","['\n\n\n\n\n\n\nFlat in calle de Josep Anselm Clavé', ' El Gòtic', ' Barcelona\n\n\n840', '000€\n\n\n3 bed.\n176 m²\n3rd floor exterior without lift\n\n\nFantastic property in the Gothic Quarter\nAmazing property of aprox. 176 constructed square meters by Port Vell and Plaça Medinacelli', ' featuring originals elements in perfect conservation status', ' hidraulic flooring', ' carved ceiling', ' high ceiling', ' wide apartment with an amazing amount of natural light']",calle de Josep Anselm Clavé,176 m²,3 bed.,3rd,without lift,,"Fantastic property in the Gothic Quarter
Amazing property of aprox. 176 constructed square meters by Port Vell and Plaça Medinacelli, featuring originals elements in perfect conservation status, hidraulic flooring, carved ceiling, high ceiling, wide apartment with an amazing amount of natural light,"
686,Flat,/en/inmueble/92710574/,"235,000€","['\n\nFlat in calle del Carme', ' El Raval', ' Barcelona\n\n\n235', '000€\n\n\n2 bed.\n65 m²\n1st floor interior without lift\n\n\nBeautiful renovated apartment very cozy and quiet', ' a lot of charm', ' located in Carmen Raval alto street', ' it consists of 62 m2', ' a living room with a fully equipped American kitchen (ceramic hob', ' oven', ' dishwasher', ' fridge and washing machine)', ' a double bedroom and a spacious single bedroom']",calle del Carme,65 m²,2 bed.,1st,without lift,,"Beautiful renovated apartment very cozy and quiet, a lot of charm, located in Carmen Raval alto street, it consists of 62 m2, a living room with a fully equipped American kitchen (ceramic hob, oven, dishwasher, fridge and washing machine), a double bedroom and a spacious single bedroom, bathroom wit"
687,Flat,/en/inmueble/97248421/,"205,000€","['\n\n\n\n\n\n\nFlat in calle de la Noguera Pallaresa', ' La Bordeta', ' Barcelona\n\n\n205', '000€\n\n\n212', '000 €\n\n3%\n\n\n\n4 bed.\n61 m²\nMezzanine interior with lift\n\n\n4 bedroom apartment! 61 m² apartment distributed in living room', ' four bedrooms', ' kitchen', ' bathroom and hall. Ideal for families! It has stoneware floors', ' aluminum windows', ' pine interior doors', ' natural gas heating installation']",calle de la Noguera Pallaresa,61 m²,4 bed.,Mezzanine,lift,,"4 bedroom apartment! 61 m² apartment distributed in living room, four bedrooms, kitchen, bathroom and hall. Ideal for families! It has stoneware floors, aluminum windows, pine interior doors, natural gas heating installation, air conditioning installation... Good general state of conservation. Many"
