,type,reference,price,district,street,area,rooms,plant,lift,parking,description
229,Flat,/en/inmueble/100552012/,"435,000€","['\n\n\n\n\n\n\nFlat in travesía de les Corts', ' Les Corts', ' Barcelona\n\n\n435', '000€\n\n\n450', '000 €\n\n3%\n\n\n\n4 bed.\n89 m²\n2nd floor exterior with lift\n\n\nThis flat is at Travessera de les Corts', ' 08028', ' Barcelona', ' Barcelona', ' is in the district of Les Corts', ' on floor 2. It is a flat', ' built in 1978', ' that has 89 m2 and has 4 rooms and 2 bathrooms.\nBesides', ' it includes terrace', ' luminous']",travesía de les Corts,89 m²,4 bed.,2nd,with lift,,"This flat is at Travessera de les Corts, 08028, Barcelona, Barcelona, is in the district of Les Corts, on floor 2. It is a flat, built in 1978, that has 89 m2 and has 4 rooms and 2 bathrooms.
Besides, it includes terrace, luminous, ascensor and exterior."
230,Flat,/en/inmueble/99815313/,"435,000€","['\n\n\n\n\n\n\nFlat in calle del Comte Borrell', "" La Nova Esquerra de l'Eixample"", ' Barcelona\n\n\n435', '000€\n\n\n445', '000 €\n\n2%\n\n\n\n3 bed.\n101 m²\n7th floor exterior with lift\n\n\nExcellent high floor in Comte Borrell street with Mallorca.\nIt consists of a spacious living-dining room of more than 30 m²', ' 3 bedrooms (previously 4)']",calle del Comte Borrell,101 m²,3 bed.,7th,with lift,,"Excellent high floor in Comte Borrell street with Mallorca.
It consists of a spacious living-dining room of more than 30 m², 3 bedrooms (previously 4), an independent equipped and renovated kitchen; bathroom and courtesy toilet; a small terrace that is accessed from the living room and utility room"
231,Flat,/en/inmueble/101609855/,"650,000€","[""\n\n\n\n\n\n\nFlat in L'Antiga Esquerra de l'Eixample"", ' Barcelona\n\n\n650', '000€\n\n\n4 bed.\n129 m²\n1st floor exterior with lift\n\n\nSpacious and centrally located to refurbish in Eixample\nWe present this flat to reform', ' in one of the most central areas of the city', ' considered by many', ' the heart of Barcelona with a large collection of modernist buildings.\nOn entering we find a spacious hall']",L'Antiga Esquerra de l'Eixample,129 m²,4 bed.,1st,with lift,,"Spacious and centrally located to refurbish in Eixample
We present this flat to reform, in one of the most central areas of the city, considered by many, the heart of Barcelona with a large collection of modernist buildings.
On entering we find a spacious hall, which gives us access to different roo"
232,Flat,/en/inmueble/101602151/,"750,000€","[""\n\n\n\n\n\n\nFlat in avenida d'Icària"", ' La Vila Olímpica del Poblenou', ' Barcelona\n\n\n750', '000€\nParking included\n\n\n4 bed.\n165 m²\n2nd floor exterior with lift\n\n\nMagnificent totally exterior apartment located on Av Icaria', ' one street from the Mapfre towers']",avenida d'Icària,165 m²,4 bed.,2nd,with lift,Parking included,"Magnificent totally exterior apartment located on Av Icaria, one street from the Mapfre towers, Hotel Arts and Puerto Olimpico. It has a community garden and a parking space included in the price. As we enter the apartment we find the hall that leads to a large living room with access to the terrace"
233,Flat,/en/inmueble/101625159/,"527,000€","[""\n\n\n\n\n\n\nFlat in calle d'Aribau"", "" L'Antiga Esquerra de l'Eixample"", ' Barcelona\n\n\n527', '000€\n\n\n4 bed.\n114 m²\n exterior with lift\n\n\nExcellent location a few meters from Av. Diagonal', ' Francesc Maciá and Hospital Clínica.\nThe apartment is located in a pleasant building built in 1966', ' located on a 5th floor in height.\nIt currently has 4 bedrooms', ' 2 full bathrooms', ' 2 multipurpose spaces']",calle d'Aribau,114 m²,4 bed.,,,,"Excellent location a few meters from Av. Diagonal, Francesc Maciá and Hospital Clínica.
The apartment is located in a pleasant building built in 1966, located on a 5th floor in height.
It currently has 4 bedrooms, 2 full bathrooms, 2 multipurpose spaces, a spacious living-dining room with access to"
234,Flat,/en/inmueble/101626156/,"845,000€","['\n\n\n\n\n\n\nFlat in ronda del General Mitre', ' Sant Gervasi - La Bonanova', ' Barcelona\n\n\n845', '000€\n\n\n4 bed.\n178 m²\n6th floor exterior with lift\n\n\nFlat for sale in Barcelona', ' with 1', '916 ft²', ' 4 rooms and 2 bathrooms', ' Storage room', ' Lift']",ronda del General Mitre,178 m²,4 bed.,6th,with lift,,"Flat for sale in Barcelona, with 1,916 ft², 4 rooms and 2 bathrooms, Storage room, Lift, Furnished and Air conditioning."
235,Flat,/en/inmueble/101626803/,"275,000€","['\n\n\n\n\n\n\nFlat in calle de Rosalia de Castro', ' El Baix Guinardó', ' Barcelona\n\n\n275', '000€\n\n\n2 bed.\n76 m²\n exterior with lift\n\n\nGaudí House', ' is pleased to present this incredible apartment in the Hospital Sant Pau.\nThe property consists of a large living room with access to a good balcony with space for tables and chairs.\nThe living room is large and exterior.\nIt consists of 2 rooms']",calle de Rosalia de Castro,76 m²,2 bed.,,,,"Gaudí House, is pleased to present this incredible apartment in the Hospital Sant Pau.
The property consists of a large living room with access to a good balcony with space for tables and chairs.
The living room is large and exterior.
It consists of 2 rooms, one single and one double.
Full bathr"
236,Flat,/en/inmueble/101615219/,"750,000€","[""\n\n\n\n\n\n\nFlat in avenida d'Icària"", ' La Vila Olímpica del Poblenou', ' Barcelona\n\n\n750', '000€\nParking included\n\n\n4 bed.\n165 m²\n2nd floor with lift\n\n\nMagnificent totally exterior apartment located on Av Icaria', ' one street from the Mapfre towers']",avenida d'Icària,165 m²,4 bed.,2nd,lift,Parking included,"Magnificent totally exterior apartment located on Av Icaria, one street from the Mapfre towers, Hotel Arts and Puerto Olimpico. It has a community garden and a parking space included in the price. As we enter the apartment we find the hall that leads to a large living room with access to the terrace"
237,Penthouse,/en/inmueble/101626277/,"475,000€","['\n\n\n\n\n\n\nPenthouse in calle del Consell de Cent', "" La Nova Esquerra de l'Eixample"", ' Barcelona\n\n\n475', '000€\n\n\n2 bed.\n92 m²\n5th floor exterior with lift\n\n\nFANTASTIC PENTHOUSE WITH TERRACE AND LOTS OF NATURAL LIGHT\nIn the heart of the Eixample', ' in a pedestrian street']",calle del Consell de Cent,92 m²,2 bed.,5th,with lift,,"FANTASTIC PENTHOUSE WITH TERRACE AND LOTS OF NATURAL LIGHT
In the heart of the Eixample, in a pedestrian street, we find this magnificent penthouse with many possibilities.
The property is located in a royal estate from the year 1900 with an elevator. It has an area of 66 m2 plus a 22 m2 terrace w"
238,Flat,/en/inmueble/101579901/,"845,000€","[""\n\n\n\n\n\n\nFlat in La Dreta de l'Eixample"", ' Barcelona\n\n\n845', '000€\n\n\n6 bed.\n162 m²\n4th floor exterior with lift\n\n\nExcellent high floor next to Consell de Cent street', ' green and pedestrian axis of the new ""superilla"" of the Eixample. It consists of a spacious living-dining room with access to a partially covered terrace as a gallery', ' facing the block patio; 6 bedrooms', ' of which 3 are doubles; complete bathroom']",La Dreta de l'Eixample,162 m²,6 bed.,4th,with lift,,"Excellent high floor next to Consell de Cent street, green and pedestrian axis of the new ""superilla"" of the Eixample. It consists of a spacious living-dining room with access to a partially covered terrace as a gallery, facing the block patio; 6 bedrooms, of which 3 are doubles; complete bathroom,"
239,Flat,/en/inmueble/100085533/,"1,400,000€","['\n\n\n\n\n\n\nFlat in calle de Roger de Llúria', "" La Dreta de l'Eixample"", ' Barcelona\n\n\n1', '400', '000€\n\n\n12 bed.\n380 m²\n1st floor exterior with lift\n\n\nFantastic property on the first floor of a royal estate with a sunny south orientation', ' in a six-story corner building in excellent condition from 1900', "" in the heart of Quadrat d'Or. Next to Plaza Catalunya and Paseo de Gracia""]",calle de Roger de Llúria,380 m²,12 bed.,1st,with lift,,"Fantastic property on the first floor of a royal estate with a sunny south orientation, in a six-story corner building in excellent condition from 1900, in the heart of Quadrat d'Or. Next to Plaza Catalunya and Paseo de Gracia, currently used as a law firm with a classic and representative corporate"
240,Flat,/en/inmueble/101626156/,"845,000€","['\n\n\n\n\n\n\nFlat in ronda del General Mitre', ' Sant Gervasi - La Bonanova', ' Barcelona\n\n\n845', '000€\n\n\n4 bed.\n178 m²\n6th floor exterior with lift\n\n\nFlat for sale in Barcelona', ' with 1', '916 ft²', ' 4 rooms and 2 bathrooms', ' Storage room', ' Lift']",ronda del General Mitre,178 m²,4 bed.,6th,with lift,,"Flat for sale in Barcelona, with 1,916 ft², 4 rooms and 2 bathrooms, Storage room, Lift, Furnished and Air conditioning."
241,Penthouse,/en/inmueble/101626277/,"475,000€","['\n\n\n\n\n\n\nPenthouse in calle del Consell de Cent', "" La Nova Esquerra de l'Eixample"", ' Barcelona\n\n\n475', '000€\n\n\n2 bed.\n92 m²\n5th floor exterior with lift\n\n\nFANTASTIC PENTHOUSE WITH TERRACE AND LOTS OF NATURAL LIGHT\nIn the heart of the Eixample', ' in a pedestrian street']",calle del Consell de Cent,92 m²,2 bed.,5th,with lift,,"FANTASTIC PENTHOUSE WITH TERRACE AND LOTS OF NATURAL LIGHT
In the heart of the Eixample, in a pedestrian street, we find this magnificent penthouse with many possibilities.
The property is located in a royal estate from the year 1900 with an elevator. It has an area of 66 m2 plus a 22 m2 terrace w"
242,Flat,/en/inmueble/99544660/,"190,000€","['\n\n\n\n\n\n\nFlat in La Salut', ' Barcelona\n\n\n190', '000€\n\n\n199', '000 €\n\n5%\n\n\n\n2 bed.\n58 m²\nGround floor exterior without lift\n\n\nTotally exterior apartment', ' for sale in the Gracia neighborhood.\nIt consists of 58m2 distributed in 2 double bedrooms', ' a living room', ' an independent kitchen fully furnished and equipped with electrical appliances', ' a complete bathroom with a shower tray and a hydromassage bathtub']",La Salut,58 m²,2 bed.,Ground,without lift,,"Totally exterior apartment, for sale in the Gracia neighborhood.
It consists of 58m2 distributed in 2 double bedrooms, a living room, an independent kitchen fully furnished and equipped with electrical appliances, a complete bathroom with a shower tray and a hydromassage bathtub, and a laundry room"
243,Penthouse,/en/inmueble/101626143/,"1,090,000€","['\n\n\n\n\n\n\nPenthouse in calle Francesc Pérez Cabrero', ' Sant Gervasi - Galvany', ' Barcelona\n\n\n1', '090', '000€\n\n\n3 bed.\n150 m²\n8th floor exterior with lift\n\n\nFANTASTIC PENTHOUSE WITH LOTS OF LIGHT IN EL TURO PARK\nThis is a great opportunity to reform a penthouse to taste in Turo Park', ' one of the most prestigious areas of Barcelona.\nLocated in a high standing estate', ' with a concierge service', ' the property has 150 m2 built']",calle Francesc Pérez Cabrero,150 m²,3 bed.,8th,with lift,,"FANTASTIC PENTHOUSE WITH LOTS OF LIGHT IN EL TURO PARK
This is a great opportunity to reform a penthouse to taste in Turo Park, one of the most prestigious areas of Barcelona.
Located in a high standing estate, with a concierge service, the property has 150 m2 built, of which 25 belong to a beauti"
244,Flat,/en/inmueble/101153903/,"399,000€","['\n\n\n\n\n\n\nFlat in calle de Provença', "" La Nova Esquerra de l'Eixample"", ' Barcelona\n\n\n399', ""000€\n\n\n3 bed.\n75 m²\n3rd floor exterior with lift\n\n\nHigh floor with balcony in l'Esquerra de l'Eixample"", ' for sale\nLocated in one of the best areas of Barcelona', "" such as l'Esquerra de l'Eixample"", ' we find this wonderful apartment', ' in a classic building on Provenza street.\nIn a third of real height', ' this house of 74.5m² built']",calle de Provença,75 m²,3 bed.,3rd,with lift,,"High floor with balcony in l'Esquerra de l'Eixample, for sale
Located in one of the best areas of Barcelona, such as l'Esquerra de l'Eixample, we find this wonderful apartment, in a classic building on Provenza street.
In a third of real height, this house of 74.5m² built, consists of a living-din"
245,Flat,/en/inmueble/101200851/,"395,000€","['\n\n\n\n\n\n\nFlat in calle de Provença', "" La Nova Esquerra de l'Eixample"", ' Barcelona\n\n\n395']",calle de Provença,89 m²,3 bed.,5th,with lift,,We are pleased to present an apartment with 3 bedrooms and 1 bathroom to be completely renovated. Welll located two minutes walking distance from the Escola Industrial and 9 minutes from the Hospital Clinic. It is an apartment of 89 m2 built and 69.50 m2 useful. It is a fifth floor with light. It ha
246,Flat,/en/inmueble/98823335/,"3,700,000€","['\n\n\n\n\n\n\nFlat in paseo de Gràcia', "" La Dreta de l'Eixample"", ' Barcelona\n\n\n3', '700', '000€\nParking included\n\n\n4 bed.\n274 m²\n5th floor exterior with lift\n\n\nMajestic 274m2 apartment in a stately building in the heart of Paseo de Gracia\n\n\nIn the most emblematic and fascinating street of Barcelona we find this very spacious and totally exterior property.\nIt consists of a cadastral area of 274 m2', ' distributed in a spacious 75 m2 living room']",paseo de Gràcia,274 m²,4 bed.,5th,with lift,Parking included,"Majestic 274m2 apartment in a stately building in the heart of Paseo de Gracia


In the most emblematic and fascinating street of Barcelona we find this very spacious and totally exterior property.
It consists of a cadastral area of 274 m2, distributed in a spacious 75 m2 living room, an exterior room with natural light to put a large office or reading room with views of Paseo"
247,Flat,/en/inmueble/101110082/,"109,000€","['\n\nFlat in calle de la Mare Eterna', ' El Bon Pastor', ' Barcelona\n\n\n109', '000€\n\n\n137', '500 €\n\n21%\n\n\n\n2 bed.\n58 m²\n2nd floor exterior with lift\n\n\nBeautiful apartment with elevator in Carrer Batllori. It has 58 square meters distributed in 2 rooms (one double) and a nice full bathroom. In addition', ' the house has a beautiful and bright living-dining room with access to a kitchen equipped with an oven']",calle de la Mare Eterna,58 m²,2 bed.,2nd,with lift,,"Beautiful apartment with elevator in Carrer Batllori. It has 58 square meters distributed in 2 rooms (one double) and a nice full bathroom. In addition, the house has a beautiful and bright living-dining room with access to a kitchen equipped with an oven, ceramic hob and a brand new extractor hood."
248,Semi-detached,/en/inmueble/96238263/,"2,400,000€","['\n\n\n\n\n\n\nSemi-detached house in calle del Camp', ' Sant Gervasi - La Bonanova', ' Barcelona\n\n\n2', '400', '000€\nParking included\n\n\n2', '950', '000 €\n\n19%\n\n\n\n6 bed.\n496 m²\n\n\nIn one of the most demanded areas of Barcelona', ' near Mandri street and Bonanova promenade', ' we find this unique property for its location. It is in one of the best and exclusive residential areas of the city']",calle del Camp,496 m²,6 bed.,,,Parking included,"In one of the most demanded areas of Barcelona, near Mandri street and Bonanova promenade, we find this unique property for its location. It is in one of the best and exclusive residential areas of the city, close to all kinds of services.
The house has 1031m² built distributed in six floors with e"
249,Flat,/en/inmueble/101618969/,"315,000€","['\n\nFlat in calle de València', ' 474', ' La Sagrada Família', ' Barcelona\n\n\n315', '000€\n\n\n4 bed.\n80 m²\n1st floor exterior with lift\n\n\nWe present this great sales opportunity in Calle Valencia', ' next to Sagrada Familia.\nThis house is located in one of the best areas of the city', ' with a perfect combination of public transport: TMB buses from Barcelona and metro L2 and L5.\nThe apartment is south facing', ' quiet and bright']",calle de València,80 m²,4 bed.,1st,with lift,,"We present this great sales opportunity in Calle Valencia, next to Sagrada Familia.
This house is located in one of the best areas of the city, with a perfect combination of public transport: TMB buses from Barcelona and metro L2 and L5.
The apartment is south facing, quiet and bright, it overlook"
250,Flat,/en/inmueble/99548320/,"845,000€","['\n\n\n\n\n\n\nFlat in calle de Muntaner', ' 411', ' Sant Gervasi - Galvany', ' Barcelona\n\n\n845', '000€\n\n\n6 bed.\n224 m²\n1st floor exterior with lift\n\n\nExclusive apartment located in Galvany', ' one of the most sought after and valued areas in Sarria / Sant Gervasi.\nThe house is located in a classic and beautiful building from 1936 with high architectural value recently restored', ' equipped with a spacious and stately hall']",calle de Muntaner,224 m²,6 bed.,1st,with lift,,"Exclusive apartment located in Galvany, one of the most sought after and valued areas in Sarria / Sant Gervasi.
The house is located in a classic and beautiful building from 1936 with high architectural value recently restored, equipped with a spacious and stately hall, which preserves the classic e"
251,Flat,/en/inmueble/101607521/,"750,000€","[""\n\n\n\n\n\n\nFlat in avenida d'Icària"", ' La Vila Olímpica del Poblenou', ' Barcelona\n\n\n750', '000€\n\n\n4 bed.\n165 m²\n2nd floor with lift\n\n\nReference: 141CAPI_INMO_00717_ Magnificent totally exterior apartment located on Av Icaria one street from the Mapfre towers']",avenida d'Icària,165 m²,4 bed.,2nd,lift,,"Reference: 141CAPI_INMO_00717_ Magnificent totally exterior apartment located on Av Icaria one street from the Mapfre towers, Arts hotel and Olympic port has a community garden and a parking space included in the price. As we enter the apartment we find the hall that leads to a large living room wit"
252,Penthouse,/en/inmueble/100023531/,"549,000€","['\n\n\n\n\n\n\nPenthouse in canuda', ' El Gòtic', ' Barcelona\n\n\n549', '000€\n\n\n2 bed.\n95 m²\n5th floor exterior with lift\n\n\nExclusive high standing penthouse in the\nBarcelona Gothic. This spectacular property']",canuda,95 m²,2 bed.,5th,with lift,,"Exclusive high standing penthouse in the
Barcelona Gothic. This spectacular property, apart from having
with a 30m2 terrace consists of the following characteristics:
From the entrance and to the left
there is a nice open kitchen fully equipped with
American Bar.
Continuing to the left
find the liv"
253,Flat,/en/inmueble/99932549/,"750,000€","['\n\n\n\n\n\n\nFlat in calle Ample', ' El Gòtic', ' Barcelona\n\n\n750', '000€\n\n\n3 bed.\n97 m²\n2nd floor exterior without lift\n\n\nBeautiful apartment in the emblematic Gothic quarter of Barcelona.\nThis exclusive furnished property has the following characteristics:\n2 balconies', ' one of which has a vintage table and chairs set\n3 bedrooms', ' two doubles and one single']",calle Ample,97 m²,3 bed.,2nd,without lift,,"Beautiful apartment in the emblematic Gothic quarter of Barcelona.
This exclusive furnished property has the following characteristics:
2 balconies, one of which has a vintage table and chairs set
3 bedrooms, two doubles and one single, perfectly adapted for an office.
2 completely renovated high s"
254,Penthouse,/en/inmueble/100991554/,"1,100,000€","['\n\n\n\n\n\n\nPenthouse in calle del Rosselló', ' La Sagrada Família', ' Barcelona\n\n\n1', '100', '000€\nParking included\n\n\n4 bed.\n237 m²\n8th floor exterior with lift\n\n\nRosselló – Estrella Damm. Bright corner penthouse with sun all day', ' views of the entire city', ' 50m2 terrace and 70m2 solarium. A few minutes from the Temple of the Sagrada Familia']",calle del Rosselló,237 m²,4 bed.,8th,with lift,Parking included,"Rosselló – Estrella Damm. Bright corner penthouse with sun all day, views of the entire city, 50m2 terrace and 70m2 solarium. A few minutes from the Temple of the Sagrada Familia, in front of the multipurpose space - Estrella Damm Museum.
The 109 m2 useful house is distributed in a spacious living"
255,Flat,/en/inmueble/96442466/,"655,000€","['\n\n\n\n\n\n\nFlat in calle de Provença', "" La Dreta de l'Eixample"", ' Barcelona\n\n\n655', ""000€\n\n\n2 bed.\n102 m²\n3rd floor exterior with lift\n\n\nCarrer PROVENÇA- Together Passeig de Gràcia (La Pedrera) and Pau Claris-\nThe heart of L'Eixample"", ' an area known as the ""Quadrat d\'Or"".\nFantastic house outside the typical and sunny block patio of L\'Eixample', ' distributed in a spacious living-dining room', ' 2 bedrooms', ' 2 full bathrooms', ' kitchen']",calle de Provença,102 m²,2 bed.,3rd,with lift,,"Carrer PROVENÇA- Together Passeig de Gràcia (La Pedrera) and Pau Claris-
The heart of L'Eixample, an area known as the ""Quadrat d'Or"".
Fantastic house outside the typical and sunny block patio of L'Eixample, distributed in a spacious living-dining room, 2 bedrooms, 2 full bathrooms, kitchen, laundry"
256,Flat,/en/inmueble/101129211/,"645,000€","['\n\n\n\n\n\n\nFlat in calle de Praga', ' El Baix Guinardó', ' Barcelona\n\n\n645', '000€\n\n\n4 bed.\n156 m²\n without lift\n\n\nEvery week we get a lot of apartments and they all have something different and special that I love.In this case', "" I couldn't stay with just one thing.The patio with the plants"", ' the natural light', ' the modernity of all the rooms And', ' also', ' very close to the Parc de les Aiguees']",calle de Praga,156 m²,4 bed.,,,,"Every week we get a lot of apartments and they all have something different and special that I love.In this case, I couldn't stay with just one thing.The patio with the plants, the natural light, the modernity of all the rooms And, also, very close to the Parc de les Aiguees, the Parc Gueell and the"
257,Flat,/en/inmueble/101186056/,"360,000€","['\n\n\n\n\n\n\nFlat in calle de la Font del Coll', ' El Coll', ' Barcelona\n\n\n360', '000€\n\n\n3 bed.\n95 m²\n1st floor exterior with lift\n\n\nFloor 1st', ' flat total surface area 114 m²', ' usable floor area 91 m²', ' single bedrooms: 2', ' double bedrooms: 1', ' double bedrooms are ensuite: 1', ' 2 bathrooms', ' wheelchair-friendly', ' air conditioning (hot and cold)', ' age between 20 and 30 years', ' built-in wardrobes', ' lift', ' balcony', ' heating (electric)', ' kitchen']",calle de la Font del Coll,95 m²,3 bed.,1st,with lift,,"Floor 1st, flat total surface area 114 m², usable floor area 91 m², single bedrooms: 2, double bedrooms: 1, double bedrooms are ensuite: 1, 2 bathrooms, wheelchair-friendly, air conditioning (hot and cold), age between 20 and 30 years, built-in wardrobes, lift, balcony, heating (electric), kitchen,"
258,Flat,/en/inmueble/100478209/,"269,000€","['\n\n\n\n\n\n\nFlat in calle de Sant Antoni Maria Claret', ' Navas', ' Barcelona\n\n\n269', '000€\n\n\n3 bed.\n73 m²\n1st floor with lift\n\n\nFantastic apartment next to Av. Meridiana. It is a house with an area of 73sqm', ' renovated and ready to move into. It is distributed in a spacious dining room with access to a balcony', ' an independent kitchen', ' a utility area', ' a complete bathroom with a shower and three bedrooms']",calle de Sant Antoni Maria Claret,73 m²,3 bed.,1st,lift,,"Fantastic apartment next to Av. Meridiana. It is a house with an area of 73sqm, renovated and ready to move into. It is distributed in a spacious dining room with access to a balcony, an independent kitchen, a utility area, a complete bathroom with a shower and three bedrooms, two of them double. Th"
259,Penthouse,/en/inmueble/100799095/,"850,000€","[""\n\n\n\n\n\n\nPenthouse in calle de l'Abat Samsó"", ' Sarrià', ' Barcelona\n\n\n850', '000€\nParking included\n\n\n3 bed.\n140 m²\n6th floor exterior with lift\n\n\nWe are very used to seeing flats of all kinds: small', ' large', ' decorated', ' empty', ' in different areas... And', ' even so', ' there are always nests that manage to surprise me. Like this one', ' for example', ' with a terrace with views of the mountains and the city']",calle de l'Abat Samsó,140 m²,3 bed.,6th,with lift,Parking included,"We are very used to seeing flats of all kinds: small, large, decorated, empty, in different areas... And, even so, there are always nests that manage to surprise me. Like this one, for example, with a terrace with views of the mountains and the city, which I thought was a beautiful space to fill wit"
260,Flat,/en/inmueble/101159733/,"598,250€","['\n\n\n\n\n\n\nFlat in calle de Guillem Tell', ' El Putxet i el Farró', ' Barcelona\n\n\n598', '250€\n\n\n2 bed.\n166 m²\nGround floor exterior with lift\n\n\nImpressive oasis in the middle of the upper area of Barcelona in the form of a home', ' a wonderful brand new ground floor with a large 110m2 private terrace', ' high ceilings of approximately 4 m', ' located in the lower area of Sant Gervasi', ' El Farró']",calle de Guillem Tell,166 m²,2 bed.,Ground,with lift,,"Impressive oasis in the middle of the upper area of Barcelona in the form of a home, a wonderful brand new ground floor with a large 110m2 private terrace, high ceilings of approximately 4 m, located in the lower area of Sant Gervasi, El Farró, very close of grace.
This property that we are offering"
261,Flat,/en/inmueble/101609979/,"315,000€","['\n\n\n\n\n\n\nFlat in Valencia', ' 474', ' La Sagrada Família', ' Barcelona\n\n\n315', '000€\n\n\n4 bed.\n80 m²\n1st floor exterior with lift\n\n\nc/Valencia - Sagrada Familia The house has an area of 80m2 built and 71 useful according to cadastre', ' currently distributed in 4 bedrooms', ' kitchen with access to laundry room', ' bathroom and living room with access to the terrace. South facing', ' quiet and bright']",Valencia,80 m²,4 bed.,1st,with lift,,"c/Valencia - Sagrada Familia The house has an area of 80m2 built and 71 useful according to cadastre, currently distributed in 4 bedrooms, kitchen with access to laundry room, bathroom and living room with access to the terrace. South facing, quiet and bright, facing a large inner courtyard of the b"
